,book,chapt,version,text
2750,LUK,9,TCL02,elciler geri donunce yaptiklari her seyi isaya anlattilar sonra isa yalnizca onlari yanina alip beytsayda denilen bir kente cekildi
2751,LUK,9,TCL02,bunu ogrenen halk onun ardindan gitti isa onlari ilgiyle karsiladi kendilerine tanrinin egemenliginden soz etti ve sifaya ihtiyaci olanlari iyilestirdi
2752,LUK,9,TCL02,gunbatimina dogru onikiler gelip ona halki saliver de cevredeki koylere ve ciftliklere gidip kendilerine barinak ve yiyecek bulsunlar cunku issiz bir yerdeyiz dediler
2753,LUK,9,TCL02,isa onlara siz yiyecek verin dedi
2754,LUK,9,TCL02,bes ekmekle iki baliktan baska bir seyimiz yok dediler yoksa bunca halk icin yiyecek almaya biz mi gidelim
2755,LUK,9,TCL02,orada yaklasik bes bin erkek vardi
2756,LUK,9,TCL02,isa ogrencilerine halki yaklasik elliser kisilik kumeler halinde yere oturtun dedi
2757,LUK,9,TCL02,ogrenciler oyle yapip herkesi yere oturttular
2758,LUK,9,TCL02,isa bes ekmekle iki baligi aldi gozlerini goge kaldirarak sukretti sonra bunlari boldu ve halka dagitmalari icin ogrencilerine verdi
2759,LUK,9,TCL02,herkes yiyip doydu artakalan parcalardan on iki sepet dolusu toplandi
2760,LUK,9,TCL02,bir gun isa tek basina dua ediyordu ogrencileri de yanindaydi isa onlara halk benim kim oldugumu soyluyor diye sordu
2761,LUK,9,TCL02,soyle yanitladilar vaftizci yahya diyorlar ama kimi ilyas kimi de eski peygamberlerden biri dirilmis diyor
2762,LUK,9,TCL02,isa onlara siz ne dersiniz dedi sizce ben kimim
2763,LUK,9,TCL02,petrus sen tanrinin
2764,LUK,9,TCL02,mesih
2765,LUK,9,TCL02,isin yanitini verdi
2766,LUK,9,TCL02,isa onlari uyararak bunu hic kimseye soylememelerini buyurdu
2767,LUK,9,TCL02,insanoglu
2768,LUK,9,TCL02,nun cok aci cekmesi ileri gelenler baskahinler ve din bilginlerince reddedilmesi oldurulmesi ve ucuncu gun dirilmesi gerektigini soyledi
2769,LUK,9,TCL02,sonra hepsine ardimdan gelmek isteyen kendini inkar etsin her gun carmihini yuklenip beni izlesin dedi
2770,LUK,9,TCL02,canini kurtarmak isteyen onu yitirecek canini benim ugruma yitiren ise onu kurtaracaktir
2771,LUK,9,TCL02,insan butun dunyayi kazanip da canini yitirirse canindan olursa bunun kendisine ne yarari olur
2772,LUK,9,TCL02,kim benden ve benim sozlerimden utanirsa insanoglu da kendisinin babasinin ve kutsal meleklerin gorkemi icinde geldiginde o kisiden utanacaktir
2773,LUK,9,TCL02,size gercegi soyleyeyim burada bulunanlar arasinda tanrinin egemenligini gormeden olumu tatmayacak olanlar var
2774,LUK,9,TCL02,bu sozleri soyledikten yaklasik sekiz gun sonra isa yanina petrus yuhanna ve yakupu alarak dua etmek uzere daga cikti
2775,LUK,9,TCL02,isa dua ederken yuzunun gorunumu degisti giysileri simsek gibi parildayan bir beyazliga burundu
2776,LUK,9,TCL02,o anda gorkem icinde beliren iki kisi isayla konusmaya basladilar bunlar musa ile ilyasti isanin yakinda yerusalimde gerceklesecek olan ayrilisini
2777,LUK,9,TCL02,konusuyorlardi
2778,LUK,9,TCL02,petrus ile yanindakilerin uzerine uyku cokmustu ama uykulari iyice dagilinca isanin gorkemini ve yaninda duran iki kisiyi gorduler
2779,LUK,9,TCL02,bunlar isanin yanindan ayrilirken petrus isaya efendimiz dedi burada bulunmamiz ne iyi oldu uc cardak kuralim biri sana biri musaya biri de ilyasa aslinda ne soylediginin farkinda degildi
2780,LUK,9,TCL02,petrus daha bunlari soylerken bir bulut gelip onlara golge saldi bulut onlari sarinca korktular
2781,LUK,9,TCL02,buluttan gelen bir ses bu benim oglumdur secilmis olandir onu dinleyin dedi
2782,LUK,9,TCL02,ses kesilince isanin tek basina oldugu goruldu ogrenciler bunu gizli tuttular ve o gunlerde hic kimseye gorduklerinden soz etmediler
2783,LUK,9,TCL02,ertesi gun dagdan indikleri zaman isayi buyuk bir kalabalik karsiladi
2784,LUK,9,TCL02,kalabaligin icinden bir adam ogretmenim diye seslendi yalvaririm oglumu bir gor o tek cocugumdur
2785,LUK,9,TCL02,bir ruh onu yakaliyor o da birdenbire ciglik atiyor ruh onu agzindan kopukler gelene dek siddetle sarsiyor bedenini yara bere icinde birakarak gucbela ayriliyor
2786,LUK,9,TCL02,ruhu kovmalari icin ogrencilerine yalvardim ama basaramadilar
2787,LUK,9,TCL02,isa soyle karsilik verdi ey imansiz ve sapmis kusak sizinle daha ne kadar kalip size katlanacagim oglunu buraya getir
2788,LUK,9,TCL02,cocuk daha isaya yaklasirken cin onu yere vurup siddetle sarsti ama isa kotu ruhu azarladi cocugu iyilestirerek babasina geri verdi
2789,LUK,9,TCL02,herkes tanrinin buyuk gucune sasip kaldi
2790,LUK,9,TCL02,herkes isanin butun yaptiklari karsisinda hayret icindeyken isa ogrencilerine su sozlerime iyice kulak verin dedi
2791,LUK,9,TCL02,insanoglu
2792,LUK,9,TCL02,insanlarin eline teslim edilecek
2793,LUK,9,TCL02,onlar bu sozu anlamadilar sozu kavramasinlar diye anlami kendilerinden gizlenmisti ustelik isaya bu sozle ilgili soru sormaktan korkuyorlardi
2794,LUK,9,TCL02,ogrenciler aralarinda kimin en buyuk oldugunu tartismaya basladilar
2795,LUK,9,TCL02,akillarindan geceni bilen isa kucuk bir cocugu tutup yanina cekti ve onlara soyle dedi bu cocugu benim adim ugruna kabul eden beni kabul etmis olur beni kabul eden de beni gondereni kabul etmis olur aranizda en kucuk kim ise iste en buyuk odur
2796,LUK,9,TCL02,yuhanna buna karsilik efendimiz dedi senin adinla cin kovan birini gorduk ama bizimle birlikte seni izlemedigi icin ona engel olmaya calistik
2797,LUK,9,TCL02,isa ona engel olmayin dedi size karsi olmayan sizden yanadir
2798,LUK,9,TCL02,goge alinacagi gun yaklasinca isa kararli adimlarla yerusalime dogru yola cikti
2799,LUK,9,TCL02,kendi onunden haberciler gonderdi bunlar kendisi icin hazirlik yapmak uzere gidip
2800,LUK,9,TCL02,samiriyeliler
2801,LUK,9,TCL02,e ait bir koye girdiler
2802,LUK,9,TCL02,ama samiriyeliler isayi kabul etmediler cunku yerusalime dogru gidiyordu
2803,LUK,9,TCL02,ogrencilerden yakupla yuhanna bunu gorunce rab bunlari yok etmek icin bir buyrukla gokten ates yagdirmamizi ister misin dediler
2804,LUK,9,TCL02,ama isa donup onlari azarladi
2805,LUK,9,TCL02,sonra
2806,LUK,9,TCL02,baska bir koye gittiler
2807,LUK,9,TCL02,yolda giderlerken bir adam isaya nereye gidersen senin ardindan gelecegim dedi
2808,LUK,9,TCL02,isa ona tilkilerin ini kuslarin yuvasi var ama insanoglunun basini yaslayacak bir yeri yok dedi
2809,LUK,9,TCL02,bir baskasina ardimdan gel dedi
2810,LUK,9,TCL02,adam ise izin ver once gidip babami gomeyim dedi
2811,LUK,9,TCL02,isa ona soyle dedi birak oluleri kendi olulerini kendileri gomsun sen gidip tanrinin egemenligini duyur
2812,LUK,9,TCL02,bir baskasi ya rab dedi senin ardindan gelecegim ama izin ver once evimdekilerle vedalasayim
2813,LUK,9,TCL02,isa ona sabani tutup da geriye bakan tanrinin egemenligine layik degildir dedi
2814,LUK,10,TCL02,bu olaylardan sonra rab yetmis
2815,LUK,10,TCL02,kisi daha gorevlendirdi bunlari ikiser ikiser kendisinin gidecegi her kente her yere kendi onunden gonderdi
2816,LUK,10,TCL02,onlara urun bol ama isci az dedi bu nedenle urunun sahibi rabbe yalvarin urununu kaldiracak isciler gondersin
2817,LUK,10,TCL02,haydi gidin iste sizi kuzular gibi kurtlarin arasina gonderiyorum
2818,LUK,10,TCL02,yaniniza ne kese ne torba ne de carik alin yolda hic kimseyle selamlasmayin
2819,LUK,10,TCL02,hangi eve girerseniz once bu eve esenlik olsun deyin
2820,LUK,10,TCL02,orada esenliksever biri varsa dilediginiz esenlik onun uzerinde kalacak yoksa size donecektir
2821,LUK,10,TCL02,girdiginiz evde kalin size ne verirlerse onu yiyip icin cunku isci ucretini hak eder evden eve tasinmayin
2822,LUK,10,TCL02,bir kente girdiginizde sizi kabul ederlerse onunuze konulani yiyin
2823,LUK,10,TCL02,orada bulunan hastalari iyilestirin ve kendilerine tanrinin egemenligi size yaklasti deyin
2824,LUK,10,TCL02,ama bir kente girdiginizde sizi kabul etmezlerse o kentin caddelerine cikip soyle deyin kentinizden ayaklarimizda kalan tozu bile size karsi silkiyoruz yine de sunu bilin ki tanrinin egemenligi yaklasti
2825,LUK,10,TCL02,size sunu soyleyeyim yargi gunu o kentin hali sodom kentinin halinden beter olacaktir
2826,LUK,10,TCL02,vay haline ey horazin vay haline ey beytsayda sizlerde yapilan mucizeler sur ve saydada yapilmis olsaydi coktan
2827,LUK,10,TCL02,cul
2828,LUK,10,TCL02,kusanip kul icinde oturarak tovbe etmis olurlardi
2829,LUK,10,TCL02,ama yargi gunu sizin haliniz sur ve saydanin halinden beter olacaktir
2830,LUK,10,TCL02,ya sen ey kefarnahum goge mi cikarilacaksin hayir oluler diyarina indirileceksin
2831,LUK,10,TCL02,sizi dinleyen beni dinlemis olur sizi reddeden beni reddetmis olur beni reddeden de beni gondereni reddetmis olur
2832,LUK,10,TCL02,yetmisler sevinc icinde donduler ya rab dediler senin adini andigimizda cinler bile bize boyun egiyor
2833,LUK,10,TCL02,isa onlara soyle dedi seytanin gokten yildirim gibi dustugunu gordum
2834,LUK,10,TCL02,ben size yilanlari ve akrepleri ayak altinda ezmek ve dusmanin butun gucunu alt etmek icin yetki verdim hicbir sey size zarar vermeyecektir
2835,LUK,10,TCL02,bununla birlikte ruhlarin size boyun egmesine sevinmeyin adlarinizin gokte yazilmis olmasina sevinin
2836,LUK,10,TCL02,o anda isa kutsal ruhun etkisiyle cosarak soyle dedi baba yerin ve gogun rabbi bu gercekleri bilge ve akilli kisilerden gizleyip kucuk cocuklara actigin icin sana sukrederim evet baba senin istegin buydu
2837,LUK,10,TCL02,babam her seyi bana teslim etti ogulun kim oldugunu babadan baska kimse bilmez babanin kim oldugunu da oguldan ve ogulun onu tanitmak istedigi kisilerden baskasi bilmez
2838,LUK,10,TCL02,sonra ogrencilerine donup ozel olarak soyle dedi sizin gorduklerinizi goren gozlere ne mutlu
2839,LUK,10,TCL02,size sunu soyleyeyim nice peygamberler nice krallar sizin gorduklerinizi gormek istediler ama goremediler sizin isittiklerinizi isitmek istediler ama isitemediler
2840,LUK,10,TCL02,bir kutsal yasa uzmani isayi denemek amaciyla gelip soyle dedi ogretmenim sonsuz yasami miras almak icin ne yapmaliyim
2841,LUK,10,TCL02,isa ona kutsal yasada ne yazilmistir diye sordu orada ne okuyorsun
2842,LUK,10,TCL02,adam soyle karsilik verdi tanrin rabbi butun yureginle butun caninla butun gucunle ve butun aklinla seveceksin komsunu da kendin gibi seveceksin
2843,LUK,10,TCL02,isa ona dogru yanit verdin dedi bunu yap ve yasayacaksin
2844,LUK,10,TCL02,oysa adam kendini hakli cikarmak isteyerek isaya peki komsum kim dedi
2845,LUK,10,TCL02,isa soyle yanit verdi adamin biri yerusalimden erihaya inerken haydutlarin eline dustu onu soyup dovduler yari olu birakip gittiler
2846,LUK,10,TCL02,bir rastlanti olarak o yoldan bir kahin geciyordu adami gorunce yolun obur yanindan gecip gitti
2847,LUK,10,TCL02,bir
2848,LUK,10,TCL02,levili
2849,LUK,10,TCL02,de oraya varip adami gorunce ayni sekilde gecip gitti
2850,LUK,10,TCL02,o yoldan gecen bir
2851,LUK,10,TCL02,samiriyeli
2852,LUK,10,TCL02,ise adamin bulundugu yere gelip onu gorunce yuregi sizladi
2853,LUK,10,TCL02,adamin yanina gitti yaralarinin uzerine yagla sarap dokerek sardi sonra adami kendi hayvanina bindirip hana goturdu onunla ilgilendi
2854,LUK,10,TCL02,ertesi gun iki dinar cikararak hanciya verdi ona iyi bak dedi bundan fazla ne harcarsan donusumde sana oderim
2855,LUK,10,TCL02,sence bu uc kisiden hangisi haydutlar arasina dusen adama komsu gibi davrandi
2856,LUK,10,TCL02,yasa uzmani ona aciyip yardim eden dedi
2857,LUK,10,TCL02,isa git sen de oyle yap dedi
2858,LUK,10,TCL02,isa ogrencileriyle birlikte yola devam edip bir koye girdi marta adinda bir kadin isayi evinde konuk etti
2859,LUK,10,TCL02,martanin meryem adindaki kizkardesi rabbin ayaklari dibine oturmus onun konusmasini dinliyordu
2860,LUK,10,TCL02,marta ise islerinin coklugundan oturu telas icindeydi isanin yanina gelerek ya rab dedi kardesimin beni hizmet islerinde yalniz birakmasina aldirmiyor musun ona soyle de bana yardim etsin
2861,LUK,10,TCL02,rab ona su karsiligi verdi marta marta sen cok sey icin kaygilanip telaslaniyorsun
2862,LUK,10,TCL02,oysa gerekli olan tek bir sey vardir meryem iyi olani secti ve bu kendisinden alinmayacak
2863,LUK,11,TCL02,isa bir yerde dua ediyordu duasini bitirince ogrencilerinden biri ya rab dedi yahyanin kendi ogrencilerine ogrettigi gibi sen de bize dua etmesini ogret
2864,LUK,11,TCL02,isa onlara dua ederken soyle soyleyin dedi
2865,LUK,11,TCL02,baba adin kutsal kilinsin
2866,LUK,11,TCL02,egemenligin gelsin
2867,LUK,11,TCL02,her gun bize gundelik ekmegimizi ver
2868,LUK,11,TCL02,gunahlarimizi bagisla
2869,LUK,11,TCL02,cunku biz de bize karsi suc isleyen herkesi bagisliyoruz
2870,LUK,11,TCL02,ayartilmamiza izin verme
2871,LUK,11,TCL02,sonra soyle dedi sizlerden birinin bir arkadasi olur da gece yarisi ona gidip arkadas bana uc ekmek odunc ver bir arkadasim yoldan geldi onune koyacak bir seyim yok derse oburu icerden beni rahatsiz etme kapi kilitli cocuklarim da yanimda yatiyor kalkip sana bir sey veremem der mi hic
2872,LUK,11,TCL02,size sunu soyleyeyim arkadaslik geregi kalkip ona istedigini vermese bile adamin yuzsuzlugunden oturu kalkar ihtiyaci neyse ona verir
2873,LUK,11,TCL02,ben size sunu soyleyeyim dileyin size verilecek arayin bulacaksiniz kapiyi calin size acilacaktir
2874,LUK,11,TCL02,cunku her dileyen alir arayan bulur kapi calana acilir
2875,LUK,11,TCL02,aranizda hangi baba ekmek isteyen ogluna tas verir ya da balik isterse balik yerine yilan verir
2876,LUK,11,TCL02,ya da yumurta isterse ona akrep verir
2877,LUK,11,TCL02,sizler kotu yurekli oldugunuz halde cocuklariniza guzel armaganlar vermeyi biliyorsaniz gokteki babanin kendisinden dileyenlere kutsal ruhu verecegi cok daha kesin degil mi
2878,LUK,11,TCL02,isa adamin birinden dilsiz bir cini kovuyordu cin cikinca adamin dili cozuldu halk hayret icinde kaldi
2879,LUK,11,TCL02,ama iclerinden bazilari cinleri cinlerin onderi
2880,LUK,11,TCL02,baalzevul
2881,LUK,11,TCL02,un gucuyle kovuyor dediler
2882,LUK,11,TCL02,bazilari ise onu denemek amaciyla gokten bir belirti gostermesini istediler
2883,LUK,11,TCL02,onlarin ne dusundugunu bilen isa soyle dedi kendi icinde bolunen ulke yikilir kendi icinde bolunen ev coker
2884,LUK,11,TCL02,seytan da kendi icinde bolunmusse onun egemenligi nasil ayakta kalabilir siz benim baalzevulun gucuyle cinleri kovdugumu soyluyorsunuz
2885,LUK,11,TCL02,eger ben cinleri baalzevulun gucuyle kovuyorsam sizin adamlariniz kimin gucuyle kovuyor sizi bu durumda kendi adamlariniz yargilayacak
2886,LUK,11,TCL02,ama ben cinleri tanrinin eliyle kovuyorsam tanrinin egemenligi uzerinize gelmis demektir
2887,LUK,11,TCL02,tepeden tirnaga silahlanmis guclu bir adam kendi evini korudugu surece mallari guvenlik icinde olur
2888,LUK,11,TCL02,ne var ki ondan daha guclu biri saldirip onu alt ettiginde guvendigi butun silahlari elinden alir ve mallarini yagmalayarak bolusturur
2889,LUK,11,TCL02,benden yana olmayan bana karsidir benimle birlikte toplamayan dagitiyor demektir
2890,LUK,11,TCL02,kotu ruh insandan cikinca kurak yerlerde dolanip huzur arar bulamayinca da ciktigim eve kendi evime doneyim der
2891,LUK,11,TCL02,eve gelince orayi supurulmus duzeltilmis bulur
2892,LUK,11,TCL02,bunun uzerine gider kendisinden kotu yedi ruh daha alir ve eve girip yerlesirler boylece o kisinin son durumu ilkinden beter olur
2893,LUK,11,TCL02,isa bu sozleri soylerken kalabaligin icinden bir kadin ona ne mutlu seni tasimis olan rahme emzirmis olan memelere diye seslendi
2894,LUK,11,TCL02,isa daha dogrusu ne mutlu tanrinin sozunu dinleyip uygulayanlara dedi
2895,LUK,11,TCL02,cevredeki kalabalik buyurken isa konusmaya basladi simdiki kusak kotu bir kusaktir dedi dogaustu bir belirti istiyor ama ona yunusun belirtisinden baska bir belirti gosterilmeyecek
2896,LUK,11,TCL02,yunus nasil ninova halkina bir belirti olduysa
2897,LUK,11,TCL02,insanoglu
2898,LUK,11,TCL02,da bu kusak icin oyle olacaktir
2899,LUK,11,TCL02,guney kralicesi yargi gunu bu kusagin adamlariyla birlikte kalkip onlari yargilayacak cunku kralice suleymanin bilgece sozlerini dinlemek icin dunyanin ta obur ucundan gelmisti bakin suleymandan daha ustun olan buradadir
2900,LUK,11,TCL02,ninova halki yargi gunu bu kusakla birlikte kalkip bu kusagi yargilayacak cunku ninovalilar yunusun cagrisi uzerine tovbe ettiler bakin yunustan daha ustun olan buradadir
2901,LUK,11,TCL02,hic kimse kandil yakip onu gizli yere ya da tahil olceginin altina koymaz tersine iceri girenler isigi gorsunler diye onu kandillige koyar
2902,LUK,11,TCL02,bedenin isigi gozdur gozun saglamsa butun bedenin de aydinlik olur gozun bozuksa bedenin de karanlik olur
2903,LUK,11,TCL02,oyleyse dikkat et sendeki isik karanlik olmasin
2904,LUK,11,TCL02,eger butun bedenin aydinlik olur ve hicbir yani karanlik kalmazsa kandilin seni isinlariyla aydinlattigi zamanki gibi bedenin tumden aydinlik olur
2905,LUK,11,TCL02,isa konusmasini bitirince bir
2906,LUK,11,TCL02,ferisi
2907,LUK,11,TCL02,onu evine yemege cagirdi o da iceri girerek sofraya oturdu
2908,LUK,11,TCL02,isanin yemekten once yikanmadigini goren ferisi sasti
2909,LUK,11,TCL02,rab ona soyle dedi siz ferisiler bardagin ve tabagin disini temizlersiniz ama iciniz acgozluluk ve kotulukle doludur
2910,LUK,11,TCL02,ey akilsizlar disi yapanla ici yapan ayni degil mi
2911,LUK,11,TCL02,siz kaplarinizin icindekini
2912,LUK,11,TCL02,sadaka olarak verin o zaman sizin icin her sey temiz olur
2913,LUK,11,TCL02,ama vay halinize ey ferisiler siz nanenin sedefotunun ve her tur sebzenin ondaligini verirsiniz de adaleti ve tanri sevgisini ihmal edersiniz ondalik vermeyi ihmal etmeden esas bunlari yerine getirmeniz gerekirdi
2914,LUK,11,TCL02,vay halinize ey ferisiler havralarda en seckin yerlere kurulmaya meydanlarda selamlanmaya bayilirsiniz
2915,LUK,11,TCL02,vay halinize insanlarin farkinda olmadan uzerlerinde gezindigi belirsiz mezarlara benziyorsunuz
2916,LUK,11,TCL02,kutsal yasa uzmanlarindan biri soz alip isaya ogretmenim bunlari soylemekle bize de hakaret etmis oluyorsun dedi
2917,LUK,11,TCL02,isa sizin de vay halinize ey yasa uzmanlari dedi insanlara tasinmasi guc yukler yuklersiniz kendiniz ise bu yukleri kaldirmak icin parmaginizi bile kipirdatmazsiniz
2918,LUK,11,TCL02,vay halinize peygamberlerin anitlarini yaparsiniz oysa onlari sizin atalariniz oldurmustur
2919,LUK,11,TCL02,boylelikle atalarinizin yaptiklarina taniklik ederek bunlari onaylamis oluyorsunuz cunku onlar peygamberleri oldurduler siz de anitlarini yapiyorsunuz
2920,LUK,11,TCL02,iste bunun icin tanrinin bilgeligi soyle demistir ben onlara peygamberler ve elciler gonderecegim bunlardan kimini oldurecek kimine zulmedecekler
2921,LUK,11,TCL02,boylece bu kusak habilin kanindan tutun da sunakla tapinak arasinda oldurulen zekeriyanin kanina degin dunyanin kurulusundan beri akitilan butun peygamberlerin kanindan sorumlu tutulacaktir evet size soyluyorum bu kusak sorumlu tutulacaktir
2922,LUK,11,TCL02,vay halinize ey yasa uzmanlari bilgi kapisinin anahtarini alip goturdunuz kendiniz bu kapidan girmediniz girmek isteyenlere de engel oldunuz
2923,LUK,11,TCL02,isa oradan ayrilinca din bilginleriyle ferisiler onu siddetle sikistirarak bircok konuda agzini aramaya basladilar
2924,LUK,11,TCL02,agzindan cikacak bir sozle onu tuzaga dusurmek icin firsat kolluyorlardi
2925,LUK,12,TCL02,o sirada halktan binlerce kisi birbirlerini ezercesine toplanmisti isa once kendi ogrencilerine sunlari soylemeye basladi ferisilerin mayasindan yani ikiyuzlulukten kacinin
2926,LUK,12,TCL02,ortulu olup da aciga cikarilmayacak gizli olup da bilinmeyecek hicbir sey yoktur
2927,LUK,12,TCL02,bunun icin karanlikta soylediginiz her soz gun isiginda duyulacak kapali kapilar ardinda kulaga fisildadiklariniz damlardan duyurulacaktir
2928,LUK,12,TCL02,siz dostlarima soyluyorum bedeni olduren ama ondan sonra baska bir sey yapamayanlardan korkmayin
2929,LUK,12,TCL02,kimden korkmaniz gerektigini size aciklayayim kisiyi oldurdukten sonra cehenneme atma yetkisine sahip olan tanridan korkun evet size soyluyorum ondan korkun
2930,LUK,12,TCL02,bes serce iki metelige satilmiyor mu ama bunlardan bir teki bile tanri katinda unutulmus degildir
2931,LUK,12,TCL02,nitekim basinizdaki butun saclar bile sayilidir korkmayin siz bircok serceden daha degerlisiniz
2932,LUK,12,TCL02,size sunu soyleyeyim insanlarin onunde beni acikca kabul eden herkesi
2933,LUK,12,TCL02,insanoglu
2934,LUK,12,TCL02,da tanrinin melekleri onunde acikca kabul edecek
2935,LUK,12,TCL02,ama kim beni insanlar onunde inkar ederse kendisi de tanrinin melekleri onunde inkar edilecek
2936,LUK,12,TCL02,insanogluna karsi bir soz soyleyen herkes bagislanacak oysa kutsal ruha kufreden bagislanmayacaktir
2937,LUK,12,TCL02,sizi havra topluluklarinin yoneticilerin ve yetkililerin onune cikardiklarinda kendimizi neyle nasil savunacagiz ya da ne soyleyecegiz diye kaygilanmayin
2938,LUK,12,TCL02,kutsal ruh o anda size ne soylemeniz gerektigini ogretecektir
2939,LUK,12,TCL02,kalabaligin icinden biri isaya ogretmenim kardesime soyle de mirasi benimle paylassin dedi
2940,LUK,12,TCL02,isa ona soyle dedi ey adam kim beni uzerinizde yargic ya da hakem yapti
2941,LUK,12,TCL02,sonra onlara dikkatli olun dedi her turlu acgozlulukten sakinin cunku insanin yasami malinin cokluguna bagli degildir
2942,LUK,12,TCL02,isa onlara su benzetmeyi anlatti zengin bir adamin topraklari bol urun verdi
2943,LUK,12,TCL02,adam kendi kendine ne yapacagim urunlerimi koyacak yerim yok diye dusundu
2944,LUK,12,TCL02,sonra soyle yapacagim dedi ambarlarimi yikip daha buyuklerini yapacagim butun tahillarimi ve mallarimi oraya yigacagim
2945,LUK,12,TCL02,kendime ey canim yillarca yetecek kadar bol malin var rahatina bak ye ic yasamin tadini cikar diyecegim
2946,LUK,12,TCL02,ama tanri ona ey akilsiz dedi bu gece canin senden istenecek biriktirdigin bu seyler kime kalacak
2947,LUK,12,TCL02,kendisi icin servet biriktiren ama tanri katinda zengin olmayan kisinin sonu boyle olur
2948,LUK,12,TCL02,isa ogrencilerine soyle dedi bu nedenle size sunu soyluyorum ne yiyecegiz diye caniniz icin ne giyecegiz diye bedeniniz icin kaygilanmayin
2949,LUK,12,TCL02,can yiyecekten beden de giyecekten daha onemlidir
2950,LUK,12,TCL02,kargalara bakin ne eker ne bicerler ne kilerleri ne ambarlari vardir tanri yine de onlari doyurur siz kuslardan cok daha degerlisiniz
2951,LUK,12,TCL02,hangi biriniz kaygilanmakla omrunu bir anlik
2952,LUK,12,TCL02,uzatabilir
2953,LUK,12,TCL02,bu kucucuk ise bile gucunuz yetmedigine gore obur konularda neden kaygilaniyorsunuz
2954,LUK,12,TCL02,zambaklarin nasil buyudugune bakin ne calisirlar ne de iplik egirirler ama size sunu soyleyeyim butun gorkemine karsin suleyman bile bunlardan biri gibi giyinmis degildi
2955,LUK,12,TCL02,ey kit imanlilar bugun var olup yarin ocaga atilacak olan kir otunu boyle giydiren tanrinin sizi de giydirecegi cok daha kesindir
2956,LUK,12,TCL02,ne yiyecegiz ne icecegiz diye dusunup tasalanmayin
2957,LUK,12,TCL02,dunya uluslari hep bu seylerin pesinden giderler oysa babaniz bunlara gereksinmeniz oldugunu bilir
2958,LUK,12,TCL02,siz onun egemenliginin ardindan gidin o zaman size bunlar da verilecektir
2959,LUK,12,TCL02,korkma ey kucuk suru cunku babaniz egemenligi size vermeyi uygun gordu
2960,LUK,12,TCL02,mallarinizi satin sadaka olarak verin kendinize eskimeyen keseler goklerde tukenmeyen bir hazine edinin orada ne hirsiz ona yaklasir ne de guve onu yer
2961,LUK,12,TCL02,hazineniz neredeyse yureginiz de orada olacaktir
2962,LUK,12,TCL02,kusaklariniz belinizde bagli ve kandilleriniz yanar durumda hazir olun
2963,LUK,12,TCL02,dugun senliginden donecek olan efendilerinin gelip kapiyi caldigi an kapiyi acmak icin hazir bekleyen koleler gibi olun
2964,LUK,12,TCL02,efendileri geldiginde uyanik bulunan kolelere ne mutlu size dogrusunu soyleyeyim efendileri beline kusagini baglayacak kolelerini sofraya oturtacak ve gelip onlara hizmet edecek
2965,LUK,12,TCL02,efendi gecenin ister ikinci ister ucuncu nobetinde
2966,LUK,12,TCL02,gelsin uyanik bulacagi kolelere ne mutlu
2967,LUK,12,TCL02,ama sunu bilin ki ev sahibi hirsizin hangi saatte gelecegini bilse evinin soyulmasina firsat vermez
2968,LUK,12,TCL02,siz de hazir olun cunku
2969,LUK,12,TCL02,insanoglu
2970,LUK,12,TCL02,beklemediginiz saatte gelecektir
2971,LUK,12,TCL02,petrus ya rab dedi bu benzetmeyi bizim icin mi anlatiyorsun yoksa herkes icin mi
2972,LUK,12,TCL02,rab de soyle dedi efendinin usaklarina vaktinde azik vermek icin baslarina atadigi guvenilir ve akilli kahya kimdir
2973,LUK,12,TCL02,efendisi eve dondugunde isinin basinda bulacagi o koleye ne mutlu
2974,LUK,12,TCL02,size gercegi soyleyeyim efendisi onu butun malinin uzerinde yetkili kilacak
2975,LUK,12,TCL02,ama o kole icinden efendim gecikiyor der kadin ve erkek hizmetkarlari dovmeye yiyip icip sarhos olmaya baslarsa efendisi onun beklemedigi gunde ummadigi saatte gelecek onu siddetle cezalandirip imansizlarla bir tutacaktir
2976,LUK,12,TCL02,efendisinin istegini bilip de hazirlik yapmayan onun istegini yerine getirmeyen kole cok dayak yiyecek
2977,LUK,12,TCL02,oysa bilmeden dayagi hak eden davranislarda bulunan az dayak yiyecek kime cok verilmisse ondan cok istenecek kime cok sey emanet edilmisse kendisinden daha fazlasi istenecektir
2978,LUK,12,TCL02,ben dunyaya ates yagdirmaya geldim keske bu ates daha simdiden alevlenmis olsaydi
2979,LUK,12,TCL02,katlanmam gereken bir vaftiz var bu vaftiz gerceklesinceye dek nasil da sikinti cekiyorum
2980,LUK,12,TCL02,yeryuzune baris getirmeye mi geldigimi saniyorsunuz size hayir diyorum ayrilik getirmeye geldim
2981,LUK,12,TCL02,bundan boyle bir evde bes kisi ikiye karsi uc uce karsi iki bolunmus olacak
2982,LUK,12,TCL02,baba ogluna karsi ogul babasina karsi anne kizina karsi kiz annesine karsi kaynana gelinine karsi gelin kaynanasina karsi olacaktir
2983,LUK,12,TCL02,isa halka sunlari da soyledi batida bir bulutun yukseldigini gorunce siz hemen saganak geliyor diyorsunuz ve oyle oluyor
2984,LUK,12,TCL02,ruzgarin guneyden estigini gorunce cok sicak olacak diyorsunuz ve oyle oluyor
2985,LUK,12,TCL02,sizi ikiyuzluler yeryuzunun ve gokyuzunun gorunumunden bir anlam cikarabiliyorsunuz da simdiki zamanin anlamini nasil oluyor da cikaramiyorsunuz
2986,LUK,12,TCL02,dogru olana neden kendiniz karar vermiyorsunuz
