,book,chapt,version,text
5141,ACT,9,TCL02,ne var ki kurduklari duzenle ilgili haber saula ulasti yahudiler onu oldurmek icin gece gunduz kentin kapilarini gozluyorlardi
5142,ACT,9,TCL02,ama saulun ogrencileri geceleyin kendisini aldilar kentin surlarindan sarkittiklari bir kufe icinde asagi indirdiler
5143,ACT,9,TCL02,saul yerusalime varinca oradaki ogrencilere katilmaya calisti ama hepsi ondan korkuyor isanin ogrencisi olduguna inanamiyorlardi
5144,ACT,9,TCL02,o zaman barnaba onu alip elcilere goturdu onlara saulun sam yolunda rabbi nasil gordugunu rabbin de onunla konustugunu samda ise onun isa adini nasil korkusuzca duyurdugunu anlatti
5145,ACT,9,TCL02,boylelikle saul yerusalimde girip ciktiklari her yerde ogrencilerle birlikte bulunarak rabbin adini korkusuzca duyurmaya basladi
5146,ACT,9,TCL02,dili grekce olan yahudilerle konusup tartisiyordu ama onlar onu oldurmeyi tasarliyorlardi
5147,ACT,9,TCL02,kardesler bunu ogrenince onu sezariyeye goturup oradan tarsusa yolladilar
5148,ACT,9,TCL02,butun yahudiye celile ve
5149,ACT,9,TCL02,samiriyedeki
5150,ACT,9,TCL02,inanlilar toplulugu
5151,ACT,9,TCL02,esenlige kavustu gelisen ve rab korkusu icinde yasayan topluluk kutsal ruhun yardimiyla sayica buyuyordu
5152,ACT,9,TCL02,bu arada her tarafi dolasan petrus liddada yasayan kutsallara da ugradi
5153,ACT,9,TCL02,orada eneas adinda birine rastladi eneas felcliydi sekiz yildan beri yatalakti
5154,ACT,9,TCL02,petrus ona eneas isa mesih seni iyilestiriyor dedi kalk yatagini topla eneas hemen ayaga kalkti
5155,ACT,9,TCL02,lidda ve saronda yasayan herkes onu gordu ve rabbe dondu
5156,ACT,9,TCL02,yafada isa ogrencisi olan tabita adinda bir kadin vardi tabita ceylan anlamina gelir bu kadin her zaman iyilik yapip yoksullara yardim ederdi
5157,ACT,9,TCL02,o gunlerde hastalanip oldu olusunu yikayip ust kattaki odaya koydular
5158,ACT,9,TCL02,lidda yafaya yakin oldugundan petrusun liddada bulundugunu duyan ogrenciler ona iki kisi yollayip vakit kaybetmeden yanimiza gel diye yalvardilar
5159,ACT,9,TCL02,petrus kalkip onlarla birlikte gitti eve varinca onu ust kattaki odaya cikardilar butun dul kadinlar aglayarak petrusun cevresinde toplandilar ona ceylanin kendileriyle birlikteyken diktigi entarilerle ustlukleri gosterdiler
5160,ACT,9,TCL02,petrus herkesi disari cikartti diz cokup dua etti sonra oluye dogru donerek tabita kalk dedi kadin gozlerini acti petrusu gorunce dogrulup oturdu
5161,ACT,9,TCL02,petrus elini uzatarak onu ayaga kaldirdi sonra kutsallarla dul kadinlari cagirdi ceylani diri olarak onlara teslim etti
5162,ACT,9,TCL02,bu olayin haberi butun yafaya yayildi ve bircoklari rabbe inandi
5163,ACT,9,TCL02,petrus uzunca bir sure yafada simun adinda bir dericinin evinde kaldi
5164,ACT,10,TCL02,sezariyede kornelius adinda bir adam vardi italyan taburunda yuzbasiydi
5165,ACT,10,TCL02,dindar bir adamdi hem kendisi hem de butun ev halki tanridan korkardi halka cok yardimda bulunur tanriya surekli dua ederdi
5166,ACT,10,TCL02,bir gun
5167,ACT,10,TCL02,saat
5168,ACT,10,TCL02,uc sularinda bir gorumde tanrinin bir meleginin kendisine geldigini acikca gordu melek ona kornelius diye seslendi
5169,ACT,10,TCL02,kornelius korku icinde gozlerini ona dikti ne var efendim dedi
5170,ACT,10,TCL02,melek ona soyle dedi dualarin ve sadakalarin anilmak uzere tanri katina ulasti
5171,ACT,10,TCL02,simdi yafaya adam yolla petrus olarak da taninan simunu cagirt
5172,ACT,10,TCL02,petrus evi deniz kiyisinda bulunan simun adli bir dericinin yaninda kaliyor
5173,ACT,10,TCL02,kendisiyle konusan melek uzaklastiktan sonra kornelius iki usagiyla ozel yardimcilarindan dindar bir askeri cagirdi
5174,ACT,10,TCL02,kendilerine her seyi anlattiktan sonra onlari yafaya gonderdi
5175,ACT,10,TCL02,ertesi gun onlar yol alip kente yaklasirlarken
5176,ACT,10,TCL02,saat
5177,ACT,10,TCL02,on iki sularinda petrus dua etmek icin dama cikti
5178,ACT,10,TCL02,acikinca da yemek istedi yemek hazirlanirken petrus kendinden gecti
5179,ACT,10,TCL02,gogun acildigini ve buyuk bir carsafi andiran bir nesnenin dort kosesinden sarkitilarak yeryuzune indirildigini gordu
5180,ACT,10,TCL02,carsafin icinde yeryuzunde yasayan her turden dort ayakli hayvanlar surungenler ve kuslar vardi
5181,ACT,10,TCL02,bir ses ona kalk petrus kes ve ye dedi
5182,ACT,10,TCL02,asla olmaz ya rab dedi petrus hicbir zaman bayagi ya da
5183,ACT,10,TCL02,murdar
5184,ACT,10,TCL02,herhangi bir sey yemedim
5185,ACT,10,TCL02,ses tekrar ikinci kez duyuldu petrusa tanrinin temiz kildiklarina sen bayagi deme dedi
5186,ACT,10,TCL02,bu uc kez tekrarlandi sonra carsafi andiran nesne hemen goge alindi
5187,ACT,10,TCL02,petrus saskinlik icindeydi gordugu gorumun ne anlama gelebilecegini dusunurken korneliusun gonderdigi adamlar sora sora simunun evinin kapisina kadar geldiler
5188,ACT,10,TCL02,evdekilere seslenerek petrus diye taninan simun burada mi kaliyor diye sordular
5189,ACT,10,TCL02,petrus hala gorumun anlamini dusunurken ruh ona bak uc kisi seni ariyor dedi
5190,ACT,10,TCL02,haydi kalk asagi in hic cekinmeden onlarla git cunku onlari ben gonderdim
5191,ACT,10,TCL02,petrus asagi inip adamlara aradiginiz kisi benim dedi gelisinizin sebebi ne acaba
5192,ACT,10,TCL02,dogru ve tanridan korkan butun yahudi ulusunca iyiligiyle taninan kornelius adinda bir yuzbasi var dediler kutsal bir melek ona seni evine cagirtip senin soyleyeceklerini dinlemesini buyurdu
5193,ACT,10,TCL02,bunun uzerine petrus onlari iceri alip konuk etti
5194,ACT,10,TCL02,ertesi gun petrus kalkti onlarla birlikte yola cikti yafadaki kardeslerden bazilari da ona katildi
5195,ACT,10,TCL02,ikinci gun sezariyeye vardilar bu arada kornelius akraba ve yakin dostlarini toplamis onlari bekliyordu
5196,ACT,10,TCL02,eve giren petrusu karsiladi tapinircasina ayaklarina kapandi
5197,ACT,10,TCL02,petrus ise onu ayaga kaldirarak kalk ben de insanim dedi
5198,ACT,10,TCL02,petrus korneliusla konusa konusa iceri girdiginde bircok insanin toplanmis oldugunu gordu
5199,ACT,10,TCL02,onlara soyle dedi bir yahudinin baska ulustan biriyle iliski kurmasinin onu ziyaret etmesinin toremize aykiri oldugunu bilirsiniz oysa tanri bana hic kimseye bayagi ya da
5200,ACT,10,TCL02,murdar
5201,ACT,10,TCL02,dememem gerektigini gosterdi
5202,ACT,10,TCL02,bu nedenle cagrildigim zaman hic itiraz etmeden geldim simdi beni ne amacla cagirttiginizi sorabilir miyim
5203,ACT,10,TCL02,kornelius uc gun
5204,ACT,10,TCL02,once bu siralarda
5205,ACT,10,TCL02,saat
5206,ACT,10,TCL02,ucte evimde dua ediyordum dedi birdenbire parlak giysili bir adam onume cikiverdi
5207,ACT,10,TCL02,kornelius dedi tanri senin duani isitti verdigin sadakalari andi
5208,ACT,10,TCL02,yafaya adam yolla petrus diye taninan simunu cagirt o deniz kiyisinda oturan derici simunun evinde kaliyor
5209,ACT,10,TCL02,bunun uzerine sana hemen adam yolladim sen de lutfedip geldin iste simdi biz hepimiz rabbin sana buyurdugu her seyi dinlemek uzere tanrinin onunde toplanmis bulunuyoruz
5210,ACT,10,TCL02,o zaman petrus soz alip soyle dedi tanrinin insanlar arasinda ayrim yapmadigini ama kendisinden korkan ve dogru olani yapan kisiyi ulusuna bakmaksizin kabul ettigini gercekten anliyorum
5211,ACT,10,TCL02,tanrinin herkesin rabbi olan isa mesih araciligiyla esenligi mujdeleyerek israilogullarina ilettigi bildiriden haberiniz vardir
5212,ACT,10,TCL02,yahyanin
5213,ACT,10,TCL02,vaftiz
5214,ACT,10,TCL02,cagrisindan sonra celileden baslayarak butun yahudiyede meydana gelen olaylari tanrinin nasirali isayi nasil kutsal ruhla ve kudretle
5215,ACT,10,TCL02,meshettigini
5216,ACT,10,TCL02,biliyorsunuz isa her yani dolasarak iyilik yapiyor iblisin baskisi altinda olanlarin hepsini iyilestiriyordu cunku tanri onunla birlikteydi
5217,ACT,10,TCL02,biz isanin yahudilerin ulkesinde ve yerusalimde yaptiklarinin hepsine tanik olduk onu carmiha gerip oldurduler
5218,ACT,10,TCL02,ama tanri onu ucuncu gun diriltti ve acikca gorunmesini sagladi
5219,ACT,10,TCL02,isa halkin tumune degil de tanrinin onceden sectigi taniklara olumden dirilmesinden sonra kendisiyle birlikte yiyip icen bizlere gorundu
5220,ACT,10,TCL02,tanri tarafindan olulerle dirilerin yargici olarak atanan kisinin kendisi oldugunu halka duyurmamizi buna taniklik etmemizi buyurdu
5221,ACT,10,TCL02,peygamberlerin hepsi onunla ilgili taniklikta bulunuyorlar soyle ki ona inanan herkesin gunahlari onun adiyla bagislanir
5222,ACT,10,TCL02,petrus daha bu sozleri soylerken kutsal ruh konusmayi dinleyen herkesin uzerine indi
5223,ACT,10,TCL02,petrusla birlikte gelen yahudi
5224,ACT,10,TCL02,imanlilar kutsal ruh armaganinin oteki uluslardan olanlarin da uzerine dokulmesini saskinlikla karsiladilar
5225,ACT,10,TCL02,cunku onlarin bilmedikleri dillerle konusup tanriyi yucelttiklerini duyuyorlardi
5226,ACT,10,TCL02,o zaman petrus bunlar tipki bizim gibi kutsal ruhu almislar suyla
5227,ACT,10,TCL02,vaftiz
5228,ACT,10,TCL02,olmalarina kim engel olabilir dedi
5229,ACT,10,TCL02,boylelikle onlarin isa mesih adiyla vaftiz olmalarini buyurdu sonra onlar petrusa birkac gun yanlarinda kalmasi icin ricada bulundular
5230,ACT,11,TCL02,elcilerle butun yahudiyedeki kardesler oteki uluslarin da tanrinin sozunu kabul ettiklerini duydular
5231,ACT,11,TCL02,ama petrus yerusalime gittigi zaman sunnet yanlilari onu elestirdiler
5232,ACT,11,TCL02,sunnetsiz
5233,ACT,11,TCL02,kisilerin evine gidip yemek yemissin dediler
5234,ACT,11,TCL02,petrus bastan baslayarak olanlari tek tek onlara anlatti
5235,ACT,11,TCL02,ben yafa kentinde dua ediyordum dedi kendimden gecerek bir gorum gordum buyuk bir carsafi andiran bir nesnenin dort kosesinden sarkitildigini bunun gokten inip benim bulundugum yere kadar geldigini gordum
5236,ACT,11,TCL02,gozlerimi carsafa dikip dikkatle baktim carsafin icinde yeryuzunde yasayan dort ayaklilar yabanil hayvanlar surungenler ve kuslar gordum
5237,ACT,11,TCL02,sonra bir sesin bana kalk petrus kes ve ye dedigini isittim
5238,ACT,11,TCL02,asla olmaz ya rab dedim agzima hicbir zaman bayagi ya da
5239,ACT,11,TCL02,murdar
5240,ACT,11,TCL02,bir sey girmedi
5241,ACT,11,TCL02,ses ikinci kez gokten geldi tanrinin temiz kildiklarina sen bayagi deme dedi
5242,ACT,11,TCL02,bu uc kez tekrarlandi sonra her sey yeniden goge alindi
5243,ACT,11,TCL02,tam o sirada sezariyeden bana gonderilen uc kisi bulundugumuz evin onunde durdular
5244,ACT,11,TCL02,ruh bana ayrim gozetmeden onlarla birlikte gitmemi soyledi bu alti kardes de benimle geldiler varip adamin evine girdik
5245,ACT,11,TCL02,adam bize evinde beliren melegi nasil gordugunu anlatti melek ona soyle demis yafaya adam yolla petrus diye taninan simunu cagirt
5246,ACT,11,TCL02,o sana senin ve butun ev halkinin kurtulus bulacagi sozler soyleyecek
5247,ACT,11,TCL02,ben konusmaya baslayinca kutsal ruh baslangicta bizim uzerimize indigi gibi onlarin da uzerine indi
5248,ACT,11,TCL02,o zaman rabbin soyledigi su sozu animsadim yahya suyla
5249,ACT,11,TCL02,vaftiz
5250,ACT,11,TCL02,etti sizler ise kutsal ruhla vaftiz edileceksiniz
5251,ACT,11,TCL02,boylelikle tanri rab isa mesihe inanmis olan bizlere verdigi armaganin aynisini onlara verdiyse ben kimim ki tanriya karsi koyayim
5252,ACT,11,TCL02,bunlari dinledikten sonra yatistilar tanriyi yucelterek soyle dediler demek ki tanri tovbe etme ve yasama kavusma firsatini oteki uluslara da vermistir
5253,ACT,11,TCL02,istefanosun oldurulmesiyle baslayan baski sonucu dagilan imanlilar fenike kibris ve antakyaya kadar gittiler tanri sozunu sadece yahudilere duyuruyorlardi
5254,ACT,11,TCL02,ama iclerinden kibrisli ve kireneli olan bazi adamlar antakyaya gidip
5255,ACT,11,TCL02,grekler
5256,ACT,11,TCL02,le de konusmaya basladilar onlara rab isayla ilgili mujdeyi bildirdiler
5257,ACT,11,TCL02,onlarin arasinda etkin olan rabbin gucu
5258,ACT,11,TCL02,sayesinde cok sayida kisi inanip rabbe dondu
5259,ACT,11,TCL02,olup bitenlerin haberi yerusalimdeki
5260,ACT,11,TCL02,kilise
5261,ACT,11,TCL02,ye ulasti bunun uzerine imanlilar barnabayi antakyaya gonderdiler
5262,ACT,11,TCL02,kutsal ruhla ve imanla dolu iyi bir adam olan barnaba antakyaya varip tanri lutfunun meyvelerini gorunce sevindi herkesi candan ve yurekten rabbe bagli kalmaya ozendirdi sonuc olarak rabbe daha bircok kisi kazanildi
5263,ACT,11,TCL02,sonra barnaba saulu aramak icin tarsusa gitti onu bulunca da antakyaya getirdi boylece barnabayla saul bir yil boyunca oradaki
5264,ACT,11,TCL02,inanlilar toplulugu
5265,ACT,11,TCL02,yla bir araya gelerek buyuk bir kitleyi egittiler ogrencilere ilk kez antakyada mesihciler
5266,ACT,11,TCL02,adi verildi
5267,ACT,11,TCL02,o gunlerde yerusalimden antakyaya bazi peygamberler geldi
5268,ACT,11,TCL02,bunlardan hagavos adli biri ortaya cikip butun dunyada siddetli bir kitlik olacagini ruh araciligiyla bildirdi bu kitlik klavdiusun imparatorlugu sirasinda oldu
5269,ACT,11,TCL02,ogrenciler her biri kendi gucu oraninda yahudiyede yasayan kardeslere gonderilmek uzere yardim toplamayi kararlastirdilar
5270,ACT,11,TCL02,bu karari yerine getirip bagislarini barnaba ve saulun eliyle kilisenin
5271,ACT,11,TCL02,ihtiyar
5272,ACT,11,TCL02,larina gonderdiler
5273,ACT,12,TCL02,o sirada kral
5274,ACT,12,TCL02,hirodes
5275,ACT,12,TCL02,
5276,ACT,12,TCL02,kilise
5277,ACT,12,TCL02,den bazi kisilere eziyet etmeye basladi
5278,ACT,12,TCL02,yuhannanin kardesi yakupu kilicla oldurttu
5279,ACT,12,TCL02,yahudilerin bundan memnun kaldigini gorunce ardindan petrusu da yakalatti bunu
5280,ACT,12,TCL02,mayasiz ekmek bayrami
5281,ACT,12,TCL02,sirasinda yapti
5282,ACT,12,TCL02,petrusu tutuklatip hapse attirdi ve dorder kisilik dort takim askerin gozetimine teslim etti
5283,ACT,12,TCL02,fisih bayramindan
5284,ACT,12,TCL02,sonra onu halkin onunde yargilamak niyetindeydi
5285,ACT,12,TCL02,bu nedenle petrus hapiste tutuldu ama
5286,ACT,12,TCL02,inanlilar toplulugu
5287,ACT,12,TCL02,onun icin tanriya hararetle dua ediyordu
5288,ACT,12,TCL02,petrus hirodesin kendisini yargilayacagi gunden onceki gece cift zincirle bagli olarak iki askerin arasinda uyuyordu kapida duran nobetciler de zindanin guvenligini sagliyordu
5289,ACT,12,TCL02,birdenbire rabbin bir melegi gorundu ve hucrede bir isik parladi melek petrusun bogrune dokunup onu uyandirdi cabuk kalk dedi o anda zincirler petrusun bileklerinden dustu
5290,ACT,12,TCL02,melek ona kusagini bagla cariklarini giy dedi petrus da soyleneni yapti abani giy beni izle dedi melek
5291,ACT,12,TCL02,petrus onu izleyerek disari cikti ama melegin yaptiginin gercek oldugunu anlamiyor bir gorum gordugunu saniyordu
5292,ACT,12,TCL02,birinci ve ikinci nobetciyi gecerek kente acilan demir kapiya geldiler kapi onlerinde kendiliginden acildi disari cikip bir sokak boyunca yuruduler sonra melek ansizin petrusun yanindan ayrildi
5293,ACT,12,TCL02,o zaman kendine gelen petrus rabbin bana melegini gonderdigini simdi gercekten anliyorum dedi o beni hirodesin elinden ve yahudi halkinin ugrayacagimi umdugu butun belalardan kurtardi
5294,ACT,12,TCL02,petrus olanlarin farkina varinca markos diye taninan yuhannanin annesi meryemin evine gitti orada bircok kisi toplanmis dua ediyordu
5295,ACT,12,TCL02,petrusun dis kapiyi calmasi uzerine roda adli bir hizmetci kiz kapiya bakmaya gitti
5296,ACT,12,TCL02,petrusun sesini taniyan kiz sevincinden kapiyi acmadan tekrar iceri kosarak petrus kapida duruyor diye haber verdi
5297,ACT,12,TCL02,cildirmissin sen dediler ona ama kiz usteleyince onun melegi olmali dediler
5298,ACT,12,TCL02,petrus ise kapiyi calmaya devam etti kapiyi acip onu gorunce sasip kaldilar
5299,ACT,12,TCL02,petrus eliyle susmalarini isaret ederek rabbin onu zindandan nasil cikardigini anlatti sonra bu haberleri yakupla obur kardeslere iletin diyerek oradan ayrilip baska bir yere gitti
5300,ACT,12,TCL02,askerler sabahleyin buyuk bir telasa kapildilar birbirlerine petrusa ne oldu diye sordular
5301,ACT,12,TCL02,hirodes onu aratti bulamayinca da nobetcileri sorguya cekti ve idam edilmeleri icin buyruk verdi
5302,ACT,12,TCL02,bundan sonra hirodes yahudiyeden sezariyeye gidip bir sure orada kaldi
5303,ACT,12,TCL02,bu arada sur ve sayda halklarina ates puskuruyordu bunlar birlesip kendisiyle gorusmeye geldiler once kralin basdanismani vlastusu kendi taraflarina cekerek baris isteginde bulundular cunku kendi ulkelerinin gereksindigi yiyecekler kralin ulkesinden saglaniyordu
5304,ACT,12,TCL02,belirlenen gunde krallik giysilerini giyen hirodes tahtina oturarak halka bir konusma yapti
5305,ACT,12,TCL02,halk bu bir insanin sesi degil bir ilahin sesidir diye bagiriyordu
5306,ACT,12,TCL02,o anda rabbin bir melegi hirodesi vurdu cunku tanriya ait olan yuceligi kendine mal etmisti ici kurtlarca kemirilerek can verdi
5307,ACT,12,TCL02,tanrinin sozu ise yayiliyor etkisini artiriyordu
5308,ACT,12,TCL02,gorevlerini tamamlayan barnabayla saul markos diye taninan yuhannayi yanlarina alarak yerusalimden donduler
5309,ACT,13,TCL02,antakyadaki
5310,ACT,13,TCL02,kilise
5311,ACT,13,TCL02,de peygamberler ve ogretmenler vardi barnaba niger denilen simon kireneli lukius
5312,ACT,13,TCL02,bolge krali
5313,ACT,13,TCL02,hirodesle birlikte buyumus olan menahem ve saul
5314,ACT,13,TCL02,bunlar rabbe tapinip
5315,ACT,13,TCL02,oruc
5316,ACT,13,TCL02,tutarlarken kutsal ruh kendilerine soyle dedi barnabayla saulu kendilerini cagirmis oldugum gorev icin bana ayirin
5317,ACT,13,TCL02,boylece oruc tutup dua ettikten sonra barnabayla saulun uzerine ellerini koyup onlari yolcu ettiler
5318,ACT,13,TCL02,kutsal ruhun buyruguyla yola cikan barnabayla saul selefkiyeye gittiler oradan da gemiyle kibrisa gectiler
5319,ACT,13,TCL02,salamise varinca yahudilerin havralarinda tanrinin sozunu duyurmaya basladilar yuhannayi da yardimci olarak yanlarina almislardi
5320,ACT,13,TCL02,adayi bastan basa gecerek bafa geldiler orada buyucu ve sahte peygamber baryesu adinda bir yahudiyle karsilastilar
5321,ACT,13,TCL02,baryesu vali sergius pavlusa yakin biriydi akilli bir kisi olan vali barnabayla saulu cagirtip tanrinin sozunu dinlemek istedi ne var ki baryesu buyucu anlamina gelen obur adiyla elimas onlara karsi koyarak valiyi iman etmekten caydirmaya calisti
5322,ACT,13,TCL02,ama kutsal ruhla dolan saul yani pavlus gozlerini elimasa dikerek ey iblisin oglu dedi yuregin her turlu hile ve sahtekarlikla dolu dogru olan her seyin dusmanisin rabbin duz yollarini carpitmaktan vazgecmeyecek misin
5323,ACT,13,TCL02,iste simdi rabbin eli sana karsi kalkti kor olacaksin bir sure gun isigini goremeyeceksin
5324,ACT,13,TCL02,o anda adamin uzerine bir sis bir karanlik coktu dort donerek elinden tutup kendisine yol gosterecek birilerini aramaya basladi
5325,ACT,13,TCL02,olanlari goren vali rable ilgili ogretiyi hayranlikla karsiladi ve iman etti
5326,ACT,13,TCL02,pavlusla beraberindekiler baftan denize acilip pamfilya bolgesinin perge kentine gittiler yuhanna ise onlari birakip yerusalime dondu
5327,ACT,13,TCL02,onlar pergeden yollarina devam ederek pisidya sinirindaki antakyaya gectiler
5328,ACT,13,TCL02,sabat gunu
5329,ACT,13,TCL02,havraya girip oturdular
5330,ACT,13,TCL02,kutsal yasa ve peygamberlerin yazilari okunduktan sonra havranin yoneticileri onlara kardesler halka verecek bir ogudunuz varsa buyurun konusun diye haber yolladilar
5331,ACT,13,TCL02,pavlus ayaga kalkti eliyle bir isaret yaparak ey israilliler ve
5332,ACT,13,TCL02,tanridan korkan
5333,ACT,13,TCL02,yabancilar dinleyin dedi
5334,ACT,13,TCL02,bu halkin yani israilin tanrisi bizim atalarimizi secti ve misirda gurbette yasadiklari sure icinde onlari buyuk bir ulus yapti sonra guclu eliyle onlari oradan cikardi colde yaklasik kirk yil onlara katlandi
5335,ACT,13,TCL02,
5336,ACT,13,TCL02,kenan ulkesinde yenilgiye ugrattigi yedi ulusun topraklarini israil halkina miras olarak verdi butun bunlar asagi yukari dort yuz elli yil surdu
5337,ACT,13,TCL02,sonra tanri peygamber samuelin zamanina kadar onlar icin hakimler yetistirdi
5338,ACT,13,TCL02,halk bir kral isteyince tanri onlar icin benyamin oymagindan kis oglu saulu yetistirdi saul kirk yil krallik yapti
5339,ACT,13,TCL02,tanri onu tahttan indirdikten sonra onlara kral olarak davutu basa gecirdi onunla ilgili su taniklikta bulundu isay oglu davutu gonlume uygun bir adam olarak gordum o her istedigimi yapar
5340,ACT,13,TCL02,tanri verdigi sozu tutarak bu adamin soyundan israile bir kurtarici isayi gonderdi
5341,ACT,13,TCL02,isanin gelisinden once yahya butun israil halkini tovbe edip
5342,ACT,13,TCL02,vaftiz
5343,ACT,13,TCL02,olmaya cagirdi
5344,ACT,13,TCL02,yahya gorevini tamamlarken soyle diyordu beni kim saniyorsunuz ben
5345,ACT,13,TCL02,mesih
5346,ACT,13,TCL02,degilim ama o benden sonra geliyor ben onun ayagindaki carigin bagini cozmeye bile layik degilim
5347,ACT,13,TCL02,kardesler ibrahimin soyundan gelenler ve tanridan korkan yabancilar bu kurtulus bildirisi bize gonderildi
5348,ACT,13,TCL02,cunku yerusalimde yasayanlar ve onlarin yoneticileri isayi reddettiler onu mahkum etmekle her sabat gunu okunan peygamberlerin sozlerini yerine getirmis oldular
5349,ACT,13,TCL02,onda olum cezasini gerektiren herhangi bir suc bulamadiklari halde pilatustan onun idamini istediler
5350,ACT,13,TCL02,onunla ilgili yazilanlarin hepsini yerine getirdikten sonra onu carmihtan indirip mezara koydular
5351,ACT,13,TCL02,ama tanri onu olumden diriltti
5352,ACT,13,TCL02,isa daha once kendisiyle birlikte celileden yerusalime gelenlere gunlerce gorundu bu kisiler simdi halka onun tanikligini yapiyor
5353,ACT,13,TCL02,biz de size mujdeyi duyuruyoruz tanri isayi diriltmekle atalarimiza verdigi sozu onlarin cocuklari olan bizler icin yerine getirmistir ikinci mezmurda da yazildigi gibi
5354,ACT,13,TCL02,sen benim oglumsun
5355,ACT,13,TCL02,bugun ben sana baba oldum
5356,ACT,13,TCL02,tanri onu asla curumemek uzere olumden dirilttigini su sozlerle belirtmistir
5357,ACT,13,TCL02,size davuta soz verdigim
5358,ACT,13,TCL02,kutsal ve guvenilir nimetleri verecegim
5359,ACT,13,TCL02,bunun icin baska bir yerde de soyle der
5360,ACT,13,TCL02,kutsalinin curumesine izin vermeyeceksin
5361,ACT,13,TCL02,davut kendi kusaginda tanrinin amaci uyarinca hizmet ettikten sonra gozlerini yasama kapadi atalari gibi gomuldu ve bedeni curuyup gitti
5362,ACT,13,TCL02,oysa tanrinin dirilttigi kisinin bedeni curumedi
5363,ACT,13,TCL02,dolayisiyla kardesler sunu bilin ki gunahlarin bu kisi araciligiyla bagislanacagi size duyurulmus bulunuyor soyle ki iman eden herkes musanin yasasiyla aklanamadiginiz her suctan onun araciligiyla aklanir
5364,ACT,13,TCL02,dikkat edin peygamberlerin sozunu ettigi su durum sizin basiniza gelmesin
5365,ACT,13,TCL02,bakin siz alay edenler
5366,ACT,13,TCL02,saskina donup yok olun
5367,ACT,13,TCL02,sizin gununuzde bir is yapiyorum
5368,ACT,13,TCL02,oyle bir is ki biri size anlatsa inanmazsiniz
5369,ACT,13,TCL02,pavlusla barnaba havradan cikarken halk onlari bir sonraki sabat gunu ayni konular uzerinde konusmaya cagirdi
5370,ACT,13,TCL02,havradaki topluluk dagilinca yahudiler ve yahudilige donup tanriya tapan yabancilardan bircogu onlarin ardindan gitti pavlusla barnaba onlarla konusarak onlari devamli tanrinin lutfunda yasamaya ozendirdiler
5371,ACT,13,TCL02,ertesi sabat gunu kent halkinin hemen hemen tumu rabbin sozunu dinlemek icin toplanmisti
5372,ACT,13,TCL02,kalabaligi goren yahudiler buyuk bir kiskanclik icinde kufurlerle pavlusun soylediklerine karsi ciktilar
5373,ACT,13,TCL02,pavlusla barnaba ise cesaretle karsilik verdiler tanrinin sozunu ilk once size bildirmemiz gerekiyordu siz onu reddettiginize ve kendinizi sonsuz yasama layik gormediginize gore biz simdi oteki uluslara gidiyoruz
5374,ACT,13,TCL02,cunku rab bize soyle buyurmustur
5375,ACT,13,TCL02,yeryuzunun dort bucagina kurtulus goturmen icin
5376,ACT,13,TCL02,seni uluslara isik yaptim
5377,ACT,13,TCL02,oteki uluslardan olanlar bunu isitince sevindiler ve rabbin sozunu yucelttiler sonsuz yasam icin belirlenmis olanlarin hepsi iman etti
5378,ACT,13,TCL02,boylece rabbin sozu butun yorede yayildi
5379,ACT,13,TCL02,ne var ki yahudiler tanriya tapan saygin kadinlarla kentin ileri gelen erkeklerini kiskirttilar pavlusla barnabaya karsi bir baski hareketi baslatip onlari bolge sinirlarinin disina attilar
5380,ACT,13,TCL02,bunun uzerine pavlusla barnaba onlara bir uyari olsun diye ayaklarinin tozunu silkerek konyaya gittiler
5381,ACT,13,TCL02,ogrenciler ise sevinc ve kutsal ruhla doluydu
5382,ACT,14,TCL02,ayni sekilde konyada da yahudilerin havrasina giren pavlusla barnaba oyle etkili konustular ki hem yahudilerden hem de
5383,ACT,14,TCL02,grekler
5384,ACT,14,TCL02,den cok kisi iman etti
5385,ACT,14,TCL02,ama inanmayan yahudiler oteki uluslardan olanlari kardeslere karsi kiskirtarak zihinlerini bulandirdilar
5386,ACT,14,TCL02,orada uzunca bir sure kalan pavlusla barnaba rab hakkinda cesaretle konusuyorlardi rab de onlara belirtiler ve harikalar yapma gucu vererek kendi lutfunu aciklayan bildiriyi dogruladi
5387,ACT,14,TCL02,kent halki ikiye bolundu bazilari yahudilerin bazilari da elcilerin tarafini tuttu
5388,ACT,14,TCL02,yahudilerle oteki uluslardan olanlar ve bunlarin yoneticileri elcileri hirpalayip tasa tutmak icin duzen kurdular
5389,ACT,14,TCL02,bunu ogrenen pavlusla barnaba likaonyanin listra ve derbe kentlerine ve cevre bolgeye kacarak oralarda da mujdeyi yaydilar
5390,ACT,14,TCL02,listrada ayaklari tutmayan bir adam vardi dogustan koturumdu hic yuruyemiyordu
5391,ACT,14,TCL02,pavlusun soylediklerini dinledi onu dikkatle suzen pavlus iyilestirilebilecegine imani oldugunu gorerek yuksek sesle ona kalk ayaklarinin uzerinde dur dedi adam yerinden firlayip yurumeye basladi
5392,ACT,14,TCL02,pavlusun ne yaptigini goren halk likaonya dilinde tanrilar insan kiligina girip yanimiza inmis diye haykirdi
5393,ACT,14,TCL02,barnabaya zeus
5394,ACT,14,TCL02,pavlusa da konusmada onculuk ettigi icin hermes
5395,ACT,14,TCL02,adini taktilar
5396,ACT,14,TCL02,kentin hemen disinda bulunan zeus tapinaginin kahini kent kapilarina bogalar ve celenkler getirdi halkla birlikte elcilere kurban sunmak istedi
5397,ACT,14,TCL02,ne var ki elciler barnabayla pavlus bunu duyunca giysilerini yirtarak kalabaligin icine daldilar
