,book,chapt,version,text
7340,2CO,11,TCL02,rab isanin sonsuza dek ovulecek olan tanrisi ve babasi biliyor ki yalan soylemiyorum
7341,2CO,11,TCL02,samda kral aretasin valisi beni yakalatmak icin kenti denetim altina almisti
7342,2CO,11,TCL02,ama beni kufe icinde surdaki bir pencereden sarkittilar boylece onun elinden siyrilip kactim
7343,2CO,12,TCL02,yararli olmasa da ovunmek gereklidir simdi gorumlere ve rabbin vahiylerine geleyim
7344,2CO,12,TCL02,on dort yil once alinip ucuncu goge goturulmus bir mesih izleyicisi taniyorum bu bedensel olarak mi yoksa beden disinda mi oldu bilmiyorum tanri bilir
7345,2CO,12,TCL02,evet bu adamin cennete goturuldugunu biliyorum bu bedensel olarak mi yoksa bedenden ayri mi oldu bilmiyorum tanri bilir orada dille anlatilamaz insanin soylemesi yasak olan sozler isitti
7346,2CO,12,TCL02,boyle biriyle ovunecegim ama kendimle ilgili olarak gucsuzluklerimden baska bir seyle ovunmeyecegim
7347,2CO,12,TCL02,ovunmek istesem bile akilsiz olmayacagim cunku gercegi soylemis olacagim ama kimse beni gordugunden ya da isittiginden daha ustun gormesin diye ovunmekten kaciniyorum
7348,2CO,12,TCL02,aldigim vahiylerin ustunluguyle gururlanmayayim diye bana bedende bir diken beni yumruklamak icin seytanin bir melegi verildi gururlanmayayim diye
7349,2CO,12,TCL02,bundan kurtulmak icin rabbe uc kez yalvardim
7350,2CO,12,TCL02,ama o bana lutfum sana yeter cunku gucum gucsuzlukte tamamlanir dedi iste mesihin gucu icimde bulunsun diye gucsuzluklerimle sevinerek daha cok ovunecegim
7351,2CO,12,TCL02,bu nedenle mesih ugruna gucsuzlukleri hakaretleri zorluklari zulumleri ve darliklari sevincle karsiliyorum cunku ne zaman gucsuzsem o zaman gucluyum
7352,2CO,12,TCL02,akilsiz biri gibi davrandim ama beni buna siz zorladiniz aslinda beni siz tavsiye etmeliydiniz cunku bir hic isem de sozum ona ustun elcilerden hic de asagi degilim
7353,2CO,12,TCL02,elciligimin kanitlari aranizda buyuk bir sabirla belirtiler harikalar ve mucizelerle gosterildi
7354,2CO,12,TCL02,size yuk olmayisimdan baska obur kiliselerden ne eksiginiz var ki bu haksizligimi bagislayin
7355,2CO,12,TCL02,iste ucuncu kez yaniniza gelmeye hazirim ve size yuk olmayacagim cunku sizde olani degil sizi istiyorum cocuklarin anne babalari icin degil anne babalarin cocuklari icin para biriktirmesi gerekir
7356,2CO,12,TCL02,ben de canlariniz ugruna malimi da kendimi de seve seve harcayacagim sizi daha cok seversem daha az mi sevilecegim
7357,2CO,12,TCL02,oyle olsun ben size yuk olmadim ama kurnaz biri oldugumdan sizi hileyle elde etmisim
7358,2CO,12,TCL02,size gonderdigim adamlardan biri araciligiyla sizi somurdum mu
7359,2CO,12,TCL02,titusu size gelmeye isteklendirdim ve obur kardesi de onunla birlikte gonderdim titus sizi somurmedi degil mi ayni ruhla davranmadik mi ayni yolu izlemedik mi
7360,2CO,12,TCL02,bunca zamandir onunuzde kendimizi savundugumuzu mu dusunuyorsunuz tanrinin onunde mesihe ait kisiler olarak konusuyoruz sevgili kardesler yaptigimiz her sey sizin gelismeniz icindir
7361,2CO,12,TCL02,cunku geldigimde sizi istedigim durumda bulamayacagimdan korkuyorum sizler de beni istediginiz durumda bulamayabilirsiniz aranizda cekisme kiskanclik ofke bencil tutkular iftira dedikodu boburlenme kargasa olmasindan korkuyorum
7362,2CO,12,TCL02,korkarim size tekrar geldigimde tanrim beni onunuzde utandiracak daha once gunah isleyip de kapildiklari pisliklerden fuhus ve sefahatten tovbe etmeyen bircoklari icin yas tutacagim
7363,2CO,13,TCL02,bu yaniniza ucuncu gelisim olacak her suclama iki ya da uc tanigin tanikligiyla dogrulanmalidir
7364,2CO,13,TCL02,daha once aranizda ikinci kez bulundugumda gecmiste gunah islemis olanlarla onlarin disinda kalanlarin hepsine soylemistim simdi sizden uzaktayken de yineliyorum tekrar yaniniza gelirsem hic kimseyi esirgemeyecegim
7365,2CO,13,TCL02,mesihin benim araciligimla konustuguna iliskin kanit istiyorsunuz mesih size karsi gucsuz degildir onun gucu sizde etkindir
7366,2CO,13,TCL02,gucsuzluk icinde carmiha gerildigi halde simdi tanrinin gucuyle yasiyor biz de onda gucsuz oldugumuz halde tanrinin gucu sayesinde onunla birlikte sizin yarariniza yasayacagiz
7367,2CO,13,TCL02,iman yolunda olup olmadiginizi anlamak icin kendinizi sinayip yoklayin isa mesihin icinizde oldugunu bilmiyor musunuz yoksa sinavdan basarisiz cikarsiniz
7368,2CO,13,TCL02,umarim bizim basarisizliga ugramadigimizi anlayacaksiniz
7369,2CO,13,TCL02,kotu bir sey yapmamaniz icin tanriya dua ediyoruz dilegimiz bizim sinavi gecmis gorunmemiz degil biz sinavda basarisiz gorunsek bile sizin iyi olani yapmanizdir
7370,2CO,13,TCL02,cunku gercege karsi degil ancak gercek ugruna bir sey yapabiliriz
7371,2CO,13,TCL02,biz gucsuz sizse gucluyken seviniyoruz yetkin olmaniz icin de dua ediyoruz
7372,2CO,13,TCL02,rabbin yikmak degil gelistirmek icin bana verdigi yetkiyi yaniniza geldigimde sert bicimde kullanmak zorunda kalmayayim diye bunlari aranizda degilken yaziyorum
7373,2CO,13,TCL02,son olarak hosca kalin kardeslerim yasantinizi duzeltin cagrima kulak verin dusuncelerinizde birlik olun esenlik icinde yasayin sevgi ve esenlik kaynagi olan tanri sizinle birlikte olacaktir
7374,2CO,13,TCL02,birbirinizi kutsal opusle selamlayin
7375,2CO,13,TCL02,butun kutsallar size selam eder
7376,2CO,13,TCL02,rab isa mesihin lutfu tanrinin sevgisi ve kutsal ruhun paydasligi hepinizle birlikte olsun
7377,GAL,1,TCL02,insanlarca ya da insan araciligiyla degil isa mesih ve onu olumden dirilten baba tanri araciligiyla elci atanan ben pavlustan ve benimle birlikte olan butun kardeslerden galatyadaki
7378,GAL,1,TCL02,kilise
7379,GAL,1,TCL02,lere selam
7380,GAL,1,TCL02,babamiz tanridan ve rab isa mesihten sizlere lutuf ve esenlik olsun
7381,GAL,1,TCL02,mesih babamiz tanrinin istegine uyarak bizi simdiki kotu cagdan kurtarmak icin gunahlarimiza karsilik kendini feda etti
7382,GAL,1,TCL02,tanriya sonsuzlara dek yucelik olsun amin
7383,GAL,1,TCL02,sizi mesihin lutfuyla cagirani birakip degisik bir mujdeye boylesine carcabuk donmenize sasiyorum
7384,GAL,1,TCL02,gercekte baska bir mujde yoktur ancak aklinizi karistirip mesihin mujdesini carpitmak isteyenler vardir
7385,GAL,1,TCL02,ister biz ister gokten bir melek size bildirdigimize ters dusen bir mujde bildirirse lanet olsun ona
7386,GAL,1,TCL02,daha once soyledigimizi simdi yine soyluyorum bir kimse size kabul ettiginize ters dusen bir mujde bildirirse ona lanet olsun
7387,GAL,1,TCL02,simdi ben insanlarin onayini mi tanrinin onayini mi ariyorum yoksa insanlari mi hosnut etmeye calisiyorum eger hala insanlari hosnut etmek isteseydim mesihin kulu olmazdim
7388,GAL,1,TCL02,kardeslerim yaydigim mujdenin insandan kaynaklanmadigini bilmenizi istiyorum
7389,GAL,1,TCL02,cunku ben onu insandan almadim kimseden de ogrenmedim bunu bana isa mesih vahiy yoluyla acikladi
7390,GAL,1,TCL02,yahudi dinine bagli oldugum zaman nasil bir yasam surdugumu duydunuz tanrinin
7391,GAL,1,TCL02,kilise
7392,GAL,1,TCL02,sine alabildigine zulmediyor onu kirip geciriyordum
7393,GAL,1,TCL02,yahudi dininde yasitim olan soydaslarimin bircogundan daha ilerideydim atalarimin geleneklerini savunmakta cok daha gayretliydim
7394,GAL,1,TCL02,ama beni daha annemin rahmindeyken secip lutfuyla cagiran tanri uluslara mujdelemem icin oglunu bana gostermeye razi olunca hemen insanlara
7395,GAL,1,TCL02,danismadim
7396,GAL,1,TCL02,yerusalim
7397,GAL,1,TCL02,e benden once elci olanlarin yanina da gitmedim arabistana gittim sonra yine sama dondum
7398,GAL,1,TCL02,bundan uc yil sonra
7399,GAL,1,TCL02,kefas
7400,GAL,1,TCL02,la tanismak uzere yerusalime gittim on bes gun onun yaninda kaldim
7401,GAL,1,TCL02,obur elcilerden hicbirini gormedim yalniz rab isanin kardesi yakupu gordum
7402,GAL,1,TCL02,bakin size yazdiklarimin yalan olmadigini tanrinin onunde belirtiyorum
7403,GAL,1,TCL02,sonra suriye ve kilikya bolgelerine gittim
7404,GAL,1,TCL02,yahudiyenin mesihe ait kiliseleri beni sahsen tanimiyorlardi
7405,GAL,1,TCL02,yalniz bir zamanlar bize zulmeden adam onceleri yikmaya calistigi imani simdi yayiyor dendigini duymuslardi
7406,GAL,1,TCL02,boylece benden oturu tanriyi yuceltiyorlardi
7407,GAL,2,TCL02,on dort yil aradan sonra titusu da yanima alip barnabayla birlikte yine yerusalime gittim
7408,GAL,2,TCL02,vahiy uyarinca gittim bos yere kosmayayim ya da kosmus olmayayim diye
7409,GAL,2,TCL02,oteki uluslar
7410,GAL,2,TCL02,arasinda yaydigim mujdeyi ozel olarak ileri gelenlere sundum
7411,GAL,2,TCL02,benimle birlikte olan titus bile
7412,GAL,2,TCL02,grek
7413,GAL,2,TCL02,olmasina karsin sunnet edilmeye zorlanmadi
7414,GAL,2,TCL02,ne var ki isa mesihte sahip oldugumuz ozgurlugu el altindan ogrenmek ve boylece bizi kolelestirmek icin gizlice aramiza sizan sahte kardesler vardi
7415,GAL,2,TCL02,mujde gercegi surekli sizinle kalsin diye bir an bile onlara boyun egip teslim olmadik
7416,GAL,2,TCL02,ama ileri gelenler ne olduklari bence onemli degil tanri insanlar arasinda ayrim yapmaz evet bu ileri gelenler soylediklerime bir sey katmadilar
7417,GAL,2,TCL02,tam tersine mujdeyi
7418,GAL,2,TCL02,sunnetli
7419,GAL,2,TCL02,lere bildirme isi nasil petrusa verildiyse
7420,GAL,2,TCL02,sunnetsiz
7421,GAL,2,TCL02,lere bildirme isinin de bana verildigini gorduler
7422,GAL,2,TCL02,cunku sunnetlilere elcilik etmesi icin petrusta etkin olan tanri oteki uluslara elcilik etmem icin bende de etkin oldu
7423,GAL,2,TCL02,toplulugun direkleri sayilan yakup
7424,GAL,2,TCL02,kefas
7425,GAL,2,TCL02,ve yuhanna bana bagislanan lutfu sezince paydasligimizin isareti olarak bana ve barnabaya sag ellerini uzattilar oteki uluslara bizlerin yahudilere kendilerinin gitmesini uygun gorduler
7426,GAL,2,TCL02,ancak yoksullari animsamamizi istediler zaten ben de bunu yapmaya gayret ediyordum
7427,GAL,2,TCL02,ne var ki
7428,GAL,2,TCL02,kefas
7429,GAL,2,TCL02,antakyaya geldigi zaman suclu oldugu icin ona acikca karsi geldim
7430,GAL,2,TCL02,cunku yakupun yanindan bazi adamlar gelmeden once kefas
7431,GAL,2,TCL02,oteki uluslar
7432,GAL,2,TCL02,dan olanlarla birlikte yemek yerdi ama o adamlar gelince sunnet yanlilarindan korkarak
7433,GAL,2,TCL02,sunnetsiz
7434,GAL,2,TCL02,lerden uzaklasti onlarla yemek yemez oldu
7435,GAL,2,TCL02,obur yahudiler de onun gibi ikiyuzluluk ettiler sonunda barnaba bile onlarin ikiyuzlulugune kapildi
7436,GAL,2,TCL02,mujde gercegine uygun davranmadiklarini gorunce hepsinin onunde kefasa soyle dedim yahudi oldugun halde yahudi gibi degil oteki uluslardan biri gibi yasiyorsun nasil olur da uluslari yahudi gibi yasamaya zorlarsin
7437,GAL,2,TCL02,dogustan yahudi olan bizler oteki uluslardan olan gunahlilar degiliz
7438,GAL,2,TCL02,yine de insanin
7439,GAL,2,TCL02,kutsal yasa
7440,GAL,2,TCL02,nin gereklerini yaparak degil isa mesihe iman ederek aklandigini biliyoruz bunun icin biz de yasanin gereklerini yaparak degil mesihe iman ederek aklanalim diye mesih isaya iman ettik cunku hic kimse yasanin gereklerini yaparak aklanmaz
7441,GAL,2,TCL02,mesihte aklanmak isterken kendimiz gunahli cikarsak mesih gunahin yardakcisi mi olur kesinlikle hayir
7442,GAL,2,TCL02,yiktigimi yeniden kurarsam yasayi cignedigimi kanitlamis olurum
7443,GAL,2,TCL02,cunku ben tanri icin yasamak uzere yasa araciligiyla yasa karsisinda oldum
7444,GAL,2,TCL02,mesihle birlikte carmiha gerildim artik ben yasamiyorum mesih bende yasiyor simdi bedende surdurdugum yasami beni seven ve benim icin kendini feda eden tanri ogluna imanla surduruyorum
7445,GAL,2,TCL02,tanrinin lutfunu gecersiz saymis degilim cunku aklanma yasa araciligiyla saglanabilseydi o zaman mesih bos yere olmus olurdu
7446,GAL,3,TCL02,ey akilsiz galatyalilar sizi kim buyuledi isa mesih carmiha gerilmis olarak gozlerinizin onunde tasvir edilmedi mi
7447,GAL,3,TCL02,sizden yalniz sunu ogrenmek istiyorum kutsal ruhu yasanin gereklerini yaparak mi yoksa duyduklariniza iman ederek mi aldiniz
7448,GAL,3,TCL02,bu kadar akilsiz misiniz ruhla basladiktan sonra simdi insan cabasiyla mi bitirmeye calisiyorsunuz
7449,GAL,3,TCL02,bos yere mi bu kadar aci cektiniz gercekten bosuna miydi
7450,GAL,3,TCL02,size kutsal ruhu veren ve aranizda mucizeler yaratan tanri bunu yasanin gereklerini yaptiginiz icin mi yoksa duyduklariniza iman ettiginiz icin mi yapiyor
7451,GAL,3,TCL02,ornegin ibrahim tanriya iman etti boylece aklanmis sayildi
7452,GAL,3,TCL02,
7453,GAL,3,TCL02,oyleyse sunu bilin ki ibrahimin gercek ogullari iman edenlerdir
7454,GAL,3,TCL02,kutsal yazi tanrinin
7455,GAL,3,TCL02,oteki uluslar
7456,GAL,3,TCL02,i imanlarina gore aklayacagini onceden gorerek ibrahime butun uluslar senin araciliginla kutsanacak mujdesini onceden verdi
7457,GAL,3,TCL02,boylece iman edenler iman etmis olan ibrahimle birlikte kutsanirlar
7458,GAL,3,TCL02,yasanin gereklerini yapmis olmaya guvenenlerin hepsi lanet altindadir cunku soyle yazilmistir yasa kitabinda yazili olan her seyi surekli yerine getirmeyen herkes lanetlidir
7459,GAL,3,TCL02,tanri katinda hic kimsenin yasayla aklanmadigi aciktir cunku imanla aklanan yasayacaktir
7460,GAL,3,TCL02,
7461,GAL,3,TCL02,yasa imana dayali degildir tersine yasanin gereklerini yapan onlar sayesinde yasayacaktir
7462,GAL,3,TCL02,ibrahime saglanan kutsama mesih isa araciligiyla uluslara saglansin ve bizler vaat edilen ruhu imanla alalim diye mesih bizim icin lanetlenerek bizi yasanin lanetinden kurtardi cunku agac uzerine asilan herkes lanetlidir diye yazilmistir
7463,GAL,3,TCL02,kardesler insan yasamindan bir ornek vereyim insanlar arasinda yapilmis bile olsa onaylanmis bir antlasmayi kimse gecersiz saymaz ona bir sey eklemez
7464,GAL,3,TCL02,vaatler ibrahime ve soyundan olana verildi tanri bircok kisiden soz ediyormus gibi ve soyundan olanlara demiyor soyundan olana demekle tek bir kisiden yani mesihten soz ediyor
7465,GAL,3,TCL02,sunu demek istiyorum dort yuz otuz yil sonra gelen yasa tanrinin onceden onayladigi antlasmayi gecersiz kilmaz vaadi ortadan kaldirmaz
7466,GAL,3,TCL02,cunku miras yasaya bagliysa artik vaade bagli degildir ama tanri mirasi ibrahime vaatle bagislamistir
7467,GAL,3,TCL02,oyleyse yasanin amaci neydi yasa suclari ortaya cikarmak icin antlasmaya eklendi vaadi alan ve ibrahimin soyundan olan kisi
7468,GAL,3,TCL02,gelene dek yururlukte kalacakti melekler yoluyla bir araci eliyle duzenlendi
7469,GAL,3,TCL02,araci tek bir tarafa ait degildir tanri ise birdir
7470,GAL,3,TCL02,oyleyse kutsal yasa tanrinin vaatlerine aykiri midir kesinlikle hayir cunku yasam saglayabilen bir yasa verilseydi elbette insanlar yasayla aklanirdi
7471,GAL,3,TCL02,oysa isa mesihe olan imana
7472,GAL,3,TCL02,dayanan vaat iman edenlere verilsin diye kutsal yazi butun dunyayi gunahin tutsagi ilan ediyor
7473,GAL,3,TCL02,bu iman gelmeden once yasa altinda hapsedilmistik gelecek iman aciklanincaya dek yasanin tutuklusuyduk
7474,GAL,3,TCL02,yani imanla aklanalim diye mesihin gelisine dek yasa egitmenimiz oldu
7475,GAL,3,TCL02,ama iman gelmis oldugundan artik yasanin denetiminde degiliz
7476,GAL,3,TCL02,cunku mesih isaya iman ettiginiz icin hepiniz tanrinin ogullarisiniz
7477,GAL,3,TCL02,vaftiz
7478,GAL,3,TCL02,de mesihle birlesenlerinizin hepsi mesihi giyindi
7479,GAL,3,TCL02,artik ne yahudi ne
7480,GAL,3,TCL02,grek
7481,GAL,3,TCL02,ne kole ne ozgur ne erkek ne disi ayrimi var hepiniz mesih isada birsiniz
7482,GAL,3,TCL02,eger mesihe aitseniz ibrahimin soyundansiniz vaade gore de mirascisiniz
7483,GAL,4,TCL02,sunu demek istiyorum mirasci her seyin sahibiyse de cocuk oldugu surece koleden farksizdir
7484,GAL,4,TCL02,babasinin belirledigi zamana dek vasilerin vekillerin gozetimi altindadir
7485,GAL,4,TCL02,bunun gibi biz de ruhsal yonden cocukken dunyanin temel ilkelerine bagli yasayan kolelerdik
7486,GAL,4,TCL02,ama zaman dolunca tanri yasa altinda olanlari ozgurluge kavusturmak icin kadindan dogan yasa altinda dogan oz oglunu gonderdi oyle ki bizler ogulluk hakkini alalim
7487,GAL,4,TCL02,ogullar oldugunuz icin tanri oz oglunun abba
7488,GAL,4,TCL02,baba diye seslenen ruhunu yureklerinize
7489,GAL,4,TCL02,gonderdi
7490,GAL,4,TCL02,bu nedenle artik kole degil ogullarsiniz ogullar oldugunuz icin de tanri sizi ayni zamanda mirasci yapti
7491,GAL,4,TCL02,ne var ki eskiden tanriyi tanimadiginiz zamanlarda gercek olmayan tanrilara kolelik ettiniz
7492,GAL,4,TCL02,simdiyse tanriyi tanidiniz daha dogrusu tanri tarafindan tanindiniz oyleyse nasil oluyor da bu degersiz etkisiz ilkelere donuyorsunuz yeniden onlarin kolesi mi olmak istiyorsunuz
7493,GAL,4,TCL02,ozel gunler aylar mevsimler yillar kutluyorsunuz
7494,GAL,4,TCL02,sizin icin korkuyorum yoksa ugrunuza bos yere mi emek verdim
7495,GAL,4,TCL02,kardesler size yalvariyorum benim gibi olun cunku ben de sizin gibi oldum bana hic haksizlik etmediniz
7496,GAL,4,TCL02,bildiginiz gibi mujdeyi size ilk kez bedensel hastaligim nedeniyle bildirmistim
7497,GAL,4,TCL02,bedensel durumum sizin icin cetin bir deneme oldugu halde beni ne hor gordunuz ne de reddettiniz tanrinin bir melegini hatta mesih isayi kabul eder gibi kabul ettiniz beni
7498,GAL,4,TCL02,simdi o sevincinize ne oldu sizin icin taniklik ederim ki elinizden gelse gozlerinizi oyar bana verirdiniz
7499,GAL,4,TCL02,peki size gercegi soyledigim icin dusmaniniz mi oldum
7500,GAL,4,TCL02,baskalari sizi kazanmaya gayret ediyor ama niyetleri iyi degil kendileri icin gayret edesiniz diye sizi bizden ayirmak istiyorlar
7501,GAL,4,TCL02,niyet iyiyse yalniz aranizda oldugum zaman degil her zaman gayretli olmak iyidir
7502,GAL,4,TCL02,cocuklarim mesih sizde bicimleninceye dek sizin icin yine dogum agrisi cekiyorum
7503,GAL,4,TCL02,simdi yaninizda bulunmayi ve sesimin tonunu degistirmeyi isterdim bu halinize sasiyorum
7504,GAL,4,TCL02,kutsal yasa altinda yasamak isteyen sizler soyleyin bana yasanin ne dedigini bilmiyor musunuz
7505,GAL,4,TCL02,ibrahimin biri kole biri de ozgur kadindan iki oglu oldugu yazilidir
7506,GAL,4,TCL02,kole kadindan olan olagan yoldan ozgur kadindan olansa vaat sonucu dogdu
7507,GAL,4,TCL02,burada bir benzetme vardir bu kadinlar iki antlasmayi simgelemektedir biri sina dagindandir kole olacak cocuklar dogurur bu hacerdir
7508,GAL,4,TCL02,hacer arabistandaki sina dagini simgeler simdiki yerusalimin karsiligidir cunku cocuklariyla birlikte kolelik etmektedir
7509,GAL,4,TCL02,oysa goksel yerusalim ozgurdur annemiz odur
7510,GAL,4,TCL02,nitekim soyle yazilmistir
7511,GAL,4,TCL02,sevin cocuk dogurmayan ey kisir kadin
7512,GAL,4,TCL02,dogum agrisi nedir bilmeyen sen
7513,GAL,4,TCL02,yukselt sesini haykir
7514,GAL,4,TCL02,cunku terk edilmis kadinin
7515,GAL,4,TCL02,kocasi olandan daha cok cocugu var
7516,GAL,4,TCL02,kardesler ishak gibi sizler de vaat cocuklarisiniz
7517,GAL,4,TCL02,olagan yoldan dogan kutsal ruha gore dogana o zaman nasil zulmettiyse simdi de oyle oluyor
7518,GAL,4,TCL02,ama kutsal yazi ne diyor
7519,GAL,4,TCL02,kole kadinla oglunu kov
7520,GAL,4,TCL02,cunku kole kadinin oglu
7521,GAL,4,TCL02,ozgur kadinin ogluyla birlikte
7522,GAL,4,TCL02,asla mirasa ortak olmayacaktir
7523,GAL,4,TCL02,iste boyle kardesler bizler kole kadinin degil ozgur kadinin cocuklariyiz
7524,GAL,5,TCL02,mesih bizi ozgur olalim diye ozgur kildi bunun icin dayanin bir daha kolelik boyunduruguna girmeyin
7525,GAL,5,TCL02,bakin ben pavlus size diyorum ki sunnet olursaniz mesihin size hic yarari olmaz
7526,GAL,5,TCL02,sunnet edilen her adami bir daha uyariyorum kutsal yasanin tumunu yerine getirmek zorundadir
7527,GAL,5,TCL02,yasa araciligiyla aklanmaya calisan sizler mesihten ayrildiniz tanrinin lutfundan uzak dustunuz
7528,GAL,5,TCL02,ama biz aklanmanin verdigi umudun
7529,GAL,5,TCL02,gerceklesmesini ruha dayanarak imanla bekliyoruz
7530,GAL,5,TCL02,mesih isada ne sunnetliligin ne de sunnetsizligin yarari vardir yararli olan sevgiyle etkisini gosteren imandir
7531,GAL,5,TCL02,iyi kosuyordunuz sizi gercege uymaktan kim alikoydu
7532,GAL,5,TCL02,buna kanmaniz sizi cagiranin istegi degildir
7533,GAL,5,TCL02,azicik maya butun hamuru kabartir
7534,GAL,5,TCL02,baska turlu dusunmeyeceginize iliskin rabde size guvenim var ama aklinizi karistiran kim olursa olsun cezasini cekecektir
7535,GAL,5,TCL02,bana gelince kardesler eger hala sunneti savunuyor olsaydim bugune dek baski gorur muydum oyle olsaydi carmih engeli ortadan kalkardi
7536,GAL,5,TCL02,aklinizi celenler keske kendilerini hadim etseler
7537,GAL,5,TCL02,kardesler siz ozgur olmaya cagrildiniz ancak ozgurluk benlik icin firsat olmasin birbirinize sevgiyle hizmet edin
7538,GAL,5,TCL02,butun kutsal yasa tek bir sozde ozetlenmistir komsunu kendin gibi seveceksin
7539,GAL,5,TCL02,ama birbirinizi isirip yiyorsaniz dikkat edin birbirinizi yok etmeyesiniz
7540,GAL,5,TCL02,sunu demek istiyorum kutsal ruhun yonetiminde yasayin o zaman benligin tutkularini asla yerine getirmezsiniz
7541,GAL,5,TCL02,cunku benlik ruha ruh da benlige aykiri olani arzular bunlar birbirine karsittir sonuc olarak istediginizi yapamiyorsunuz
7542,GAL,5,TCL02,ruhun yonetimindeyseniz yasaya bagimli degilsiniz
7543,GAL,5,TCL02,benligin isleri bellidir bunlar fuhus pislik sefahat putperestlik buyuculuk dusmanlik cekisme kiskanclik ofke bencil tutkular ayriliklar bolunmeler cekememezlik sarhosluk cilgin eglenceler ve benzeri seylerdir sizi daha once uyardigim gibi yine uyariyorum boyle davrananlar tanri egemenligini miras alamayacaklar
7544,GAL,5,TCL02,ruhun urunuyse sevgi sevinc esenlik sabir sefkat iyilik baglilik yumusak huyluluk ve ozdenetimdir bu tur nitelikleri yasaklayan yasa yoktur
7545,GAL,5,TCL02,mesih isaya ait olanlar benligi tutku ve arzulariyla birlikte carmiha germislerdir
7546,GAL,5,TCL02,ruh sayesinde yasiyorsak ruhun izinde yuruyelim
7547,GAL,5,TCL02,bos yere ovunen birbirine meydan okuyan birbirini kiskanan kisiler olmayalim
7548,GAL,6,TCL02,kardesler eger biri suc islerken yakalanirsa ruhsal olan sizler boyle birini yumusak ruhla yola getirin siz de ayartilmamak icin kendinizi kollayin
7549,GAL,6,TCL02,birbirinizin agir yukunu tasiyin boylece mesihin yasasini yerine getirirsiniz
7550,GAL,6,TCL02,kisi bir hicken kendini bir sey saniyorsa kendini aldatmis olur
7551,GAL,6,TCL02,herkes kendi yaptiklarini denetlesin o zaman baskasinin yaptiklariyla degil yalniz kendi yaptiklariyla ovunebilir
7552,GAL,6,TCL02,herkes kendine dusen yuku tasimali
7553,GAL,6,TCL02,tanri sozunde egitilen kendisini egitenle butun nimetleri paylassin
7554,GAL,6,TCL02,aldanmayin tanri alaya alinmaz insan ne ekerse onu bicer
7555,GAL,6,TCL02,kendi benligine eken benlikten olum bicecektir ruha eken ruhtan sonsuz yasam bicecektir
7556,GAL,6,TCL02,iyilik yapmaktan usanmayalim gevsemezsek mevsiminde biceriz
7557,GAL,6,TCL02,bunun icin firsatimiz varken herkese ozellikle iman ailesinin uyelerine iyilik yapalim
7558,GAL,6,TCL02,bakin size kendi elimle ne denli buyuk harflerle yaziyorum
7559,GAL,6,TCL02,bedende gosterise onem verenler yalniz mesihin carmihi ugruna zulum gormemek icin sizi sunnet olmaya zorluyorlar
7560,GAL,6,TCL02,oysa sunnetlilerin kendileri bile kutsal yasayi yerine getirmiyor sizin bedenlerinizle ovunebilmek icin sunnet olmanizi istiyorlar
7561,GAL,6,TCL02,bana gelince rabbimiz isa mesihin carmihindan baska bir seyle asla ovunmem onun carmihi araciligiyla dunya benim icin oludur
7562,GAL,6,TCL02,ben de dunya icin
7563,GAL,6,TCL02,sunnetli olup olmamanin onemi yoktur onemli olan yeni yaratilistir
7564,GAL,6,TCL02,bu kurala uyan herkese ve tanrinin israiline esenlik ve merhamet olsun
7565,GAL,6,TCL02,bundan boyle kimse bana sorun cikarmasin cunku ben isanin yara izlerini bedenimde tasiyorum
7566,GAL,6,TCL02,kardesler rabbimiz isa mesihin lutfu ruhunuzla birlikte olsun amin
7567,EPH,1,TCL02,tanrinin istegiyle mesih isanin elcisi atanan ben pavlustan efeste
7568,EPH,1,TCL02,bulunan kutsallara mesih isaya ait olan sadiklara selam
7569,EPH,1,TCL02,babamiz tanridan ve rab isa mesihten sizlere lutuf ve esenlik olsun
7570,EPH,1,TCL02,bizi mesihte her ruhsal kutsamayla goksel yerlerde kutsamis olan rabbimiz isa mesihin babasi tanriya ovguler olsun
7571,EPH,1,TCL02,o kendi onunde sevgide kutsal ve kusursuz olmamiz icin dunyanin kurulusundan once bizi mesihte secti
7572,EPH,1,TCL02,kendi istegi ve iyi amaci uyarinca isa mesih araciligiyla kendisine ogullar olalim diye bizi onceden belirledi
7573,EPH,1,TCL02,oyle ki sevgili oglunda
7574,EPH,1,TCL02,bize bagisladigi yuce lutfu ovulsun
7575,EPH,1,TCL02,tam bir bilgelik ve anlayisla uzerimize yagdirdigi lutfunun zenginligi sayesinde mesihin kani araciligiyla mesihte kurtulusa suclarimizin bagislanmasina kavustuk
7576,EPH,1,TCL02,tanri sir olan istegini mesihte edindigi iyi amac uyarinca bize acikladi
7577,EPH,1,TCL02,zaman dolunca gerceklestirecegi bu tasariya gore yerdeki ve gokteki her seyi mesihte birlestirecek
7578,EPH,1,TCL02,her seyi kendi istegi dogrultusunda duzenleyen tanrinin amaci uyarinca onceden belirlenip mesihte secildik
7579,EPH,1,TCL02,
7580,EPH,1,TCL02,oyle ki mesihe ilk umut baglayan bizler onun yuceliginin ovulmesi icin yasayalim
7581,EPH,1,TCL02,gercegin bildirisini kurtulusunuzun mujdesini duyup ona iman ettiginizde siz de vaat edilen kutsal ruhla onda muhurlendiniz
7582,EPH,1,TCL02,ruh tanrinin yuceliginin ovulmesi icin tanriya ait olanlarin kurtulusuna dek mirasimizin guvencesidir
7583,EPH,1,TCL02,bunun icin rab isaya iman ettiginizi ve butun kutsallari sevdiginizi duydugumdan beri ben de sizin icin surekli sukrediyor sizi dualarimda hep aniyorum
7584,EPH,1,TCL02,rabbimiz isa mesihin tanrisi yuce baba kendisini tanimaniz icin size bilgelik ve vahiy ruhunu versin diye dua ediyorum
7585,EPH,1,TCL02,onun cagrisindan dogan umudu kutsallara verdigi mirasin
7586,EPH,1,TCL02,yuce zenginligini ve iman eden bizler icin etkin olan kudretinin askin buyuklugunu anlamaniz icin yureklerinizin gozleri aydinlansin diye dua ediyorum bu kudret tanrinin mesihi olumden diriltirken ve goksel yerlerde saginda oturturken onda sergiledigi ustun gucle ayni etkinliktedir
7587,EPH,1,TCL02,tanri onu butun yonetimlerin hukumranliklarin guc ve egemenliklerin yalniz bu cagda degil gelecek cagda da anilacak butun adlarin cok ustune cikardi
7588,EPH,1,TCL02,her seyi ayaklari altina sererek ona bagimli kildi onu her seyin uzerinde bas olmak uzere
7589,EPH,1,TCL02,kilise
7590,EPH,1,TCL02,ye verdi
