,chapt_code,text,book,chapt,version
50,LUK.7.SCO1904,noo eftir he had endit a his teachin i the hearin o the thrang he gaed intil capernaum and a centurions servinman wha was unco thocht o by him was ill and ready to dee but hearin aboot jesus he sent to him elders o the jews wha besocht him that he wad come and save his servinman and whan they cam to jesus they besocht him sair sayin he is wordie to wham ye wad grant this for he loes oor nation and has biggit us a kirk and jesus was gaun wi them by this time he no bein far frae the hoose the centurion sent freends to him sayin lord dinna fash yersel for i amna wordie ye soud come under my roof and sae naither thocht i mysel wardie to come till ye but speak wi a word and my servinlad sal be hale for een i mysel am ane set under authoritie and haein under me sodgers and i say to ane gang and he gangs and to anither come and he comes and to my servinlad do this and he dis it and whan jesus heard thae words he ferlied at him and turnin to the thrang that followt him said i say tye i haena fund sic leal faith na no in isral and they that were sent returnin to the hoose faund the servinlad weel and it cam to pass in order that he was gaun intil a citie cad nain and mony disciples gaed wi him and a great thrang noo whan he cam to the yett o the citie look thar was carryt oot ane deid the ae son o his mither and she was a weedow and a hantle o folk o the citie war wi her and whan the lord saw her he had unco pitie on her and says to her dinna greet and gaun forrit he touched the bier and the bearers stude still and he said laddie i say to thee rise and he that was deid sat up and begude to speak and he gied him ower to his mither and a gliff fell on them a and they magnifyt god cryin a great prophet has raise up amang us and god has visitit his folk and this word aboot him gaed oot intil the hail o judea and a throwe the pairts roond aboot and the disciples o john tellt him a thir things and cain to him twa certain anes o his disciples john sent them to the lord sayin are ye the ane that soud come or are we to look for anither ane and comin to him the men said john baptist has sent us to thee sayin are ye the ane that soud come or are we to look for anither ane at that oor he healed mony o their ills and plagues and foul spirits and on mony blin he bestowed sicht and jesus answerin said to them gang yere ways and cairry word to john what ye saw and heard hoo the blin win their sicht the lameters gang aboot lepers are made clean the deif hear the deid are raised and the needy hae the joyfu message preached to them and weel may he be wha finds nae cause o stumblin in me and the messengers o john gaun awa he begude to speak to a the thrang anent john what gaed ye oot intil the waste to see a reed winshaken but what wast ye gaed oot to see a man clad in saft attire but look they wha are fund in grand attire and fend delicately are in royal palaces but what gaed ye oot tae see a prophet aye say i tye and muckle mair nor a prophet this is he o wham it is puttendoon lo i send oot my messenger afore yere face wha sal mak yer fitroad gangable afore ye for i say tye amang a that are born o weemen there isna a greater prophet than john the baptist yet he wha is the less in gods kingdom is greater nor he and a the folk whan they heard and the taxmen laudit god bein bapteezt in johns bapteezin but the pharisees and the writers pat aside the coonsel o god again their sels no bein bapteezt o him unto what than sal i compare the men o this generation and until what are they like they are like bairns sittin i the merkitplace and cryin ane to anither and sayin we piped to ye and ye dancedna we crooned a dirge to ye and ye gratna for john the baptist is come naither eatin breid nor drinkin wine and ye say he has a demon the son o man is come eatin and drinkin and ye say see a man o gluttony and a winetippler a freend o taxmen and the illdeedie and yet wisdom is justifeet o her bairns and a certain ane o the pharisees wad hae him come and eat wi him and gaun intil the hoose o the pharisee he sat doon to meat and see a wumman o the citie wha was an illdooer whan she kent that he was sittin at meat i the pharisees hoose she gat her an alabaster cruse o perfume and staunin ahint him at his feet she begude to weet his feet wi her tears and wiped the tears aff wi her hair and was kissin his feet and crystit them wi the perfume but the pharisee wha had bidden him seein it spak till his sel this ane gin he war a prophet wad hae taen tent wha and o whatna sort this wumman is that touches him that she is a bad ane and jesus answerin says to him simon i hae a thing to say tye and he says maister say on thar was a certain creditor wha had twa debtors the ane was awn fyvehunner sillerpennies and the tither fifty and whan they had nocht to pay wi he forgae them baith whilk o them noo wull loe him maist answerin quo simon i wad think he to wham he forgae the maist and he says to them ye hae judged richt and turnin him to the wumman he says to simon see ye this wumman i cam intil yere hoose ye gied me nae watir for my feet but she wat my feet wi her tears and wiped them aff wi her hair nae kiss giedyeme but she sin i cam in hasna left aff to kiss my feet wi nae ulyie did ye anoint my heid but she wi perfume crystit my feet sae say i tye her mony sins hae been forgien for she loed muckle but to wham little is forgien he loes little and he said till her yere sins are forgien and they sittin at meat wi him begude to say to their sels wha is this that is een forgien sins but he said to the wumman yere faith has saved ye gang in peace,LUK,7,SCO1904
51,LUK.8.SCO1904,and it cam aboot that in due coorse he gaed throwe a cities and villages preachin and bringin the gudetidins o the kingdom o god and the twal war wi him and certain weemen wha had been healed o foul spirits and illnesses mary cad the magdalene and joan wife o chuza herods steward and susanna and mony mair wha war giean oot to them o their ain plenishin and whan a great thrang cam thegither and they o the cities journeyd till him he spak throwe a parable a sawer gaed oot to saw his seed and as he sawed some fell aside the fitroad and was trampit doon and the burdies o the air devoort it and ither fell on the rock and as sune as it brairdit it dwined awa for it wanted moisture and ither fell amang the thorns and growin up wit the thorns smoord it and ither some fell intil the gude grun and brairdin brocht forth frute a hunnerfauld thir things sayin he cryt alood he wha has lugs to hear let him hear but his disciples war speirin at him what may this parable be and he said to you it is gien to win the knowledge o the mysteries o gods kingdom but to the lave in parables sae seein they seena and hearin they understaunna noo the parable is this the seed is the word o god and they by the fitroad are they wha hear than comes sautan and cleeks awa the word frae their heart least believin they soud be saved and thir on the rock are they wha whan they hear wi joy welcome the word but they hae nae rute wha believe for a wee and in time o trial fa away and thir that fell amang the thorns are they that hear and as they gang on their way are smoord wi cark and care and the gear and the joys o this life and bring nae frute to the ripenin but that i the gude grun are they wha in an honest and leal heart hear the word and grip it fast and tholin a bring their frute to perfeteness for nane luntin a crusie covers it ower wi a dish or pits it aneath a couch but sets it on a stun that they wha come in may see the licht for thar is nae secret but sal be unfauldit nor onything hidlins that sanna be kent tak tent than hoo ye hear for to wha has sal rowth be gien and wha hasna frae him sal be taen awa een what he seems to hae noo thar cam seekin him his mither and his brethren but they coudna win nar him for the thrang and it was said to him yere mither and yere brethren are staunin ootby and wad see ye but he answert and quo he to them my mither and my brethren are thir wha hear the word o god an do it and it cam that on ane o the days he gaed intil a boat he and his disciples and he said to them lat us gang ower to the other side o the loch and they set oot noo as they war sailin he fell asleep and thar cam doon an unco storm o win intil the loch and they were fillin and war in danger and they cam till him and waukend him sayin maister maister we perish and he raise and challenged the win and the ragin o the watir and they war lown and it becam a calm and he said to them whaur is yere faith but struck wi dreid they ferlied sayin ane to anither whatna man is this that he orders the wins and watirs and they obey him and they cam till the kintraside o the gerasenes whilk indeed is ower fornent galilee and whan they war come forth on the lan a certain man met him oot o the citie wha had demons and for lang had worn nae claes nor wad bide in ony hoose but i the tombs but seein jesus he cryt oot and fell doon afore him and wi a soondin voice cryt what hae i to dae wi thee jesus son o god maist heigh i entreat thee tormentmena for he commandit the foul spirit to come oot o the man for aft it had grippit him and he was keepit in ward and bund wi fetters and chains and rivin his bonds sindry he was cad intil the deserts by the demons and jesus demandit o him what is yere name and he said legion for that mony demons had entert intil him and they entreatit him that he wadna command them to gang oot intil the abyss noo thar was a herd o mony swine feedin on the mountain and they entreatit him that he wad gie them leave to enter intil them and he loot them and the demons gaun forth frae the man gaed intil the swine and the hale herd rushed doon the scaur intil the loch and war drooned and whan they that herdit them saw what was dune they fled and tellt it i the citie and i the kintraside and they cam oot to see what had come to pass and cam to jesus and faund the man the demons had gane oot o cleedit and in his richt senses at the feet o jesus and they feart and they wha beheld tauld hoo the ane possesst wi demons was saved than the hail o the kintraside o the gerasenes entreatit him to depairt frae them for they war hauden wi a great fear and he gaun intil a boat returned again noo the man the demons had gane oot o was entreatin him that he micht be wi him but he sent him awa sayin gang yere ways to yere hoose and schaw what great things god has wrocht for ye and he gaed aff and tellt throwe the hail citie hoo great things jesus had dune for him noo as jesus returned a the folk welcomed him back for they war lookin for him and see thar cam ane named jairus and the same was a ruler i the kirk and fan doon at jesus feet he entreated him to come to his hoose for he had but ae dochter aboot twal year auld and she lay deein but as he gaed the thrang delayt him and a wumman haein a flowin for twal year wha indeed had wared a her gear on doctors and wasna healed o ony cam ahint him and touched the fringe o his mantle and at ance her flowin o blude stancht and jesus said wha ist that touchd me and whan a war denyin peter and they that war wi him replyt maister the multitudes hem thee in and thrang thee and sayst thou wha touched me but jesus said some ane touched me for i tak tent o pooer gaun oot frae me and the wumman seein she hadna escapit kennin cam trimlin and loutin doon afore him tellt afore a the folk for why she had touched him and hoo she was healed at ance and he said to her dochter yere faith has made ye hale gang yere ways in peace een whiles he was speakin cam ane frae the kirkrulers hoose sayin to him yere dochter is deid dinna fash the maister ony mair but jesus hearint says fearna only believe and she sal be saved and comin to the hoose he suffert nae man to gang in wi him but peter and john and james and the faither o the lassie and her mither and they war a greetin and makin their maen ower her but he said wail na for she deet na but is sleepin and they made derision o him kennin she was deid but he takin her by the haun spak alood lassie rise and her spirit returned and she raise at ance and he spak that she soud hae to eat and her parents war astoundit but he chairged them no to tell ony what had been dune,LUK,8,SCO1904
52,LUK.9.SCO1904,and cain thegither the twal he gied them pooer and authoritie ower a the demons and to heal diseases and he sent them oot to proclaim gods kingdom and to heal the sick and quo he till them tak nocht for yere journey naither staff nor wallet nor breid nor siller nor to hae twa coats and intil whatna hoose ye may enter bide ye int and frae thar gang yere ways again and as mony as winna tak ye in whan ye gang frae that citie flaff aff the stour frae yere feet for testimonie again them and gaun oot they gaed throwe a the touns proclaimin the joyfumessage and teachin agate noo herod the kingdepute heard o a that was dune and he swithert and was sair fashed for some said john had risen again frae the deid and some that elijah was come and ithers again that ane o the auld prophets had come to life but herod said i beheidit john but wha is this i hear sic things o and he socht to see him and the apostles returnin tellt him a things they had dune and he took them aside and gaed awa unkent to a city caed bethsaida but the folk comin to ken followt him and he took them to him and spak to them o the kingdom o god and healed thae that stude in need o healin noo as the day begude to wear awa the twal comin nar says to him send ye the folk awa that they may gang to the touns and clachans roond to lodge and fend for we are here in a desert bit but he said to them ye gie them to eat but they said we hae nae mair nor fyve bannocks and twa speldrins unless we soud gang and buy meat for a thir folk for thar war aboot fyve thoosan men and he said to his disciples gar them sit doon in companies o aboot fifty and they did sae and gart them ane and a sit doon and takin the fyve bannocks and the twa speldrins he lookit up aboon and blessd them and brak them and gied to the disciples and they to the folk and they did a eat and war satisfyt and what was left ower was taen up twal baskets o broken meat and it cam aboot than whan he was alane and prayin the disciples war wi him and he speirt at them sayin wham say the folk i am and they answert him john the baptist ithers elijah and yet ithers that ane o the auld prophets is risen again and quo he to them but wham div ye say i am and peter answerin said gods christ and he strickly admonished them and commandit them that they soud tell this to nane sayin the son o man maun dree mony things and be rejeckit o the elders the heidpriests and the writers and be slain and on the third day rise and he said to them a gin ony man wad follow me lat him deny his sel and tak up his cross ilka day and follow me for whasae wad hain his life sal tine it and whasae may tine his life for my sake that vera man sal save it for what sairs it a man gin he has gotten the hail warld and has tint his sel or is cuisten oot for whasae has shame o me and o my words the son o man sal hae shame o him at what time he comes in his glorie and in the glorie o the faither and o the holie angels but truly say i tye thar are some here staunin wha in naegate sal ken death to the time they see the glorie o god and it cam to pass aboot an auchtdays eftir thae sayins that he took wi him peter and john and james and gaed to pray up intil a mountain and whiles he was prayin the look o his face was changed and his cleedin becam white and shinin and lo twa men spak wi him wha war moses and elijah wha schawed theirsels in glorie and spak o his depairtin whilk he soud accomplish at jerusalem but peter and the lave wi him war unco heavy wi sleep and whan they war waukend up they saw his glorie and the twa men staunin wi him and as they war aboot to pass awa peter said to jesus maister it is graun for us to be here and lat us mak thrie bothies ane for thee and ane for moses and ane for elijah no kennin richt what he was sayin and whiles he was yet speakin thir words a clud cam and owershadit them and they were strucken fu o fear as the men entert intil the clud and a voice cam oot o the clud this is my son the chosen ane hear ye him and whan the voice had been heard jesus was thar his lane and they keepit it to their sels and tellt nae man i thae days whatna things they had seen and it cam aboot that on the neist day as they war come doon frae the mountain a great thrang o folk met him and look a man frae mang the folk cryt oot sayin maister i entreat ye look ye on my son for he is my aebairn and lo a spirit grips him to sudden he skreighs oot and it rives him and dingin him jimply wull leave him and i entreatit thy disciples to cast him oot and they coudna and answerin jesus said o fause and thrawart generation to whatna time sal i bide wye and thole ye bring here yere son and while he was acomin the demon dang him doon and mangld him and jesus challenged the foul spirit and healed the laddie and gied him ower to his faither and they war a strucken wi amazement at the michty power o god but while they ilka ane ferlied at a the things that jesus had dune he says to his followers lat thir words sink doon intil yere lugs for the son o man is sune to be delivert intil the hauns o men but they kentna this sayin and it was keepit frae them that they soudna ken it and they war feart to speir at him anent the sayin and thar gat up an arglebargle amang them wha o them soud be heighest noo jesus kennin what was in their hearts took a wee bairn and sat him by his side and said to them whasae may mak welcome this bairn in my name welcomes me and whasae welcomes me welcomes him that sent me for he that is least amang ye he sal be great and john spak up maister we saw ane by wham demons were cuisten oot i thy name and we challenged him for he wasna followin wi us and jesus said to him fauthimna for wha isna contrar to ye is for ye and it cam aboot that whan the days o his takinup war come he siccarlie set his face to gang to jerusalem and he sent oot rinners to gang afore him and as they gaed they cam intil a wee toun o the samaritans to mak ready for his comin and they wadna hae him come for that his face was set to gang to jerusalem and whan james and john disciples saw that they speirt lord wull ye hae us bid fire to come doon frae the lift and consume them but he turned aboot and rebukit them and they gaed on till anither toun and as they journeyd on ane said to him ise follow thee whaursaeer thou may gang and jesus said to him the tods hae dens and the burdies o the lift hae nests but the son o man hasna whauron to lay his heid and he said to a different ane follow ye me but quo he lord lat me gang first to the burial o my faither but he said to him leave ye the deid to kist their ain deid but gang ye and spread abreid the kingdom o god and yet anither said to him ise follow thee lord but lat me first gang hame and pairt wi thae i my ain hoose but jesus said to him nae man takin haud o the pleuch and lookin back to the things ahint is fit for the kingdom o god,LUK,9,SCO1904
53,LUK.10.SCO1904,and eftir thir things the lord took seeventy mair as weel and sent them oot twa by twa afore his face intil ilka toon and place whaur he wad come his sel and he was sayin to them the hairst is unco great but the workfolk are few entreat ye than o the lord o the hairst that he may press workfolk intil his hairst gang ye see i am sendin ye oot as lambs amang the wolves cairryna purse nor wallet nor shoon and dinna be salutin ony as ye gang and intil whatsae hoose ye gang say ye first peace be to this hoose and gin the son o peace bide yonner yere ain peace sal licht upon it but gin it bena sae yese hae yere ain peace again and bide ye i the same hoose eatin and drinkin what they hae by them for the laborer maun hae his fee flitna frae hoose to hoose and whatna toon ye enter in and they mak ye welcome eat what is set afore ye and heal the sick tharin sayin till them the kingdom o god is come nar tye but whaureer ye gang intil a toon and they winna tak ye in gang ye oot intil the highways ot sayin een the stour o yere toon on oor shoon we dicht aff for ye but tak tent gods kingdom has come narhaund ye i say tye that for them o sodom i that day it sal be better than for yon toon wae for ye chorazin wae for ye bethsaida for gin tyre and sidon had seen the warks o pooer that had been dune in you they wad langayne repentit sittin in towclaith and assis but it sal be better for tyre and sidon at the judgment nor for you and ye capernaum are ye heizt up to heaven doon to hell sal ye be cuisten wha is hearin you is hearin me and wha is gangin you by is gangin me by and wha is gangin me by is ganginby him that sent me oot and the seeventy blythely returned sayin lord een the demons gie in to us i thy name and he said to them i was lookin at sautin as like a fireflaucht he fell frae heeven behauld i hae gien tye richt to tramp on serpents and scorpions and on a the pooer o the enemie and naething sal in onygate skaith ye yet bena blythe for this that the demons are gieanin to ye but be ye blythe that yere names are putten doon aboon in that vera oor joyd he i the holie spirit and said i own to thee lord o heeven and yirth that thou did hide thir things frae the wyss and the discernin and did mak them plain to the bairnlike een sae my faither for sae it was weel i thy sicht to me are delivert up a things o my faither and nane comes to ken wha the son is only the faither and wha the faither is only the son and sic a ane as the son may reveal him till and turnin till his disciples he says to them by their sels happy the een that see what your een see for i say tye mony prophets and kings war fain to see what ye are seein and didna see and to hae heard what ye hear and heardna and now see a writer raise tempin him and sayin maister what maun i do that i may hae an everlastin inheritance and he said to him what has been puttendoon i the law hoo read ye and answerin he said ye sal loe the lord yere god wi yere hail heart and wi yere hail saul and wi yere hail pooer and wi a aefauld ettlin and yere neebor like yersel and he said to him truly hae ye said do ye as weel and yese hae life but he fain to mak himsel oot to be richt speirt at jesus wha is my neebor and takin it up jesus said thar was a man gaun doon frae jerusalem till jericho wha fell in wi robbers wha strippit him and cloured and gashed him and gaed their ways leain him nar deid and it cam aboot that a certain priest cam doon that gate and lookin on him gaed cannie by on the ither side and in siclike mainner a levite as weel comin doon till the place and seeint slippit by on the faraway side but a certain samariaman gaun on his journey cam doon till him and lookin on him was fu o compassion and comin nar bund up his clours teemin in ulyie and wine and pittin him on his ain beas fesht him till the inn and tentit him and on the morn takin oot twa sillerpennies he gae them to the guidman sayin tak tent o him weel and whatna mair ye ware on him whan i come back ise pay ye noo whilk ane oot o thae three think ye made his sel neebor till him that fell in wi the robbers and he says the ane that dealt in compassion wi him and jesus says to him gang ye and be doin siclike noo as they gaed on he cam intil a certain toon and a certain wumman named martha bade him intil her hoose and she had a sister cad mary wha was aye sittin narby the feet o jesus hearin his words but martha was unco pernickity aboot mickle service and comin doon till him quo she lord div ye no heed that my sister leas me to ser by my lane bid her that she help me but jesus answers and says to her martha martha ye are puttillt and fashed wi a hantle o things but thar is ae thing aye needit and mary waled oot the gude pairt and it isna to be taen awa frae her,LUK,10,SCO1904
