,chapt_code,text,book,chapt,version
98,ACT.10.SCO1904,thar was a man in cesarea cad cornelius officer in a core cad the italian devout and fearin god wi a his hoose giean aumous to the folk and prayin to god aye he saw in plain vision about thrie oclock i the day an angel o god comin in to him and sayin to him cornelius noo he settin his een on him and bein unco fleyt said what ist my lord and he said to him yere prayers and aumouses are come up to be keepit in mind afore god and noo send aff men to joppa and fesh ane simon cad peter he bides wi ane simon a tanner that has his hoose by the sea and whan the angel that spak to him was gane he cad twa servinmen and a godlie sodger o thae waitin on him and whan he had tellt them a things he sent them awa to joppa noo on the morn as they gaed on their way and cam nar to the citie peter gaed up to the hoosetap to pray aboot the dennertime and he grew unco hungry and wad fain eaten a wee but whiles they war preparin he fell intil a dwaum and saw the lift unsteekit and a kind o veschel comin doon as a great sheet loutit doon by the fowr corners in whilk war a the beass and creaturs o the yirth and birds o the air and a voice cam to him arise peter kill and eat but peter said no sae lord for at nae time did i eat ocht that was common or unclean and a voice the second time cam to him whatna things god has made pure ca thou no common noo this was dune thrice and than the veschel was taen up again intil the lift but as peter was in a swither what aiblins this vision he saw micht mean see the men sent by cornelius haein speirt oot the hoose o simon stude fornent the yett and spak and speirt gin simon cad peter was enterteened thar and while peter considert the vision the spirit said to him see thrie meen seek ye arisin gang doon and gae wi them haein nae fears for i hae sent them than peter gaun doon to the men said tak tent i am he that ye are seekin what is the cause o yere comin and they said cornelius an officer a gude man and fearin god wellthocht o by a the folk o the jews was tellt by a holie angel to send for ye to his hoose and to hear words frae ye bringing them in than he enterteened them and on the morn he gaed awa wi them and a wheen o the brethren frae joppa gaed wi him and the day eftir he cam intil cesarea noo cornelius was lookin for them and had brocht thegither his kin and bosomfreends and it cam aboot that as cornelius met him he loutit doon at his feet and did reverence to him but peter raised him sayin staun up for i too mysel am but a man and sae talkin wi him he gaed in and faund mony that had come thegither and said to them ye weel ken hoo it isna an allooed thing for a man a jew to join himself or come to ane o anither nation and god has schawn me that ise to ca nae man common or unclean and sae wi nae arglebarglin i cam whan i was sent for i ask than for why ye sent for me and cornelius said fowr days syne i was praying at the thrieoclock in my hoose and behauld a man stude afore me in bricht cleedin and said cornelius yere prayer is heard and yere aumouses are keepit in mind o god send than to joppa and ca hither simon cad peter bidin i the hoose o ane simon a tanner by the sea and sae at ance i sent for ye and eke ye did weel to come noo than we are a here i the sicht o god to hear a the things that god has gien ye for us and peter begude to speak and said i see that god is nae chooser o faces but amang a nations he that fears him and dis richt is acceptable to him as to the word he sent oot to the sons o isral proclaimin the gudeword o peace throwe jesus the christ the same is lord o a ye ken what already has taen place throwe the hail o judea beginnin frae galilee eftir the bapteezin that john preached een aboot jesus o nazareth hoo god anointit him wi holie spirit and pooer wha gaed aboot doin gude and healin a that war in thrall to sautan for god was wi him and we are eewitnesses o a things he did baith i the land o the jews and at jerusalem wham they slew hingin him on a tree him did god raise on the third day and gied him to be seen no to a the folk but to eewitnesses waled oot afore by god by us wha did in fact eat and drink wi him eftir his risin frae amang the deid and he chairged us to preach to a folk and to testifie that this is he wha was ordeend by god as the judge o the leevin and the deid to him gie a the prophets witness that throwe his name ilka ane wha lippens him obteens remission o sins while as peter was yet speakin thir words the holie spirit fell on a that war hearin the word and the believin anes o the circumceesion war astoundit they that cam wi peter than een to fremdfolk the free gift o the holie spirit was gien for they listened to him speakin wi ither tongues and laudin god than said peter can onyane noo forbid the watir that thir soudna be bapteezt wha hae had the holie spirit gien them een as we and he ordert that they soud be bapteezt than entreatit they him to bide some wheen days,ACT,10,SCO1904
99,ACT.11.SCO1904,noo the apostles and brethren they that war in judea heard tell that een the gentiles received the word o god and when peter gaed up to jerusalem they oot o the circumceesion war challengin him sayin ye gaed in to men no circumceest and did eat meat wi them but peter beginnin set the maitter in order afore them sayin i was in the citie o joppa prayin and in a dwaum i saw a vision a veschel comin doon as it had been a great sheet by fowr corners loutit doon frae the lift and it cam to me intil whilk narrowlie lookin i took tent and saw fowrfittit beass o the yirth and wild beass and crawlin things and birdies o the lift forby i heard a voice sayin to me arise peter kill and eat but i answert no sae lord for naething common nor unclean at ony time has gane intil my mooth but the voice spak the second time frae aboon whatna things god has made pure ca thou no common noo this was dune thrice and it was a taen up again aboon and tak tent een than war thrie men haltin at the hoose whaur i was sent frae cesarea to me and the spirit bade me gang wi them switherin nane and thar gaed wi me thir sax brethren as weel and we entert intil the mans hoose and he tellt us hoo he saw the angel in his hoose staunin and sayin to him send awa to joppa and fesh simon cad peter wha sal speak words tye in whilk ye sal be saved ye and yere hoose and whan i begude to speak the holie spirit fell on them as on us at the first than brocht i to mind the words o the lord hoo he wad say john bapteezt indeed wi watir but ye sal be bapteezt wi holie spirit and forasmuckle as god gied them the like free gift een as to us wha believed i the lord jesus christ wha was i that i soud be able to hinner god and whan they heard thae things they war quate and laudit god sayin noo has god gien repentance until life een to the gentiles noo they that war scattert abreid by the persecution that raise anent stephen gaed the length o phenicia and cyprus and antioch speakin the word allenar to the jews but thar war a wheen men o them cyprians and cyrenians wha gaun intil antioch spak een to the greeks giean them the blythemessage pertainin to the lord jesus and the lords haun was wi them and an unco hantle o them believin turned them to the lord and the sough o a this cam to the lug o the kirk at jerusalem and they sent oot barnabas that he soud gang the lenth o antioch wha comin and seein hoo gracious was god rejoict and besocht a that wi their hail heart they soud wait upon god for he was a godlie man and fu o the holie spirit and faith and a hantle o folk war won for the lord and he gaed on to tarsus for to seek saul and lichtin on him he fesht him to antioch and it cam aboot that they met wi the kirk and instruckit mony and the believers first in antioch war named christians and i thae days thar cam prophets doon frae jerusalem to antioch and ane o them cad agabus gied an intimation throwe the spirit that an unco famine was to come on the hail warld whilk a cam aboot under claudius than the disciples ilka ane as he had ability was mindit to send charitie to the brethren dwallin in judea whilk thing they did sendin to the elders throwe the hauns o barnabas and saul,ACT,11,SCO1904
100,ACT.12.SCO1904,noo it was tharaboot that herod the king raxt oot his hauns to do ill to some o the kirk and he slew james johns brither wi the sword and seein it flattert the jews he gaed on mair and grippit peter as weel thae war the days o the sad breid and whan he had grippit him he laid him in thrall giean him ower to fowr fowrsome sets o sodgers to keep him ettlin eftir the pasche to fesh him oot to the people sae peter was keepit i the dungeon but earnest prayer was made a the time to god for him and whan herod wad hae fesht him oot at nicht peter was sleepin atween twa sodgers fast wi twa chains and gairds afore the door tentit the prison and see an angel o the lord stude by him and a licht glintit i the dungeon and giean peter a dunt on the side he raised him up sayin rise up haste and the chains slypit aff frae his hauns and the angel said mak yersel snod and tie on yere shoon and he did sae and he says to him cast yere manteel aboot ye and follow me and gaun oot he followt and kentna it was true what the angel did but thocht he dreamed a dream and gaun throwe a first ward and than a second they cam to the airn yett that led oot to the citie whilk unsteekit o its ain sel to them and gaun oot they gaed on throwe ae street and the angel left him and peter comin to his sel said noo ken i o a certaintie that the lord sent oot his angel and delivert me frae herods haun and frae a the expectation o the jewish folk and thinkin a wee he cam to the hoose o mary johns mither the ane cad mark whaur mony war forgathert and prayin noo as he chappit at the door o the porch thar cam oot a lass to hearken named rhoda and kennin peters voice for joy she unsteekitna the yett but rinnin in she tellt that peter was staunin fornent the yett but they said to her ye are wud but she on her side threepit that it was even sae but they said it is his wraith but peter a this time was chappin and openin they war astonisht but motionin to them wi the haun to be whisht he tellt them a hoo the lord had led him frae the prison and said as weel tell thir things to james and the brethren and gaun on he cam intil anither place noo whan it was day thar was an unco steer amang the sodgers what has become o peter and whan herod had socht for him and faund him no pittin the keepers to the test ordert them to be putten to deid and gaun doon frae judea intil cesarea he bade thar noo he was unco vexed wi the folk o tyre and sidon but wi ae mind they war comin to him and makin a freend o blastus the kings chaumerlain they socht for peace for that their pairts were mainteened by the kings kintra and on a day appointit herod buskit in royal robes and sittin on a thron made a set speech tae them and the folk made a shout cryin a gods voice and no a mans voice and at ance the angel o the lord dang him for that he giedna god the glorie and he was devoort o worms and deet but the word o god grew mair and mair and barnabas and saul cam back frae jerusalem whan they had dune their message takin wi them john cad mark,ACT,12,SCO1904
101,ACT.13.SCO1904,noo thar war i the assembly at antioch baith prophets and teachers sic like as barnabas and simon him cad niger lucius o cyrene and manaen wha was fosterbrither to herod the kingdepute and saul and as they sert the lord and war fastin the holie spirit said set apairt to me barnabas and saul for the wark to whilk i hae bidden them sae fastin and prayin and layin their hauns on them they sent them aff they thus sent oot by the holie spirit gaed doon to selucia and frae thar sailed the lenth o cyprus and gaun forrit to salamis they proclaimed the word o god i the kirks o the jews and they had john to attend them and gaun throwe the hail isle the lenth o paphos they cam on a particular man a magician a fauseprophet a jew by name barjesus wha was wi the governordepute sergius paulus a man o discernment he cain for barnabas and saul desirt to hear the word o god but elymas the magician for sae is translatit his name withstude them seekin to turn the governordepute frae the faith but saul wha cam to be cad paul as weel fu o the holie spirit lookin sternly at him says o fu o a guile and a wrang son o the enemy wull ye no haud frae makin gleyd the straucht ways o the lord and noo see the lords haun is on ye and yese be blin no seein the sun till the time come and at ance thar fell on him a misty mirkness and gaun aboot he was seekin for some ane to airt him by the haun than the governordepute seeing what had come about believed being made to ferlie at the word o the lord noo settin their sails frae paphos pauls company cam to perga o pamphylia but john leain them gaed back to jerusalem hoobeit they leain perga cam till antioch in pisidia and gaun intil the kirk on the sabbathday sat doon and the law being read and the prophets the kirkrulers sent to them and quo they men brethren gin ye hae ony word o gudecoonsel for the folk say on and paul staunin up and motioning wi his haun said men wha are isralites and ye that fear god hearken the god o this nation isral waled oot oor forbears and raised up the folk whan they bade in egypts lan and wi a lofty airm he led them oot ot and for aboot forty years time tholed he their behavior i the wilderness and castin doon seeven nations in canaans lan gart them inherit their lan for aboot fowr hunner and fifty year and eftir thae things gied he them judges till samuel a prophet and eftir they socht for a king and god gied them saul son o kish a man o benjamins tribe for forty years and whan he had putten him aside he raised up dauvid for their king o him he said bearin witness i faund dauvid o jesse a man eftir my ain heart wha sal do a my wull o this mans seed has god conform to his own promise brocht to isral a saviour jesus john haein preached afore his comin the bapteezin o repentance to a israls folk and as john performed his task he said wha tak ye me to be i amna he but tent ye ane is comin eftir me the shoon o whase feet i amna fit to lowse men brethren bairns o abrams race and whasae amang ye fears god to you the word o this salvation is sent out for they o jerusalem and their rulers kennin naither him nor the words o the prophets that are read ilka sabbathday they hae een fulfillt them in condemnin him and een though they faund nae cause o death in him yet demandit they o pilate that he soud be slain and whan they had finisht a things anent him whilk had been putten doon they took him doon frae the tree and laid him in a tomb but god waukened him frae mang the deid and he was seen for a gey wheen days to thae wha cam up wi him frae galilee to jerusalem wha at this present are his eewitnesses to the people and to you we are giean the blythemessage as to the promise made to the faithers that god has fulfillt the same to our bairns by raisin up jesus as it is putten doon i the first psalm my son art thou this day hae i begotten thee and in that he raised him frae mang the deid noo nae mair to fa back to corruption he thus says i wull gie you the faithfu lovinkindnesses o dauvid sae as in anither place he says thou winna gie thy holy ane to see corruption for dauvid his sel eftir he had serd god in his ain lifetime fell sleepin and was laid wi his faithers and saw corruption but he that god waukened up saw corruption nane sae be it kent to you men brethren that throwe this man is proclaimed to you the lowsin o sin and throwe him a wha believe are justifyt frae a things no possible by moses law to be justifyt frae tak tent than sae that comena on ye spoken o in the prophets tak tent ye that geck and ferlie ye and dwine awa for i work a wark i your days a wark yese no believe though ane set it plain afore ye and whan they skailt frae the kirk they desirt that thir words soud be tellt them the neist sabbath noo whan the kirk brak up thar followt mony o the jews and o the godlie seekers wi paul and barnabas wha speakin till them heartit them up to continue in gods love but on the comin sabbath narhaun the hail citie cam thegither to hear the word o the lord but the jews seein the thrangs war fu o jealousie and spak again thae things that paul said miscain them and paul and barnabas wi great freedom o speech said it was necessar that the word o god soud first be spoken to you seein ye hae cuisten it frae ye and adjudge yersels no wordie o eternal life than turn we to the gentiles for sae has the lord bidden us i hae set thee up for a licht to the gentiles that thou may be for salvation to the farawa ends o the yirth and as the gentiles heard this they war pleased and glorifyt the word o the lord and as mony as had come to be disposed to eternal life believed and the word o the lord was spread abreid in a that kintraside but the jews steered up the godlie weemen o gudestandin and the heid men o the citie and raised up a feud again paul and barnabas and cuist them oot o their borders but they flaffing the stoor aff their shoon again them cam to iconium and the disciples war filled wi joy and wi the holie spirit,ACT,13,SCO1904
102,ACT.14.SCO1904,noo it cam aboot in iconium that they gaed intil the jews kirk and sae spak that thar believed baith o jews and greeks an unco thrang but the misbelievin jews steered up and misleared the sauls o the gentiles and gart them be turned again the brethren sae a gey while they bade speakin oot freely i the lord wha bure witness to the word o his love grantin tokens and ferlies to be dune by their hauns but the bouk o the citie was dividit and some war wi the jews and some wi the apostles and whan thar was an onset baith o the gentiles and jews wi the rulers to dishonor them and stane them they kent ot and fled ootby intil the cities o lycaonia to lystra and derbe and the kintra tharaboot and thar they proclaimed the joyfumessage and at lystra thar was sittin a man feckless in his feet a lameter frae his mithers womb wha never gaed the same man heard paul speak wha strickly observin him and perceivin that he had faith to be saved cryt oot wi a soondin voice staun ye up on yere feet and he lap up and walkit aboot and whan the thrang saw what paul had done they cryt oot i the tongue o lycaonia the gods appearin like men hae come doon to us and they war cain barnabas jupiter but paul mercurie seein he was the main speaker and the priest o jupiter whase shrine was fornent the citie brocht owsen and garlands tae the ports along wi a the thrang and wad hae dune sacrifeece but hearin ot the apostles barnabas and paul rivin their manteels ran forrit amang the folk cryin oot and sayin men why are ye doin sic things we are but men o like natur wi you deliverin to ye the joyfumessage that ye soud turn awa frae sic witless things to the leevin god wha made heeven and yirth and the sea and a things in them wha in bygane time hinderedna the nations to gang their ain gate though he leftna his sel wantin testimonie doin gude frae aboon giean us rain and frutefu seasons fillin fu o joy yere hearts and een wi thir sayins jimply restrained they the thrang that they soudna sacrifeece to them but thar cam jews frae antioch and iconium and perswadin the thrang and stanin paul they harled him ootby frae the citie judgin him to be deid the disciples stanin roon hoobeit he risin up cam intil the citie and neist day gaed forth wi barnabas to derbe deliverin the blythemessage to that citie as weel and makin mony disciples they returned to lystra and iconium and to antioch makin steive the sauls o the disciples entreatin them to bide i the faith sayin throwe a hantle o afflictions maun we win to the kingdom o god and appointin for them elders in ilka assembly and wi prayer and fastin they gied them ower to the lord in wham they pat their trust and gaun throwe pisidia they cam intil pamphylia and proclaimin the word in perga they cam doon the lenth o attalia and frae that they sailed for antioch frae whaur they had been gien ower to the favor o god for the wark they performed sae haein come they convened thegither the assembly and gaed ower a things that god did wi them and hoo that he had unsteekit a door o faith for the gentiles and they bade a gey while wi the disciples,ACT,14,SCO1904
103,ACT.15.SCO1904,and some comin frae judea war instructin the brethren gin ye bena circumceesed conform to moses law ye canna be savd but eftir thar was nae sma disputin and quaistenin wi them by paul and barnabas they settled for paul and barnabas and ithers frae amang them to gang up to the apostles and elders at jerusalem anent this quaisten sae they bein set forrit by the kirk and gaun throwe baith phenicia and samaria declared the turninaboot o the gentiles and gart the brethren hae great joy and comin to jerusalem they war welcomed by the kirk and the apostles and the elders and gaed ower a the things god had dune by them but thar stude forrit some o the sect o the pharisees wha believed threepin it is necessar to circumceese them and chairge them to keep moses law and the apostles and elders war gotten thegither to consider this maitter but eftir a hantle o quaistenin peter staunin up says to them men brethren ye a ken weel that a gey while syne god made wale amang us that the gentiles frae my mooth soud hear the blythemessage and believe and god wha taks tent o the heart bure testimonie giean them the holie spirit een as to us and made nae differ ava atwixt us and them purifyin their hearts by faith and noo hoo are ye tempin god wi layin a yoke on the disciples that naither oor faithers nor we war steive eneuch to cairry but still we hae faith throwe the lord jesus christ that wese be saved een in like mainner as they and a the folk keepit whusht and they hearkened to paul and barnabas narratin a the tokens and wunnerwarks god did amang the gentiles by them but eftir they had dune james answert sayin men brethren hearken to me simon has narrated hoo god at first did come to wale oot o the gentiles a folk for his name and to this is conform the words o the prophet een as it is putten doon eftir thir things wull i return and heize up again the tent o dauvid that is faun doon and its ruins wull i raise and set up again that the lave o men may seek eftir the lord een a the gentiles on wham has been invoked my name says the lord wha maks a thir things kent frae the beginnin o the warld sae my judgment is that we soudna fash thae wha mang the gentiles are turnin to god but that we soud send letters to them that they keep awa frae the pollutions o eidols and frae lecherie and frae things stranglt and frae blude for moses o auld time citie by citie has thae proclaimin him being read i the kirks ilka sabbathday than seemed it to be weel to the apostles and the elders wi the hail kirk to send waled oot men frae mang them to antioch wi paul and barnabas judas cad barsabas and silas foremaist men amang the breithren and wrate by tham the apostles and the elder brethren to the brethren throwe antioch and syria and cilicia that are frae oot the gentiles greetin forasmuckle as we hear that some gaun oot frae us hae puttenyeaboot wi teachin unsettlin yer sauls to wham we gied nae sic instructions it seems gude to us assembled bein o ae mind that walin oot men we soud send them to ye wi oor weelloed barnabas and paul men wha hae putten their lives in pawn for the name o oor lord jesus christ we hae sent than judas and silas and them that by word o mooth they may report the same things for it seemed weel to the holie spirit and to us no to be layin ony mair burden on ye save thir necessar things to keep awa frae eidol sacrifeeces and frae blude and frae things stranglt and frae lecherie oot o whilk keepin yersels clear ye sal do weel fareyeweel sae they bein sent awa gaed doon to antioch and gaitherin the thrang thegither delivert the letter and they readin it rejoiced ower the consolation and judas and silas theirsels bein prophets wi mony words comfortit and upbiggit the brethren and eftir makin a delay they war sent awa in peace frae the brethren to them wha sent them oot nanetheless it pleased silas to bide still thar but paul and barnabas bade in antioch teachin and proclaimin the blythemessage o the word o the lord wi mony ithers but eftir a gey wheen days paul says to barnabas lat us turn again and look in on the brethren in ilka city whaur we proclaimed the word o the lord and see hoo they fare noo barnabas was mint to tak wi them john wha was cad mark whauras paul thocht best no to tak him wi them wha turned awa frae pamphylia and gaedna wi them to the wark and thar raise a shairp contention atwixt them sae that they sindered the ane frae the ither and barnabas takin wi him mark sailed oot for cyprus but paul walin silas gaed oot being putten ower intil the lords favor by the brethren and he gaed throwe syria and cilicia strenthenin the kirks,ACT,15,SCO1904
