,chapt_code,text,book,chapt,version
160,2CO.12.SCO1904,to boast may be needfu tho it has nae profit sae i wull come to visions and revelations o the lord i ken a man in christ wha fowrteen years syne and gin he was in the body or oot o the body i kenna god kens was claught up siccan a ane as this the lenth o the third heeven and i ken sic a man as this gin he was i the body or oot o the body i kenna god kens that he was claucht up into paradise and heard unutterable things whilk it isna for a man to speak for sic a ane as this wull i boast but for mysel i winna boast but in my ain weaknesses for een soud i be fain to boast i sanna be a fule for i wull speak truth but i lat be that nae ane soud think o me aboon what he sees me to be or hears frae me and whaurfor least by the unco greatness o the revelation i soud be ower muckle upliftit thar was gien to me a stog i the flesh a messenger o sautan that he micht baff me in this behauf i thrice entreatit the lord that it micht gang frae me and he said to me my tender love is eneuch for thee for my strenth is perfited in weakness maist blythely than wull i boast mysel raither i my weaknesses that the pooer o christ may be ower me and around me sae than i am content in weaknesses in skaithins in necessities in persecutions in stretts on behauf o christ for whan i mysel am weak than am i stieve i hae become glaikit ye hae compelled me for i micht weel hae been commendit by you for i am naething short o the maist preeminent apostles een tho i be naething truly the tokens o an apostle war wrocht amang ye in a langtholin in signs and ferlies and pooers for in whatna way war ye made inferior to the lave o the kirks exceptin that i mysel wasna burdensome to ye forgie me this wrang tak tent the third time i am haudin mysel in readiness to come to ye naither wull i be burdensome for i seekna yours but you for the bairns are na to be layin up gear for the parents but the parents for the bairns for unco blythely wull i spend and be a spent in behauf o yere sauls tho the mair i loe ye the less am i loed but be it sae i didna burden ye but bein pawkie i tuik ye wi guile was thar ony ane o thae i sent tye by wham i tuik advantage o ye i entreatit titus and i sent him wi the brethren surely titus didna take advantage o ye wast no i the same spirit we walkit wast no i the same fitprints ye think a this time we are makin apology tye afore god in christ are we speakin but a things beloved are for yere upbiggin for i am in fear least in ony way haein come i soudna fin in ye sic as i wad desire and that i soud be fund o you sic as ye wadna least by ony means strivins envies belchins o wrath diveesions illspeakins swallins tulzies be fund least haein come again my god sal humble me amang ye and i sal hae to mak maen ower mony o thae wha had afore sinned and haena repentit o the uncleannesses and lechery and wantonness they war guilty o,2CO,12,SCO1904
161,2CO.13.SCO1904,this third time am i come tye at the mooth o twa witnesses or thrie sal ilka word be made siccar i tellt ye aforehaun and div tell ye aforehaun as gin i war wye the second time to a thae wha sinned and to the lave that gin i come again i wullna spare sin ye are seekin a prufe o christ speakin in me who isna feckless toward ye but is michty amang ye for he was crucifyt oot o weakness nanetheless he leeves wi gods pooer for een we are weak in him but we sal leeve wi him oot o gods pooer toward ye try yersels gin ye be i the faith pit yersels to the prufe or kenyena o yere ain sels gin jesus christ be in you except aiblins ye be outerlins but i trust ye sal ken we arena orts nor outerlins but we pray god ye do nae evil no that we may seem acceptit but that ye may do what is bonnie een tho we be as outerlins for we hae nae pooer contrar to the truth but only on the truths side and we joy whaneer we bein weak ye are strang and for this thing we pray yere perfection sae for this reason i tell ye thir things bein absent that bein wye i mayna need to deal snelly accordin to the pooer the lord gae me no for puin doon but for upbiggin but noo i the end brethren rejoicin restore yersels to order be consoled be o the ae mind leeve thegither in peace and the god o love and peace sal be wi ye greet ye ane anither wi a sacred kiss a the saunts salute ye the favor o the lord jesus christ and the love o god and the indwallin o the holie spirit be wi ye a,2CO,13,SCO1904
162,GAL.1.SCO1904,paul an apostle no frae men nor throwe men but throwe jesus christ and god the faither wha raist him frae amang the deid and a the brethren wi me to the kirks o galatia the peace and gude favor o god the faither tye and oor lord jesus christ wha gied his sel for oor sins that he micht deliver us oot o this present warld whilk is an ill ane conform to the wull o oor god and faither to wham be glorie for evir and evir amen i ferlie that thus sae sune ye are changin frae him wha perswadit ye intil christs love intil some ither gudeword whilk indeed isna anither gudeword but that are some wha are fashin ye and wad damage the gudeword o christ but een aiblins it soud be we or an angel frae heeven wha soud bring ye anither gudeword differin frae what we gied tye lat him be accurst as said we syne sae say i noo again gin ony ane gies ye a gudeword differin frae what ye gat lat him be accurst for at this time div i perswad men or dis god or div i seek to please men if aye i am pleasin men christs servant amina for i mak kent tye brethren as to the gudework whilk was tellt by me that it isna conform to men for naither did i frae man obteen it nor was i learned it by man but throwe a revealin o jesus christ for ye heard as anent my mainner o life at ae time in judaism that in an unco way i persecutit the kirk o god and laid it waste and was gaun on in judaism ayont my marrows amang my ain folk bein unco zealous for the traditions o my forebears but wham it pleased god wha took me sindry frae my mithers womb and invitit me by his grace to reveal his son in me that i soud deliver the gudeword regairdin him amang the heathen at ance i coonselltna wi flesh and blude nor gaed i up to jerusalem to them that war apostles afore me but i gaed awa intil arabia and cam back again to damascus than thrie years eftir i gaed up to jerusalem to get acquant wi peter and bade wi him fyfteen days but o the lave o the apostles saw i nane but james the brither o the lord noo as to whatna things i am tellin ye tent ye in presence o god i amna speakin fause and syne i gaed intil the kintra o syria and cilicia forby i wasna kent by face to the kirks o judea whilk are in christ only they war hearin he wha was persecutin us at ae time is noo preachin the joyfumessage o the faith that ance he laid waste and they magnifyt god in me,GAL,1,SCO1904
163,GAL.2.SCO1904,than in the coorse o fowrteen year i gaed up again to jerusalem wi barnabas takin titus as weel and i gaed up by revelation and laid afore them the gudeword whilk i preach amang the nations to their sels privately hoobeit wi thae o distinction least by ony means i soud run or had been rinnin in vain and no een titus wha was wi me tho he was a greek was compelled to be circumceesed and this was on accoont o fause brethren secretly brocht in wha cam in but to spy oot oor liberty whilk we hae in christ jesus that sae they soud bring us intil bondage to wham no een for an oor gied we place by siccan a submission that the truth o the gudeword micht still bide wi you but frae thae held to be in repute whatsoeer they war at ae time is naething to me god accepts nae mans face thae o repute addit naething to me but on the contrar seein i was entrustit wi the gudeword to the uncircumceesion een as peter was to the circumceesion for he that wrocht in peter for an apostleship o the circumceesion wrocht een in me for the heathen and seein the favor whilk was gien to me james and peter and john wha war reputit pillars gied to me and barnabas a richt haun o britherhood that we soud gang to the heathen and they to the circumceesion only that we soud be mindfu o the puir as to whilk i was een fu o zeal this vera thing to do but whan peter cam to antioch i stude up again him to his face for that he was to be wytit for afore certain anes cam frae james he did eat wi the gentiles but whan they cam he held back and keepit his sel allenar in fear o thae o the circumceesion and the lave war usin this doobleness wi him sae that een barnabas was cairryt awa wi their deceit but whan i saw they warna gangin upricht i the truth i the gudeword quo i to peter afore them a gin ye bein a jew to begin wi leeve in a gentile way and no in a jewish mainner hoo div ye gar gentiles to be judaizin we jews by natur and no sinners frae amang gentiles kennin that a man isna justifyt by warks o law but only throwe faith in christ jesus een we pit oor faith in christ jesus that we soud be justifyt by faith in christ and no by warks o law for by warks o law sal nae flesh be justifyt gin hoobeit tho seekin for justification in christ een we oorsels are fund sinners is christ than a bringerin o sin far frae it for gin i bigg up again whatna things i pu doon i schaw mysel to be guilty for i throwe law deet to the law that i soud leeve to god i hae become crucifyt wi christ nay i leeve allenar nae langer but christ is leevin in me and the life i noo hae i the flesh i leeve i the faith o the son o god wha loed me and gied his sel up on my behauf i amna settin aside the grace o god for gin throwe law is richtousness christ maun hae deet in vain,GAL,2,SCO1904
164,GAL.3.SCO1904,o glaikit galations wha cuist glamour ower ye afore whase vera een jesus christ was clearly schawn as a crucifyt ane i wad but ken this frae ye wast by the warks o the law that ye hae gotten the spirit or by the hearin o faith are ye sae glaikit eftir makin a beginnin i the spirit are ye noo gaun to be perfitit i the flesh tholed ye sic things for nocht gin it yet be for nocht he than that supplyt to ye the spirit and wrocht ferlies amang ye did he it by warks o the law or by hearin o faith een as abram lippened god and it was reckoned to him as richtousness ken than that they o faith een they are bairns o abram and the scriptur lookin forrit to god justifyin the heathen throwe faith announced aforehaun the gudeword to abram they sal be blest in thee een a the nations sae than they o faith are haein a blessin alang wi faithfu abram for as mony as are o lawwarks are neath a curse for it is putten doon accurst is ilka ane wha gangsna on in a things i the buik o the law to do them but that in law nae ane is hauden richtous wi god is plain for the richtous ane sal leeve by faith but the law isna by faith on the contrar he wha dis them sal leeve in them christ redeemed us oot o the curse o the law bein made a curse on oor behauf for it is putten doon accurst is ilka ane hingin on a tree sae that to the nations the blessin o abram micht come in jesus christ that we soud hae the promise o the spirit by faith brethren humanly am i speakin yet a human covenant nae ane sets by or adds to noo to abram war the promises spoken and to his seed it disna say and to seeds as o mony but as o ane and to thy seed whilk is christ but say i a covenant een afore made siccar by god the law whilk eftir fowr hunner and thretty years cam in disna pit by that it soud mak the promise feckless for gin aiblins the inheritance is by law it is nae langer by promise but to abram by promise had god bestown it why than the law for the cause o sin it was addit till siccan a time as the seed to wham it was promised soud come whilk law was gien in chairge by messengers at the haun o a mediator but the mediator isna o ane but god is ane was the law than contrar to the promises o god far frae it for gin a law war gien that had pooer to gie life truly than by law soud hae been richtousness but the scriptur steekit up a things as aneath sin that the promise by faith in jesus christ soud be gien to thae that hae faith but afore faith cam we war keepit siccar neath the law shut in to the faith aboot to be made kent sae that the law has been oor bairnkeeper to tak us to christ that we soud throwe faith be declart richtous but faith haein come we are nae mair aneath a bairnkeeper for ye are a sons o god throwe the faith in jesus christ for ye as mony as war bapteezt into christ hae putten on christ thar isna to be said jew nor greek thar isna to be said bond nor free thar isna to be said male nor female for a ye thegither are ane in christ jesus and gin ye are christs than are ye abrams seed and heirs een as said the promise,GAL,3,SCO1904
165,GAL.4.SCO1904,but i say sae long as the heir is a bairn he differsna frae a servant een tho aiblins he be the laird o a but is aneath bairnkeepers and overseers till the time set by the faither sae we too whan we war bairns war keepit in bonds to the hornbuik o the warld but whan the fu time cam god sent oot his son wha cam o a wumman wha cam aneath the law that he micht redeem thae aneath the law sae that we coud receive the adoption o bairns and mair for that ye are sons god sent oot his sons spirit into oor hearts cryin oot abba faither sae ye are nae mair a servant but a bairn and gin a bairn than an heir throwe god but than in sooth no kennin god ye war in bondage neath thae that war by natur nae gods whauras noo eftir that ye hae owned god or raither been owned o him hoo ist that ye are gaun back again to the feckless and beggarlie beginnins to whilk ye wad fain ower again be in bondage ye preceesely observe days and months and years i am feart for ye least by ony means i hae toiled for ye in vain become ye as i for that i too becam as yersels brethren i entreat ye in naething did ye wrang me but ye ken hoo that by reason o a weakness i the flesh i preached to ye the gudeword at the first and the temptation ye saw i my flesh ye despisedna nor scunnert at it but took me to yere hearts as an angel o god as christ jesus whaur than is that happiness o yours for i witness tye that gin it had been possible yere ain een wad ye hae pykit oot and gien to me sae noo hae i gotten to be yere fae for that i deal leal wi ye they zealouslie seek ye but no in a gude way aye they wad steek ye oot that ye may seek eftir them but it is gude for a gude thing to be socht eftir wi zeal at a times and no only whan i am wi ye my bairns o wham again i am in birthpangs till siccan a time as christ be formed in you aye i coud wiss to be wi ye enoo and to change my speech for i am in a swither aboot ye but tell me ye that wad fain be neath the law div ye no hear the law for it is puttendoon abram had twa sons ane by a bondmaid and ane by a free wumman but the ane by the bondmaid hoobeit was born eftir the mainner o the flesh whauras the ane by the free wumman throwe a promise whilk things in sooth are a parable for thir weemen are twa covenants ane frae mount sinai bringin forth to bondage whilk in sooth is hagar for hagar is mount sinai in arabia and is like to jerusalem that noo is and is in bondage wi her bairns but the jerusalem aboon is free wha indeed is mither to us a for it is puttendoon rejoice ye barren that burena brek oot intil shouts ye that warna in birthpangs for mair are the bairns o the desolat than o her that has the husband but we brethren eftir the mainner o isaac are bairns o the promise but just as than the ane born eftir the flesh persecutit the ane born eftir the spirit een sae is it enoo but what says the scriptur pit ye oot the bondmaid and her son for in naegate sal the bairn o the bondmaid inherit alang wi the bairn o the free sae brethren we arena the bondmaids bairns but the free wummans,GAL,4,SCO1904
166,GAL.5.SCO1904,wi freedom christ maks us free staun ye steive than and bena hauden fast wi ony yoke o bondage tak tent i paul say tye that gin ye receive circumceesion christ wull profit ye nocht but i witness to ilka man again that receives circumceesion that he is a bund debtor to the hail law ye are set aside frae christ ye wha wad be justifyt i the law ye are faun awa frae his favor for we throwe the spirit are fain waitin for the hope o richtousness for in christ jesus naither circumceesion coonts for ocht nor uncircumceesion but faith wrocht inwardly by love ye gaed weel wha taiglt ye that ye soudna comply wi the truth this compliance wasna o him wha cad ye a wee barm wull gang throwe the hail melder i am perswadit o ye i the lord that ye winna be thrawart but he that fashes ye sal dree his weird whaeer he may aiblins be but i brethren gin i be preachin circumceesion why am i sae persecutit for than had the bogle o the cross been dune awa i wad they een wad cut aff their sels that fash ye for ye war cad in freedom brethren but turnna yere freedom intil an indulgence to the flesh but raither by yere love ser ye ane anither for the hail law is bund up in ae word this ye sal loe yere neebor as yersel but gin ye gansh at and devoor ane anither tak tent that ye bena destroyt ane o anither on the ither haun i say walk ye i the spirit and the wull o the flesh ye sanna fulfil for the flesh has desires contrar to the spirit and the spirit contrar to the flesh for thir again ane anither are set that ye mayna do the things ye wad itherwise do but gin than ye are led by the spirit ye arena under the law but plain to be seen are the warks o the flesh whilk are adultery lechery wantonness idolatry divination hatred fainoot jealousy wrath factions pairties envyins bludeshed druckenness revellins and siclike things as to whilk i tell ye plainly een as i hae tellt ye afore that they wha practeese sic things as thir sanna inherit gods kingdom but the frute o the spirit is love happiness peace langtholin canniness gudeness lealness meekness selfguidin again sic things as thir thar is nae law but they wha are o christ jesus hae crucifyt the flesh wi its desires and hankerins gin we leeve by the spirit by the spirit lat us een be airtit lat us no be seekin for vain glorie challengin ane anither envyin ane anither,GAL,5,SCO1904
167,GAL.6.SCO1904,brethren gin aiblins a man be betrayt intil a faut ye wha are spiritual recover sic a ane i the spirit o canniness lookin to yersel least ye yersel be tempit uphaud ye ane anithers burdens sae sal ye perform the law o christ for gin a man thinks he is something whan he is naething he is but deceivin his sel in his ain mind but lat ilka man test his ain wark and than sal he hae pleasur in himsel allenarlie and no in what anither thinks for ilka man sal cairry his ain backburden nanetheless lat him that is instructit i the word hae fellowship wi him that instructs in a gude things dinna deceive yer sels god isna to be mocked for what a man saws the same sall he shear for he that saws till his ain flesh oot o the flesh sal hae corruption but he wha saws to the spirit oot o the spirit sal hae lifeforaye but in doin what is weel lat us no be cuistendoon for in due time we sal reap gin we gienaup sae than een as we hae openins lat us work what is gude toward a men special toward the hoosehauld o the faith see wi sic muckle letters i wrate tye wi my ain haun as monie as wad mak a bonnie schaw i the flesh they wad gar ye be circumceesed only that they soudna dree persecution for the cross o christ for no een they wha hae become circumceesed are their sels observin the law but they wad hae ye circumceesed that they micht boast theirsels in your flesh but wi me lat it be far frae boastin gin it bena in the cross o oor lord jesus christ throwe wham the warld to me is crucifyt and i to the warld for in christ jesus naither circumceesion is onything nor uncircumceesion but a new creation and till as mony as are gaun on by this rule peace and mercy on them and on the isral o god for the lave lat nane gie me fash for i bear aboot in my body the brands o the lord jesus oor lord jesus christs favor wi yere spirit brethren amen,GAL,6,SCO1904
168,EPH.1.SCO1904,paul an apostle o christ jesus throwe the wull o god to the saunts in ephesus and a the leal anes in christ jesus lovinfavor to ye and peace frae god oor faither and the lord jesus christ blessed aye the god and faither o oor lord jesus christ wha blesst us in a spiritual blessin on heigh in christ conform to his acceptin us in him afore the upbiggin o the warld that we soud be pure and wyteless in his presence in love settin us oot aforehaun for adoption o bairns by jesus christ to himsel conform to the gudepleasur o his wull to the praise o the glorie o his lovinfavor wi whilk he favored us in the beloved ane in wham we hae salvation throwe his blude the passinby o offences een as by the richness o his favor whilk he gart to owerflow to us in a wisdom and skill makin kent to us the hidden secret o his wull een by his gude guidin that he ettled in his sel lookin to the perfeteness o the times to bring thegither a things for christ o things in heeven and things on yirth a in him in wham een we war made an inheritance bein set oot aforehaun by the purpose o him wha works a things by the coonsel o his ain mind that we soud be for the praise o his glorie wha war the first to lippen to christ in wham ye too hearin the leal word the gudetidins o yere salvation in wham lippenin war sealt wi the holie spirit o promise wha is the arles o oor inheritance till the possession be a redeemed to the praise o his glorie for the same cause i too hearin o yere faith i the lord jesus and the love ye hae to a the saunts am aye giean thanks on yere accoont namin ye ower i my prayers that the god o oor lord jesus christ the faither o glorie may gie ye a spirit o wisdom and revealin in his knowledge yere inward een bein fu o licht that ye may come to ken what the hope o his blythebidden is what his rich inheritance o glorie i the saunts and what the unmeasured vastness o his pooer toward us wha hae faith een as by the up haudin o his micht whilk he wrocht in christ raisin him frae mang the deid and settin him doon amang a the heevenlies at his ain richthaun far up aboon a rule and authoritie and pooer and dominion and ilka name that is named no alane i this warld but eke in that that is to come and pat a things under his feet and gied him as heid ower a things to the kirk whilk in sooth is his body the completion o him wha completes a in a for himsel,EPH,1,SCO1904
169,EPH.2.SCO1904,and you brocht to life war deid in offences and sins in whilk ye gaed in time bypast een as in the way o this warld conform to the ruler o the pooer o the air the spirit noo workin i the bairns o dourness wi wham een we oorsels had oor life at ae time i the fainness o the flesh obeyin the craikins o the flesh and o the thochts and war bairns o wrath by natur een as war the lave but god plenteous in mercy for his unco love he loed us wi een tho we war deid by oor sins brocht us to life alang wi christ by tenderlove are ye saved and wi him raised us up and wi him gied us heevenlie seats in christ jesus that he micht schaw i the ages to come the unco owergaun riches o his love in kindness to us in christ jesus for it is by his love ye hae been saved throwe faith and this comes aboot no frae you it is gods free gift no frae warks least ony ane soud boast for his ain wark are we oorsels bein formed in christ jesus for gude warks whilk god afore made ready that we soud gang in them sae keep ye in mind that at ae time ye gentiles i yere flesh named uncircumceesion by the saecad circumceesion in flesh made wi hauns that ye war at yon time staunin sindry frae christ bein fremd to the citizenship o isral and bein strangers as to the covenants o promise wantin hope and wantin god i the warld but enoo in christ jesus ye wha war ance farawa are made sib in the blude o christ for he is the makin o oor peace wha made baith to be aye and dang doon the dividinwa haein in his ain flesh dune awa the hostility and the law o requirements in ordinances that oot o the twa he soud mak to his sel ae newformed man makin peace and soud reconcile them baith perfetely in ae body to god throwe the cross slayin the hostility by the same and cam and delivert the gudeword o peace to you o the farawa and peace to the nar athaun for it is throwe him we hae the cominin we baith i the ae spirit to the faither sae than ye are nae mair fremdfolk and gangrels but are marrows o the saunts and are o the hoosehauld o god bein upbiggit on the fundation o the apostles and prophets christ jesus his sel the heid cornerstane in wham the hail edifice i the way o bein fitly laid thegither is growin to be a holie temple o the lord in wham ye too are bein biggit thegither intil a dwallinplace o god i the spirit,EPH,2,SCO1904
