,book,chapt,version,text,second,label
3288,LUK,24,USNT,the saa him aa richt but the didnae ken wha he wus,an dinnae road iz intae temptation but save iz frae tha wickit yin fer yours is tha kingdom tha pooer an tha glorie fer iver an iver amen fer if you forgie fowk whan the dae wrang agin ye then yer heivenlie faither wull forgie you as weel,1
3289,LUK,24,USNT,an he saed tae thaim whut wur ye taakin aboot thair alang tha road,efter tha crood wus put oot tha dure jesus gaed in an tuk tha wee lass bi tha han an she ris tae hir feet,1
3290,LUK,24,USNT,the cum tae a stap lukkin doon in tha mooth,an noo that a masel yer loard an taicher hae waasht yer feet you shud waash yin anithers feet tae,1
3291,LUK,24,USNT,an yin o thaim caad cleopas saed tae him ye maun be a stranger in jerusalem if ye hinnae heerd ocht o whuts bin happenin thair in tha last wheen o days saed he tae thaim whut things,he heerd whut a guid answer jesus haed gien an he axt him this o aa tha commauns whut yin is tha maist impoartin,1
3292,LUK,24,USNT,an the saed did ye no hear aboot jesus o nazareth a proaphit michtie in his wurds an daeins afore god an aa tha fowk,an he toul thaim tak naethin wi ye fer tha road nether stav tae studie ye ner baag tae cairrie ocht in ner breid ner siller an nae spare claes,1
3293,LUK,24,USNT,an aboot hoo oor heid preeshts an heidyins hannit him ower,an yin o thaim a thortie on tha laa tried tae ketch him oot wi this question maister whuts tha maist impoartin commaun in tha laa,1
3294,LUK,24,USNT,the passt a sentence o deith on him an nailt him tae a cross sae the did,but you hae kep tha guid wine tae noo,1
3295,LUK,24,USNT,we haed thocht he wus tha yin that wud redeem israel,an the niver saed ocht tae oniebodie fer the wur that feart,1
3296,LUK,24,USNT,oniehoo its thrie days since this happent,an as the wur leain tha toon wi a big crood follaein thaim the saen blin bartimaeus tha sinn o timaeus sittin beggin on tha bunker o tha road,1
3297,LUK,24,USNT,ay an parteeclar weemen frae amang iz that wur up earlie at his tomb tuk iz bak whan the saed the cudnae fin his bodie an the cum bak an toul iz thed saen a vision o angels sayin jesus wus leevin an sartin o thaim that wus amang iz went tae tha tomb an richt eneuch the fun it jist as tha weemen haed saed jesus wusnae thair,richt awa up he got gethert up his mat an waakit oot in front o thaim aa,1
3298,LUK,24,USNT,then jesus saed tae tha twa o thaim ye coofs yis ir slow tae tak in aa that tha proaphits spauk aboot the saed that christ wud hae tae dree aa these things afore he gaed intae his glorie did the no,then gie caesar whut belangs tae caesar saed he an gie god whut belangs tae god,1
3299,LUK,24,USNT,an stairtin wi moses an aa tha proaphits he made plain tae thaim whut aa tha scriptures saed aboot hissel,tha herd tuk aff doon tha hill heid furst intae tha loch an tha hale lock wus droont,1
3300,LUK,24,USNT,an whan the cum nearhan tha village whar the wur gaun he lukt as if he wus gaun on furder,fer a wull pit tha richt wurds in yer mooth an gie yis tha wut tae uise thaim sae nane o yer enemies wull be able tae stan up tae yis or say a wurd agin yis,1
3301,LUK,24,USNT,but the coaxt him sayin wud ye no stap wi iz fer its dailygan an itll be dairk shuin,pilate got a wee sign made an put it up on tha cross wi this writ on it jesus o nazareth tha king o tha jews,1
3302,LUK,24,USNT,sae he went in wi thaim,an the saed jesus o nazareth,1
3303,LUK,24,USNT,an it cum aboot as he sut doon tae ait wi thaim that he tuk breid blisst it an brauk it an gien it tae thaim,if a wus tellin tha truith but whut did ye hut me fer,1
3304,LUK,24,USNT,an aa o a suddent thair een wus apent an the kent wha he wus an wi that jesus wus nae mair tae bi saen the saed tae yin anither did it no set oor hairts alow whan he taakt tae iz on tha road an apent up tha scriptures tae iz,some thocht that yin o tha oultime proaphits haed cum bak tae life an ithers thocht it wus mebbe elijah,1
3305,LUK,24,USNT,sae the ris up tha same oor an the went bak tae jerusalem an fun tha eleiven gethert thegither an thaim that wur wi thaim,thairll be a wile baad time o sufferin aa ower tha lan an gods angr wull be agin this fowk,1
3306,LUK,24,USNT,tha loard is ris richt eneuch the wur toul,an aa tha fowk cum at tha furst licht tae listen tae him in tha hoose o god,1
3307,LUK,24,USNT,an simon haes saen him an tha twa frae emmaus toul aa that haed happent on tha road an hoo the knowed it wus jesus tha minit he brauk tha breid,these things is whut sullies a bodie but aitin wioot tha ritual waashin o hans daesnae sullie him,1
3308,LUK,24,USNT,an jist as the wur taakin thair stud jesus in tha middle o thaim aa an he saed tae thaim peace be wi yis but the wur aa hairtscarred an afeart an thocht the haed saen a wraith,this brocht aboot whut tha proaphit saed wud happen the divid ma dishables amang thaim an the cloddit dice fer ma claes an sittin doon the kep watch ower him thair,1
3309,LUK,24,USNT,an he saed tae thaim fer why ir yis put aboot,she wull hae a sinn an ye ir tae gie him tha name jesus fer he wull save his ain fowk frae thair wrangdaeins,1
3310,LUK,24,USNT,an why aa tha doots wiin yersels,she wull hae a sinn an ye ir tae gie him tha name jesus fer he wull save his ain fowk frae thair wrangdaeins,1
3311,LUK,24,USNT,tak a luk at ma hans an ma feet,becas o that tha sodgers cum an brauk tha legs o tha furst man that wus crucyfied alang wi jesus an then tha same thing wi tha tither,1
3312,LUK,24,USNT,its masel hannle me an see fer a wraith haesnae flesh an banes as yis see a hae,sae efter judas haed taen tha bit o breid awa he went,1
3313,LUK,24,USNT,an efter sayin this he showed thaim his hans an his feet an the wur that blythesum an dumfoonert the cud harlie tak it in,then he sent ither sarvints tae thaim mair ner he sent tha furst time an tha fairmers traitit thaim aa tha same wye,1
3314,LUK,24,USNT,an he axt thaim hae yis ocht tae ait in tha hoose,on tha furst day o tha faist o bairmless breid whan the aye killt tha passower lamb jesus follaers axt him whar dae ye want iz tae gang tae mak readie fer tha passower mail,1
3315,LUK,24,USNT,the gien him a bit o brannert fish an a wee bit o honeycomb an he tuk it an et it afore thaim,hoo can ye say tae yer brither cum here brither let me tak tha skelf oot o yer ee an yit ye cannae see tha plenk in yer ain ee,1
3316,LUK,24,USNT,then he saed tae thaim this is whut a toul ye whaniver a wus still amang yis that aa tha things that wur writ doon consarnin me in tha laa o moses tha proaphits an tha psaums maun cum aboot,an jesus went on tae say yin time thair wus this weelaff man that dresst up in fancie claes an leeved iverie day in tha lap o luxurie,1
3317,LUK,24,USNT,then he apent thair mines tae unnerstan tha scriptures sayin tae thaim its writ doon that tha christ maun suffer he maun dee an rise frae tha deid tha thurd day an that wi ma thortie yis ir tae praich this message tae aa nations repent o yer sins an god wull forgie yis,an efter sayin this he showed thaim his hans an his feet an the wur that blythesum an dumfoonert the cud harlie tak it in,1
3318,LUK,24,USNT,yis ir tae stairt frae jerusalem,he caad his twal follaers thegither an he gien thaim tha pooer tae drive oot ill spirits an tae cure aa kines o disaises an ailments,1
3319,LUK,24,USNT,yous hae saen these things sae yis ir wutnesses o thaim aa,tha hale warls rinnin efter him noo thair wus some greeks amang tha fowk that haed cum up fer tha passower,1
3320,LUK,24,USNT,noo listen tae me a wull senn upon yis tha gift ma faither promist,noo as simon peter wus stud wairmin hissel the axt him agane you wudnae be yin o thaim follaers o his wud ye,1
3321,LUK,24,USNT,but yous ir tae stap here in jerusalem tae yis ir claithed wi pooer frae abain,then jesus saed tae tha centurion gae it wull be daen fer ye tha wye ye believed it wud,1
3322,LUK,24,USNT,an jesus led thaim oot tha lenth o bethanie an thair he liftit up his hans an blisst thaim,an wha gien ye tha thortie,1
3323,LUK,24,USNT,an it cum aboot that while he wus blissin thaim he pairtit frae thaim an he wus taen up intae heiven,whan jesus heerd this he saed tae tha man thairs jist yin thing ye still hae tae dae,1
3324,LUK,24,USNT,an the wurshipt him an the went bak tae jerusalem wi blythesum hairts,whaniver the fun him the saed tae him iverie yins lukkin fer ye an jesus cum bak wi cum on an well gang awa frae here tae tha toons roon aboot a hae tae praich thair as weel fer thats whut a cum here fer tae dae,1
3325,LUK,24,USNT,an the spent aa thair time laudin an blissin in tha hoose o god,fer jhone tha baptiser wusnae intae aitin breid ner drinkin wine whaniver he cum an ye say thairs a baad spirit in him,1
3326,JHN,1,USNT,richt at tha stairt ye haed tha wurd,but na ma kingdom isnae frae here,1
3327,JHN,1,USNT,tha wurd wus thair alang wi god an tha wurd wus god,the cum intae tha hoose the saen tha wee wean wi his mither mary an the bood doon an wurshipt him,1
3328,JHN,1,USNT,he wus thair alang wi god richt frae tha stairt,jesus cum bak wi this tak heed an dinnae let oniebodie lead yis aglee fer monies a yin wull cum in ma name sayin a be tha christ or tha time is cum,1
3329,JHN,1,USNT,iverie last thing wus made throu him athoot him naethin ava wus iver made,she rowlt him up in bits o claith an put him in a manger wi tha fother acause thair wus nae ruim fer thaim in tha ludgin hoose,1
3330,JHN,1,USNT,in him wus life an this life wus tha licht o mankine,an then he wull senn his angels oot tae gether thegither his chosen yins frae tha fower wuns frae tha ootermaist pairt o tha irth tae tha ootermaist pairt o heiven,1
3331,JHN,1,USNT,tha licht beams in tha mirk but tha mirk cannae pit it oot,but even tha verie hairs o yer heid ir aa coontit sae dinnae be feart yis ir warth mair ner a hale wheen o sparras,1
3332,JHN,1,USNT,thair wus this man sent oot frae god bi tha name o jhone,the stript him an put a scarlet robe on him an then the plettit thoarns thegither tae mak a croon an the set it on his heid,1
3333,JHN,1,USNT,an he cum fer tae be a wutness tae tha licht sae that acause o him aa fowk micht believe,roon aboot this time tha emperor caesar augustus gien oarders that a heidcoont wus tae be taen o aa tha fowk in iverie pairt o his empire,1
3334,JHN,1,USNT,noo he wusnae thon licht hissel but he cum fer tae be a wutness tae tha licht,watch an pray sae ye dinnae gie in tae temptation,1
3335,JHN,1,USNT,tha true licht him that gies licht tae iverie man wus cumin intae tha warl,fer if ye dae tha skins wull brust an tha winell be skailt,1
3336,JHN,1,USNT,he wus in tha warl but tha mair it wus o his makkin tha warl didnae ken wha he wus,he axt thaim whut did ye gang oot intae tha wulderness fer tae see,1
3337,JHN,1,USNT,he cum tae his ain lan but his ain fowk wantit naethin tae dae wi him,an iverie brench that daes gie fruit he faces bak a weethin sae that it fruits aa tha mair,1
3338,JHN,1,USNT,yit tae aa thaim that did tak him in an trustit on his name he gien thaim tha richt tae be makkit childer o god childer that wus no boarn bi tha wye o nature ner bi tha wull o flesh an bluid ner bi tha notion a husban micht hae,the cud harlie believe it an the gien glorie tae god yit at tha same time the felt feart an saed we hae saen things theday that ir ower ocht efter this jesus went oot an saa a tex man bi tha name o levi sittin in his hut,1
3339,JHN,1,USNT,na but childer that wus boarn o god,jesus caad his follaers tae him an saed ma hairt gaes oot tae these fowk the hae bin here wi me this thrie days an the hae naethin lef tae ait,1
3340,JHN,1,USNT,tha wurd cum tae be flesh an bluid an leeved amang iz,then the put wine mixt wi myrrh tae his mooth but he wudnae tak it,1
3341,JHN,1,USNT,we hae saa his glorie tha glorie o tha yin an ainlie that cum frae tha faither fu o grace an truith,on tha furst day o tha week at tha scraich o day tha weemen cum tae tha tomb an brocht tha spices the haed makkit readie,1
3342,JHN,1,USNT,he caad oot cryin thons him a wus taakin aboot whaniver a saed him that cums efter me is abain me fer he wus thair afore iver a wus boarn,the wull pit ye oot o tha meetin hooses ay tha day is cumin whan oniebodie that kills ye wull think ther daein gods wark,1
3343,JHN,1,USNT,oot o tha fu guidness o his hairt we hae aa got yin blissin on tap o anither,the aa et thair fill an the gethert up aa tha wee bits o breid an fish eneuch tae fill twal creels,1
3344,JHN,1,USNT,tha mair tha laa wus gien throu moses grace an truith cum throu jesus christ,ay sae whaniver ye see tha signs am taakin aboot then yell know weel eneuch,1
3345,JHN,1,USNT,naebodie haes iver saen god it is gods yae sinn wha bides in tha hairt o tha faither that haes showed him tae fowk,he saed tae thaim hoo cum yis ir thinkin laik this,1
3346,JHN,1,USNT,noo tha day tha jews sent preeshts an levites frae jerusalem tae ax jhone wha he wus here is whut he saed tae thaim,na as lang as tha bridegruim is wi thaim the cannae fast but tha day wull cum whaniver tha bridegruim wull be tuk awa frae thaim an cum that day thell keep a fast,1
3347,JHN,1,USNT,he wus aye apen aboot it an toul thaim strecht am no tha christ,an efter leain nazareth he gaed tae capernaum an he stapt thair,1
3348,JHN,1,USNT,sae the axt him wha ir ye then,sae as it wus wearin on tae evenin joseph o arimathea a man weel up in tha cooncil wha wus waitin on tha kingdom o god hissel tuk his courage in his hans an he went up tae pilate fer tae ax fer tha bodie o jesus,1
3349,JHN,1,USNT,ir ye tha proaphit we ir waitin on,an tha weelaff yins gien weel nae doot aboot it then alang cum a weeda wumman an she drapt in twa wee coins amuntin tae verie little ,1
3350,JHN,1,USNT,at tha enn o it the speered wha ir ye,fer a ken hoo tae tak oarders a hae sodgers unner me as weel,1
3351,JHN,1,USNT,gie iz yer answer tae tak bak tae thaim that sent iz,tha mair it stairts aff as a gye wee seed yit whan it growes it becums a big bush an then a tree sae as tha wee burds cum an tuk shilter in its brenches,1
3352,JHN,1,USNT,whut hae ye tae say fer yersel,tha man that cums in bi tha yett is tha hird o tha sheep,1
3353,JHN,1,USNT,jhone answert wi tha wurds o isaiah tha proaphit am tha voice o yin caain oot in tha wiles mak tha road readie fer tha loard cumin,an whaniver tha yins that wur lukkin efter tha pigs saen whut haed happent the run aff an toul iveriebodie in tha toon an kintrie roon aboot,1
3354,JHN,1,USNT,noo some pharisees that haed bin sent speered him mair gin yer no tha christ ner elijah ner tha proaphit hoo cum yer baptisin fowk then,an jist dae tae ithers whut yis wud want thaim tae dae tae yersels,1
3355,JHN,1,USNT,a baptise wi watter jhone answert but thairs yin stud amang ye that yis dinnae know,noo whan tha sin wus gaun doon aa tha yins that haed seeck fowk wi aa kines o disaises brocht thaim tae jesus an he put his hans on iverie yin o thaim an hailt thaim,1
3356,JHN,1,USNT,him that cums alang efter me hes tha yin,but na lizbeth saed he maun hae tha name o jhone,1
3357,JHN,1,USNT,an am no fit tae lowse his buits fer him,noo whan tha centurion saen whut wus daen he gien glorie tae god an saed thon man wus a guid man thats fer shair an aa tha fowk that cum tae see whut wus gaun on whan the saa whut wus daen the bate thair breeshts in sorra an went awa,1
3358,JHN,1,USNT,noo this aa cum aboot at bethanie on tha faur side o tha joardan whar jhone wus baptisin,but you maun be perfait jist as yer heivenlie faither is perfait,1
3359,JHN,1,USNT,tha nixt day jhone saa jesus cumin up tae him an saed luk an behoul tha lamb o god that taks awa tha sin o tha warl thons tha man a wus taakin aboot whaniver a saed thairs a man cumin efter me thats o heicher stannin ner me fer he wus thair afore iver a wus boarn,an tha message he gien wus this efter me thair wull cum yin that is michtier ner me,1
3360,JHN,1,USNT,a didnae unnerstan masel wha he wus but it wus tae mak him kent tae israel that a cum baptisin wi watter,isaiahs proaphesie cums aboot in thaim whaniver he says you wull aye be hearin but niver unnerstannin yell aye be seein but niver takkin it in,1
3361,JHN,1,USNT,then jhone gien this accoont a saa tha spirit cum doon frae heiven laik a doo an bide on him,the cudnae gie him onie answer tae that ava,1
3362,JHN,1,USNT,a wudnae a knowed him but tha yin that sent me fer tae baptise wi watter toul me whan ye see tha spirit cum doon an bide on a man its him that wull baptise wi tha halie spirit,he wull gang in an oot an fin guid gress,1
3363,JHN,1,USNT,a hae saa it fer masel an am wutness tae it,hooaniver tha fowk o tyre an sidon wull be better aff on tha day o reckonin than yous wull,1
3364,JHN,1,USNT,thon man daes be tha sinn o god,stap in tha yin hoose an ait an drink whut the set afore ye fer a warker is warth his wages,1
3365,JHN,1,USNT,tha nixt day jhone wus bak thonner wi twa o his ain follaers,he sent oot his sodgers fer tae desthroy thaim murderers an he brunt thair citie doon,1
3366,JHN,1,USNT,whaniver he saa jesus slippin bye he saed luk thons tha lamb o god whaniver tha twa follaers heerd him say this the turnt an went efter jesus,but gae noo an tell his follaers an tell peter that jesus is awa on aheid o yis intae galilee,1
3367,JHN,1,USNT,lukkin roon jesus saa thaim cumin efter him an axt whut dae yis want,this is tha yin tha scriptures taak aboot whaniver the say listen all senn oot ma messenger aheid o ye he wull mak readie tha wye afore ye,1
3368,JHN,1,USNT,rabbi the saed rabbi stans fer dominie whar ir ye stappin thenicht,fer if ye dae tha skins wull brust an tha winell be skailt,1
3369,JHN,1,USNT,cum on an see he answert,but as jesus wus gaun thair tha thrang wus croodin roon him,1
3370,JHN,1,USNT,sae the went an saa whar he wus stappin an the passt tha rest o tha day wi him fer it wus aboot fower in tha efternuin,fer up tae jhones time aa tha proaphits an tha laa foretoul whut wus tae happen,1
3371,JHN,1,USNT,andra simon peters brither wus yin o tha twa that went efter jesus whaniver the heerd whut jhone haed saed,but hell cum bak wi a tell ye a dinnae know a thing aboot ye or whar ye cum frae,1
3372,JHN,1,USNT,tha furst thing andra daen wus tae fin his brither simon an tell him we hae fun tha messiah mainin tha christ,hooaniver jesus tuk hir bi tha han an caad oot cum on chile up ye git an hir spirit cum bak an at yinst she got up,1
3373,JHN,1,USNT,an he brocht him tae jesus,sae the axt him but whut maun we dae if wer tae dae tha wark that god wud hae iz dae,1
3374,JHN,1,USNT,jesus tuk a guid luk at him an he saed sae ye ir simon jhones sinn,he toucht hir han an tha faivir left hir an she got up an stairtit tae sarve an luk efter him,1
3375,JHN,1,USNT,cephas stans fer peter mainin a roak tha nixt day jesus made up his mine tae heid fer galilee,but he answert a tell ye tha truith a know naethin aboot ye an jesus warnt thaim yer tae watch oot al o yis fer ye dinnae ken tha day or tha oor all be bak,1
3376,JHN,1,USNT,he fun philip an saed tae him follae me,sae yis can tell tha weather bi tha luk o tha sky but yis cannae wark oot tha signs o tha times a wickit an adulterous generation luks fer a miraclis sign but nane wull be gien it apairt frae tha sign o jonah,1
3377,JHN,1,USNT,noo philip cum frae bethsaida tha same toon as andra an peter,sae richt awa tha king sent aff a sodger tae gang an bring tha heid o jhone tha baptiser bak wi him,1
3378,JHN,1,USNT,philip fun thannie an toul him we hae fun tha yin moses writ aboot in tha laa him that tha proaphits writ aboot forbye jesus o nazareth tha sinn o joseph,o faither you that aye daes whuts richt tha mair tha warl daesnae ken ye a ken ye an these follaers o mine ken that ye hae sent me,1
3379,JHN,1,USNT,nazareth cud ye iver see ocht guid cumin oot o thonner,a saed a be gods sinn an fer that yis chairge me wi blesphemie,1
3380,JHN,1,USNT,cum an see fer yersel saed philip,whaniver jesus cum tae tha district o caesarea philippi he axt his follaers wha dae fowk say tha sinn o man is,1
3381,JHN,1,USNT,whan jesus saa thannie cumin he saed this aboot him noo thairs a guid israelite thairs naethin fauss aboot him hoo is it ye ken me,heres whut a bid ye love yin anither,1
3382,JHN,1,USNT,jesus answert a saa ye whaniver ye wur still unner tha fig tree afore philip caad ye,then tha wun drapt an it wus aa peace an quaitness,1
3383,JHN,1,USNT,wi that thannie declared rabbi you ir tha sinn o god sae ye ir,tha maisters o tha laa an tha heid preeshts lukt fer a wye tae tak houl o him thair an then fer the kent he haed spauk agin thaim in this parable,1
3384,JHN,1,USNT,tha king o israel jesus saed you lippen jist wi me tellin ye a saa ye unner tha fig tree,yin day jesus saed tae his follaers thairll aye be temptation tae dae wrang but dear halp tha yin that daes tha tempin it wud be faur better fer him if a millstane wus hung roon his neck an he wus drapt intae tha sea rether ner him leadin yin o these puir wee craiters asthray,1
3385,JHN,1,USNT,weel yell see ower mair ner that,he answert ay loard ye ken that a love ye,1
3386,JHN,1,USNT,an then he addit am tellin yis tha truith thairs a day cumin whaniver yell see heiven apen up an tha angels o god gaun up an cumin doon on tha sinn o man,whutiver hoose yis ir stappin in he saed bide yer time in it til yis tak yer lave o tha toon,1
3387,JHN,2,USNT,cum tha thurd day thair wus this waddin on at cana in galilee an tha mither o jesus wus at it,an the put a blinfoul on him the hut him on tha face an axt weel proaphit tell iz wha skelpt ye,1
3388,JHN,2,USNT,an jesus wus axt tae tha waddin tae alang wi his follaers,tha fairmers tuk houl o his sarvints the bate yin o thaim the put anither tae deith an the staned a thurd,1
3389,JHN,2,USNT,noo whaniver tha wine wus aa daen jesuss mither saed til him the hae nae mair wine,an tha man stud up sae he did an he went awa hame,1
3390,JHN,2,USNT,wumman dear jesus answert whut ir ye bringin me intae it fer,whaniver peter saa that follaer he axt loard whut aboot him,1
3391,JHN,2,USNT,his mither saed til tha sarvints whutiver he bids yis dae dae it,blisst ir tha yins thats traitit ill fer daein whuts richt fer thairs is tha kingdom o heiven,1
3392,JHN,2,USNT,noo nearhan thair wus six stane watter crocks tha soart tha jews uised fer ritual waashin that cud houl aboot twuntie tae thurtie gallon apiece,if tha guviner hears tell o this well taak him roon an keep ye oot o bother,1
3393,JHN,2,USNT,jesus toul tha sarvints fill tha crocks fu o watter,hes pittin fowk tha wrang road,1
3394,JHN,2,USNT,sae the fillt thaim fu tae tha lip,thats a guid answer an becas o it qo he til hir whan ye gae bak hame yell fin tha ill spirit haes left yer dochter,1
3395,JHN,2,USNT,then he toul thaim noo lave a drap oot an tak it tae tha heid sarvint,an tha yins vext sair wi ill spirits wus aa cured,1
3396,JHN,2,USNT,sae the daen as the wur bid,but nae shuiner wur the oot than the stairtit tae spreed tha news aboot him aa roon tha hale kintrie,1
3397,JHN,2,USNT,an tha heid sarvint preed a wee taste o tha watter that haed bin turnt intae wine,sae jesus axt tha laayers an pharisees daes tha laa alloo ye tae hail fowk on tha sabbath day or no,1
3398,JHN,2,USNT,hed nae notion whar it cum frae tha mair tha sarvints that haed brocht tha watter knowed,naebodie iver taakt tha wye thon man daes tha sodgers toul thaim,1
3399,JHN,2,USNT,sae he tuk tha bridegruim tae tha yin side,on ma ain a can dae naethin a judge jist whut a hear an ma judgin is richt fer am no lukkin tae plaise masel but tae plaise him that sent me,1
3400,JHN,2,USNT,qo he onie ither bodie wud gie oot tha guid wine at tha furst an whan fowks hae a lock o drink in thaim the bring oot tha chaip stuff,whaniver jesus cum doon frae tha braeside big croods follaed him,1
3401,JHN,2,USNT,but you hae kep tha guid wine tae noo,did ye no ken that a maun be aboot ma faithers bizness here in his hoose,1
3402,JHN,2,USNT,this sign at cana in galilee wus tha furst that jesus wrocht,yer ee is tha lamp o yer bodie an if yer ee is guid yer hale bodie is fu o licht but whan yer ee is baad yer hale bodies fu o dairkness,1
3403,JHN,2,USNT,in daein this his glorie wus thair fer aa tae see an his follaers believed in him,tha wumman wus a greek wi nae jewish breedin frae tha region o syrophoenicia,1
3404,JHN,2,USNT,efter this jesus tuk hissel doon wi his follaers tae capernaum alang wi his mither an brithers an the aa stapt thonner fer twarthie days,all no lea yis laik orphan weans a wull cum tae ye,1
3405,JHN,2,USNT,whaniver tha time cum fer tha jews tae houl tha passower jesus gaed up tae jerusalem,but the kep on cryin oot crucyfie him crucyfie him pilate saed tae thaim a thurd time why whut wrang haes he daen,1
3406,JHN,2,USNT,an in tha coortyaird o tha hoose o god he cum on men dailin in kye sheep an doos an ithers sittin at thair tables changin siller,then yin o tha laayers saed tae jesus maister ir ye gettin at us as weel,1
3407,JHN,2,USNT,sae he put thegither a whup o coards an driv tha hale lock oot o tha temple gruns alang wi sheep an kye he skailt tha siller o tha money changers an coupt thair tables,cum on noo an well dae him in an whutiver his da wus fer leain him wull cum tae us sae the tuk houl o him an throwed him oot o tha vineyaird an put him tae deith,1
3408,JHN,2,USNT,tae thaim that soul doos he saed tak aa this awa oot o here hoo dar yis mak a margymore oot o ma faithers hoose his follaers haed mine o tha scripture whar its writ all be het up wi a hungr fer your hoose sae tha jews then axt him strecht whut sign cud ye gie iz fer pruif o yer richt tae dae aa this,an am no fit tae lowse his buits fer him,1
3409,JHN,2,USNT,jesus gien thaim tha answer fletten this temple an in thrie days a wull rise it agane,nixt day whan the haed cum doon aff tha hill a hale crood o fowk cum tae meet him an this man caad oot frae tha crood maister a beg ye wud ye tak a luk at ma sinn,1
