,book,chapt,version,text,second,label
2210,LUK,3,USNT,cainan wus tha sinn o arphaxad,acause thon follaer wus akwant wi tha heich preesht he wus allooed tae gae wi jesus intae tha verie coortyaird o tha heich preesht but peter haed tae houl on ootbye at tha dure,1
2211,LUK,3,USNT,arphaxad wus tha sinn o shem,sorra tae chorazim an sorra tae bethsaida fer if tha fowk o tyre an sidon haed saen tha warkin o gods pooer as yous hae saen it the wud hae repentit lang syne in seckclaith an eshes,1
2212,LUK,3,USNT,shem wus tha sinn o noah,whaniver a wus wi thaim a lukt efter thaim an kep thaim safe an siccar bi tha name ye gien me,1
2213,LUK,3,USNT,noah wus tha sinn o lamech,yis hae een ir yis blin,1
2214,LUK,3,USNT,lamech wus tha sinn o methuselah,but some o thaim that wus thair wus sair illplaised an saed yin tae tither whut fer wus this waste o guid nard,1
2215,LUK,3,USNT,methuselah wus tha sinn o enoch,yit a thurd time he cum bak an he saed tae thaim ir yis aye sleepin an aye takkin yer rest,1
2216,LUK,3,USNT,enoch wus tha sinn o jared,did a no cure ten men,1
2217,LUK,3,USNT,jared wus tha sinn o mahalalel,sae jesus gan awa wi thaim,1
2218,LUK,3,USNT,mahalalel wus tha sinn o kenan,at furst licht he turnt up yinst mair in tha temple coorts whar aa tha fowk gethert roon him an he sut doon an begun lairnin thaim,1
2219,LUK,3,USNT,kenan wus tha sinn o enosh,hoo cum this oyle wusnae soul an tha catter gien tae tha puir,1
2220,LUK,3,USNT,enosh wus tha sinn o seth,but jesus saed tha day wull cum whan aa these stanes wull be tummelt doon an no yin stane wull be left abain tha ither,1
2221,LUK,3,USNT,seth wus tha sinn o adam,blisst ir tha yins thats traitit ill fer daein whuts richt fer thairs is tha kingdom o heiven,1
2222,LUK,3,USNT,an adam wus tha sinn o god,but if tha sarvint says tae hissel hes a lang time o cumin tha maister an he aits an gets drunk an he stairts tae bate up aa tha ither sarvints weel noo tha maister wull cum bak on a day an oor whan hes no lukkin oot fer him an tha maister wull dae awa wi that sarvint,1
2223,LUK,4,USNT,an jesus bein fu o tha halie spirit cum bak frae tha joardan an wus taen bi tha spirit intae tha wulderness,an he saa twa boats pued up bi tha watters edge,1
2224,LUK,4,USNT,fer fowertie days he wus tempit bi tha deil an in aa thaim days he didnae ait ocht ava,wi that tha heich preesht tore his claes an saed whut need hae we o onie mair wutnesses,1
2225,LUK,4,USNT,an at tha enn o tha time he wus gye hungrie,iveriebodie thats on fer tha truith taks tent o whut a say,1
2226,LUK,4,USNT,an tha deil saed tae him if ye ir tha sinn o god tell that stane thair tae turn intae breid,he went in an saed tae thaim whuts aa this narration an yowlin aboot,1
2227,LUK,4,USNT,an jesus spauk bak tae him an saed it is writ doon that man cannae leeve bi breid alane but bi iverie wurd o god,monie o thaim saed hes bin tuk ower wi a divil an hes haiverin whut wud ye listen tae him fer,1
2228,LUK,4,USNT,then tha deil tuk him up heich an lut him see aa tha kingdoms o tha warl in a weethin o time,gae in bi tha nerra gate,1
2229,LUK,4,USNT,tha deil saed tae him aa tha pooer o these kingdoms a wull gie ye an tha glorie that gangs wi thaim fer its mine tae gie tae whaiver a laik,an oniebodie that says ye oul fool wull be rinnin tha risk o hell fire,1
2230,LUK,4,USNT,gin ye wull jist boo doon tae me it wull aa be yer ain,josiah wus tha faither o jeconiah an his brithers,1
2231,LUK,4,USNT,jesus saed til him awa or that satan fer tha guid buik says ye ir tae woarship tha loard yer god an tae sarve naebodie but him,then he cum bak tae his follaers an he fun thaim sleepin,1
2232,LUK,4,USNT,an tha deil brocht him tae jerusalem an tuk him up tae tha verie tap o tha hoose o god an saed tae him if ye ir tha sinn o god throw yersel doon frae here fer tha guid buik says he wull tell his angels tae luk efter ye an keep an ee on ye,mary wus aa throu hirsel as she tried tae mak sense o whut tha angel haed telt hir,1
2233,LUK,4,USNT,wi thair hans the wull haud ye up fer fear ye dunt yer fit agin a stane,an he stairtit aff bi tellin thaim whut ye hae jist heerd frae tha guid buik haes cum aboot theday,1
2234,LUK,4,USNT,an jesus saed bak tae him its in tha buik forbye ye ir no tae temp tha loard yer god an whan tha deil haed stapt aa tha tempin he tuk aff an lut him be fer a while,whut dae yis think tha laird wull dae,1
2235,LUK,4,USNT,an jesus cum bak in tha pooer o tha spirit intae galilee an he wus tha taak o tha hale kintrie roon aboot,he bid thaim on nae accoont tae tell oniebodie ocht aboot it an he toul thaim tae gie hir a bite tae ait,1
2236,LUK,4,USNT,an he taicht in thair meetin hooses an he haed a great name amang thaim aa,whan did we see ye seeck or in jail an went an visitit ye,1
2237,LUK,4,USNT,an he cum tae nazareth whar he haed bin raired an as he aye daen he went intae tha meetin hoose on tha sabbath day an stud up fer tae read,the tye up heavie burdens owerwechtie tae cairt an the pit thaim on fowks shooders but they thairsels ir no wullin tae lift a fingr tae halp thaim,1
2238,LUK,4,USNT,the gien him tha screed o tha proaphit isaiah an whan he haed apent tha buik he fun tha place whar it wus writ doon tha spirit o tha loard is cum ower me fer he haes anointit me tae tell oot tha guid news tae tha puir he haes sent me fer tae hail tha hairtbrauk tae lowse thaim thats bun tae gie sicht tae tha blin fer tae set free thaim thats trod doon an fer tae praich tha yeir o tha loards grace,tha yin that haes bin forgien a wee bit wull onlie love a wee bit,1
2239,LUK,4,USNT,whan jesus haed rowlt up tha screed he gien it bak tae tha man in chairge an he sut doon,laik yell fin in tha buik o isaiah tha proaphit he spauk o jhone whan he saed a voice is cryin oot in tha wiles mak readie tha wye o tha loard mak his pads strecht fer him iverie glen wull be fillt in an iverie muntin an knowe levelt oot an tha crookit wyes wull be makkit strecht an tha reuch wyes makkit flet,1
2240,LUK,4,USNT,an naebodie in tha meetin hoose cud tak thair een aff him,at midnicht tha cry rung oot heres tha bridegruim cum on oot an meet him then aa tha lasses waakent up an the trimmed thair lamps,1
2241,LUK,4,USNT,an he stairtit aff bi tellin thaim whut ye hae jist heerd frae tha guid buik haes cum aboot theday,the made an approach tae philip wha cum frae bethsaida in galilee,1
2242,LUK,4,USNT,an aa spauk weel o him an the cud harlie tak in tha wunsum wurds that cum oot o his mooth,sae tha owerseer toul him tak yer bill sit doon thair quick an pit doon fiftie an tae anither he saed an whut dae ye owe,1
2243,LUK,4,USNT,he telt thaim this nae doot ye wull quote tha oul saw at me docter hail yersel an yell say whut we heerd ye daen in capernaum dae it here in yer ain hametoon as weel,tha rain cum doon tha watter ris an tha wuns blattert an bate agin thon hoose o his,1
2244,LUK,4,USNT,an he saed a warrant ye this nae proaphit is iver walcum in his ain hametoon,yin wus a pharisee an tha ither wus a tex man,1
2245,LUK,4,USNT,am tellin ye tha truith in tha days o elijah tha heivens wus shut up fer thrie yeir an six month an thair wus a big hungr ower aa tha lan,she got up at yinst an stairtit tae sarve an luk efter thaim,1
2246,LUK,4,USNT,an thair wus monie weedas in israel at tha time,if this man wusnae frae god he cudnae a daen ocht ava,1
2247,LUK,4,USNT,elijah wusnae sent til onie o thaim but onlie tae a weeda wumman in serepta near tha toon o sidon,it haed bin jist tha wye tha angel haed toul thaim,1
2248,LUK,4,USNT,forbye thair wus monie lepers in israel in tha time o elisha tha proaphit but nane o thaim wus makkit clain apairt frae naaman frae syria,an sae it wus as the wur on thair wye this bodie saed tae jesus a wull follae ye nae metter whar yer fer saed jesus tae him foxes hae holes an burds hae nests but tha sinn o man haes naewhar he can caa hame,1
2249,LUK,4,USNT,whaniver the heerd these things aa tha fowk in tha meetin hoose wus wile angrie,wi aa that thair wus monies a yin did believe in him even amang tha heidyins,1
2250,LUK,4,USNT,an the ris up an the driv him oot o tha toon an the tuk him up tae tha broo o tha hill whar tha toon wus bigged fer tae throw him doon heid furst,wi you bein a taicher o israel saed jesus yed think ye wud unnerstan these things am tellin ye tha truith whut we ir tellin ye aboot is baith whut we ken an whut we hae wutnesst but yous fowk dinnae tak onie heed o iz,1
2251,LUK,4,USNT,but he passt richt throu tha middle o thaim an gaed on his wye,tha nummer o thaim that et wus aboot five thoosan men niver mine weemen an weans,1
2252,LUK,4,USNT,then jesus went on doon tae capernaum a toon o galilee,sae the went an saa whar he wus stappin an the passt tha rest o tha day wi him fer it wus aboot fower in tha efternuin,1
2253,LUK,4,USNT,an he wus taichin tha fowk thair on tha sabbath day,dinnae be thinkin a hae cum tae bring peace tae tha irth,1
2254,LUK,4,USNT,an the wur aa thunnerstruck wi his taichin fer tha wurds he spauk wus pooerfu,an naebodie in tha meetin hoose cud tak thair een aff him,1
2255,LUK,4,USNT,an in tha meetin hoose thair wus a man that haed a demon an ill spirit in him,efter these wurds jesus lukt up abain tae heiven,1
2256,LUK,4,USNT,an he scraicht oot lood hey lea iz alane jesus o nazareth whut dae ye want wi iz,whaniver he saa jesus slippin bye he saed luk thons tha lamb o god whaniver tha twa follaers heerd him say this the turnt an went efter jesus,1
2257,LUK,4,USNT,hae ye cum here tae dae awa wi iz,sae ye wud be a king then saed pilate,1
2258,LUK,4,USNT,a ken richt weel wha ye ir,his follaers saed bak tae him whar cud we get eneuch breid oot here in tha wiles tae feed sitch a crood o fowk,1
2259,LUK,4,USNT,ye ir tha halie yin o god but jesus chackt him an saed houl yer wheesht an cum oot o him an tha demon throwed him tae tha grun fornent thaim aa an it cum oot o him an it didnae hurt him ava,sae be merciefu jist as yer faither is merciefu,1
2260,LUK,4,USNT,an the wur aa dumfoonert an taakt amang thairsels an saed did ye iver hear tha laik o it,then a wull tell thaim strecht a niver knowed ye,1
2261,LUK,4,USNT,fer wi thortie an pooer he oarders tha ill spirits an at his biddin the cum oot sae jesus wus tha taak o tha hale kintrieside roon aboot,efter takkin him tae tha side awa frae tha thrang jesus put his fingrs intae tha mans ears,1
2262,LUK,4,USNT,an he gaed oot o tha meetin hoose an on tae simons hame,simon peter saed bak you ir tha christ tha sinn o tha leevin god,1
2263,LUK,4,USNT,noo simons guidwifes mither wus wile baad wi a faivir an the axt jesus fer tae mak hir better,in tha same wye tha mans a fool that gethers up stuff fer hissel an haesnae stored up tha richt soart o treysure wi god,1
2264,LUK,4,USNT,he stud ower hir an he chackt tha faivir an it left hir,an whaniver it wus hairvest time he sent his sarvints tae tha fairmers fer tae collect tha fruit,1
2265,LUK,4,USNT,she got up at yinst an stairtit tae sarve an luk efter thaim,sae the saed we cannae tell,1
2266,LUK,4,USNT,noo whan tha sin wus gaun doon aa tha yins that haed seeck fowk wi aa kines o disaises brocht thaim tae jesus an he put his hans on iverie yin o thaim an hailt thaim,cum tae be hailt on yin o thaim days an no on tha sabbath an this is hoo tha loard answert him,1
2267,LUK,4,USNT,forbye demons cum oot o monie o thaim cryin oot ye ir christ tha sinn o god an he wud chack thaim oarderin thaim no tae spake fer the kent that he wus tha christ,then whut tha proaphit jeremiah saed aforehan wud happen cum aboot a voice wus heerd in ramah greetin an lamentin,1
2268,LUK,4,USNT,whan it wus daylicht he depairtit an went tae a place he cud be on his ain,sorra tae you that ir lachin fer yis wull be greetin an sorrafu,1
2269,LUK,4,USNT,an tha fowk lukt fer him an cum tae him an axt him fer tae stye fer the didnae want him tae lea thaim,whut ir ye quizzin me fer,1
2270,LUK,4,USNT,but he saed tae thaim a maun praich tha guid news o tha kingdom o god tae tha ither toons as weel fer thats why a wus sent,fer a wusnae taakin on ma ain accoont but tha faither that sent me toul me whut tae say an hoo tae say it,1
2271,LUK,4,USNT,sae he kep on praichin in tha meetin hooses o galilee,betimes it haed made him brek awa frae his gairds an tha chains the haed bun him up wi an it haed driv him oot intae tha wiles,1
2272,LUK,5,USNT,yin day jesus wus stannin bi tha loch o gennesaret an aa tha fowk wus croodit roon him pushin an shuvin fer tae hear tha wurd o god,thair wus a man that haed twa sinns,1
2273,LUK,5,USNT,an he saa twa boats pued up bi tha watters edge,capernaum wus bi tha loch in tha district o zebulun an naphtali tae bring aboot whut wus foretoul bi tha proaphit isaiah in tha lan o zebulun an tha lan o naphtali on tha wye tae tha loch on tha ither side o tha joardan in galilee whar tha gentiles leeve tha fowk that sut in tha dairk hae saa a bricht licht an on tha yins leevin in tha lan o tha shedda o deith tha licht haes cum in,1
2274,LUK,5,USNT,but tha fishermen wus awa oot o thaim an the wur waashin thair neyts,an tha loard saed if yis haed faith as smaa as a mustert seed even yis cud say tae this mulberry tree cum oot bi tha ruit an plant yersel in tha sea an richt awa itd dae whut its toul,1
2275,LUK,5,USNT,an jesus got intae yin o tha boats whut belanged tae simon an axt him tae pit oot a weethin frae tha lan,the axt amang thairsels whas gaun tae rowl awa tha stane fer iz frae tha mooth o tha tomb,1
2276,LUK,5,USNT,an he sut doon an taicht tha fowk frae tha boat,thair wus onie amoont o gress thonner an tha men sut doon aboot five thoosan o thaim,1
2277,LUK,5,USNT,noo whan he haed daen taakin tae tha fowk he toul simon pit oot tae tha deep watter an let doon yer neyts fer a haal,an jesus saed tae thaim then all no be tellin yis ether bi whut thortie a dae these things he turnt tae tha fowk an toul thaim this parable thair wus this man plantit a vineyaird an he set it tae a wheen o tenantfairmers tae rin afore gaun awa fer a lang time tae anither kintrie,1
2278,LUK,5,USNT,simon saed dominie we hae wrocht aa nicht an tuk naethin,but yin o his follaers judas iscariot him that wud bethray him later on he wus agin it,1
2279,LUK,5,USNT,but nanethaless all dae as ye bid me an let doon tha neyts,he saed acause yer faith is sae waik,1
2280,LUK,5,USNT,an whan the haed daen this the catched a pooerfu lock o fish,weel ye cud hae put ma siller intae tha bank hoo cum ye didnae,1
2281,LUK,5,USNT,thair wus that monie that tha nettin stairtit tae cum apairt,tha warl cannae tak him in fer it nether sees him ner kens him,1
2282,LUK,5,USNT,sae the waved tae thair nighbers in tha ither boat tae cum an gie thaim a han an the fillt baith boats sae fu that the near sunk,hosanna in tha heichest heiven sae jesus went intae jerusalem an on intae tha hoose o god,1
2283,LUK,5,USNT,whaniver simon peter saa this he faad on his knees afore jesus an saed gawa frae me loard fer am a sinfu man,then whaniver a cum bak it cud hae made me a wee bit o intrest wi that tha king toul thaim that wur stannin roon aboot tak his coin frae him an gie it tae him that haes tha ten,1
2284,LUK,5,USNT,whaniver him an aa that wur wi him saa tha haal o fish the cud harlie tak it in,an he saed whut is it yis want,1
2285,LUK,5,USNT,an nether cud jeames an jhone tha sinns o zebedee that wur nighberin wi simon,abba faither he saed aa things ir poassible wi you,1
2286,LUK,5,USNT,jesus saed tae simon dinnae be feart,watch an pray sae ye dinnae gie in tae temptation,1
2287,LUK,5,USNT,frae noo on its men yell be ketchin,but in thaim days efter tha time o sufferin tha sin wull be mirkit an tha muin wull no gie onie licht tha starns wull be faain oot o heiven an tha pooers o tha lift wull be dinnelt,1
2288,LUK,5,USNT,whaniver the haed brocht thair boats tae lan the left aa an the follaed efter jesus,then tha wun drapt an it wus aa peace an quaitness,1
2289,LUK,5,USNT,anither time whan jesus wus in yin o tha toons thair wus this man wile baad wi leprosie,his mithers caad mary isnt she,1
2290,LUK,5,USNT,whaniver he saen jesus he faad doon afore him an begged him loard if ye hae a mine tae ye can mak me clain,but jesus chackt him an saed houl yer wheesht an cum oot o him an tha ill spirit made tha man trimmle an shake then it gie a scraich an cum oot o him,1
2291,LUK,5,USNT,an he put his han oot an toucht him sayin a wull shairlie,an the fun faut whaniver the saa some o his follaers aitin breid wi hans that wurnae clain thats tae say the haednae waasht thaim,1
2292,LUK,5,USNT,be clain an richt awa tha leprosie wus gan frae him,but yell no aye hae me wi ye,1
2293,LUK,5,USNT,an he chairged him tae tell naebodie but bid him gang an show hissel tae tha preesht,saed jesus summodie haes toucht me fer a felt tha pooer gang oot o me tha wumman seein that she cudnae hide cum an faad doon afeart an trimmlin at his feet,1
2294,LUK,5,USNT,gie an offerin fer yer cleansin saed jesus as moses telt iz in tha laa fer a wutness tae yin an aa that yer weel agane but fer aa this tha hale kintrieside taakt aboot him aa tha mair an cum tae hear him in thair droves an tae be cured o thair ailments,a tell ye tha truith whutiver ye bine on irth wull be bun in heiven an whutiver ye lowse on irth wull be lowsed in heiven,1
2295,LUK,5,USNT,then jesus tuk hissel awa frae thaim intae a quait place fer tae pray as he wus in tha habit o daein,yit yin abain solomon is here noo an their no listenin tha men o nineveh wull stan up in that day as weel wi this generation an thell condemn it fer they repentit whaniver jonah praicht tae thaim an yit yin abain jonah is here noo,1
2296,LUK,5,USNT,anither day as he wus lairnin tha fowk thair wus pharisees an taichers o tha laa sittin bye,noo whaniver the cum bak doon tha muntin tae tha crood o fowk a man cum up tae jesus an got doon on his knees afore him,1
2297,LUK,5,USNT,the haed cum frae aa tha villages roon aboot oot o galilee an judea an jerusalem an tha pooer o tha loard wus thair fer tae hail thaim,tha saicret o tha kingdom o god haes bin gien tae ye saed jesus but tae thaim thats ootside tha kingdom a taak in parables sae that the micht aye be lukkin but niver see an aye listenin yit niver unnerstan less the micht turn an thair sins be forgien,1
2298,LUK,5,USNT,an luk see a wheen o men wus bringin a paralysed man on a bed an the wur lukkin fer a wye fer tae bring him intae tha hoose tae lay him doon afore jesus,an whan jesus cum tae lan he fun a quare thrang o fowk fornent him an his hairt went oot tae thaim an he cured thair seeck fowk,1
2299,LUK,5,USNT,an whan the cudnae fin a road in acause o aa tha thrang the went up on tae tha tap o tha hoose an lut him doon on his bed throu tha ruif in amang tha fowk richt fornent jesus,anent sin becas the dinnae believe in me anent bein richt becas am gaun tae tha faither whar yell no see me onie mair an anent judgemen acause tha prince o this warl noo stans condemned bi god,1
2300,LUK,5,USNT,whaniver he saa thair faith he saed ma freen yer sins is aa forgien,an thaim at confesst thair sins wur baptised bi him in tha joardan river,1
2301,LUK,5,USNT,tha maisters o tha laa an tha pharisees stairtit taakin amang thairsels,an sae tha jews convoyed jesus frae caiaphas tae tha palace o tha roman guviner,1
2302,LUK,5,USNT,wha daes he think he is taakin sitch blesphemie,an jesus axt him whut dae the caa ye,1
2303,LUK,5,USNT,wha can forgie sins but god alane,noo at tha risin frae tha deid whase guidwife wull she be fer she wus merriet on tha hale seiven o thaim,1
2304,LUK,5,USNT,jesus knowed whut thair thochts wur an saed tae thaim hoo cum yis ir thinkin laik this,all gie tha half o whut a hae tae thaim at haes need o it,1
2305,LUK,5,USNT,is it aisier tae say yer sins ir forgien or tae say get up an waak,jist then some pharisees cum up an saed tae him get oot o here if ye want tae leeve fer herod haes it in mine tae kill ye gang tell thon sleekit oul fox saed jesus tae thaim that all be keepin on castin oot ill spirits an hailin tha seeck theday an themorra,1
2306,LUK,5,USNT,but noo yell see that tha sinn o man haes tha pooer tae forgie sins here on irth,mary haes waaled whuts best an itll no be taen awa frae hir,1
2307,LUK,5,USNT,jesus then saed tae tha man that haed bin paralysed get up tak yer bed wi ye an gang awa hame an richt awa he got up afore thaim gethert up his beddin an went aff hame praisin god,an tha maister o tha laa saed tae him weel saed maister its tha truith ye spake fer thair is yin god an nane ither but him an tae love god wi aa yer hairt an mine micht an main an yer nighber as yersel is mair impoartin than aa tha brunt offerins an secryfices ye cud mak whaniver jesus heerd tha sense tha man wus taakin he saed tae him ye ir no faur awa frae tha kingdom o god efter that naebodie wud dar pit onie mair questions tae him,1
2308,LUK,5,USNT,the cud harlie believe it an the gien glorie tae god yit at tha same time the felt feart an saed we hae saen things theday that ir ower ocht efter this jesus went oot an saa a tex man bi tha name o levi sittin in his hut,quick gae an tell his follaers he haes ris frae tha deid an hes awa on aheid o ye intae galilee,1
2309,LUK,5,USNT,an jesus saed tae him follae me levi ris up left aa behin him an follaed jesus,at tha stairt his follaers didnae unnerstan aa this,1
2310,LUK,5,USNT,an levi layed on a big spreed in his ain hoose fer jesus an thair wus a hale lock o tex men an tha laik thair roon tha table wi thaim,oniebodie lukkin at me haes saen tha faither,1
2311,LUK,5,USNT,but tha maisters o tha laa an tha pharisees wus mutterin tae tha follaers o jesus fer why ir ye aitin an drinkin wi tex men an sinners,but tha angel saed dinnae be feart fer am bringin yis tha best news iver an its fer tha hale warl tha saviour ay tha christ tha loard haes this nicht bin boarn in bethlehem tha toon o davit,1
2312,LUK,5,USNT,an jesus saed tae thaim fowk that ir hale an hairtie dinnae need a docter but seeck fowk dae a hinnae cum fer tae caa guid leevin fowk tae repentance but a hae cum tae caa sinners,an jesus wus praichin tha wurd tae thaim,1
2313,LUK,5,USNT,some fowk saed tae him jhones follaers ir aye fastin an prayin an sae dae tha follaers o tha pharisees but your yins is aye aitin an drinkin but jesus saed tae thaim ye cannae mak waddin guests fast while tha bridegruim is wi thaim,the gart hir tae stan in tha middle o tha getherin an the saed tae jesus taicher the catched this wumman here in tha verie ect o adulterie noo in oor laa moses bid iz tae stane sitch weemen tae deith,1
2314,LUK,5,USNT,thairll cum a day but whaniver tha bridegruim wull be tuk awa frae thaim an thatll be tha time the wull fast,but am tellin ye oniebodie thats even angrie wi his brither wioot onie caas is gaun tae be judged fer it,1
2315,LUK,5,USNT,he toul thaim anither parable naebodie taks a piece o claith frae a new coat tae patch an oul yin,if yer richt ee maks ye dae wrang hoke it oot an clod it awa,1
2316,LUK,5,USNT,if he daes tha new patch wull pu awa frae tha oul an forbye the wudnae match,an at dailygan the went oot o tha citie,1
2317,LUK,5,USNT,an naebodie pits new wine intae oul wineskins,this meent that jesus cudnae be saen gaun intae a toon he haed tae stay oot in tha kintrie,1
2318,LUK,5,USNT,fer if ye dae tha new wine wull brust tha oul skins tha wine wull spill oot an tha skins wull be ruint,heivens risin sin is jist aboot tae brek on iz oot o tha guidness o gods hairt giein licht tae thaim that sits in tha dairk shedda o deith an roadin iz intae tha pad o peace,1
2319,LUK,5,USNT,na ye hae tae pit new wine intae new skins then baith wull be aa richt,an thair wus naebodie barrin tha preeshts allooed tae dae this,1
2320,LUK,5,USNT,forbye naebodie efter haein drunk oul wine wud richt awa be lukkin new wine,thell no follae a stranger but na thell rin aff whan the hear a voice the dinnae ken,1
2321,LUK,5,USNT,fer he wud say tha oul wine is better,an he saed ye can onlie git rid o this kine bi prayer an fastin,1
2322,LUK,6,USNT,cum twa sabbaths efter this jesus wus gaun throu tha coarnfiels an his follaers pluckt tha heids aff tha coarn tae ait giein thaim a rub atween thair hans,efter this jesus tuk hissel doon wi his follaers tae capernaum alang wi his mither an brithers an the aa stapt thonner fer twarthie days,1
2323,LUK,6,USNT,an some o tha pharisees axt thaim hoo cum yis ir daein whuts agin tha laa on tha sabbath day,then the sput in his face an hut him wi thair fists,1
2324,LUK,6,USNT,jesus gien tha answer hae ye no read whut davit daen whaniver him an his freens wus hungrie,dinnae be tuk bak whaniver a tell ye yis maun be boarn agane,1
2325,LUK,6,USNT,hoo he gaed intae tha hoose o god an tuk an et tha halie showbreid an gien it tae thaim that wus wi him forbye,jesus gien tha answer hae ye no read whut davit daen whaniver him an his freens wus hungrie,1
2326,LUK,6,USNT,shair that wus agin tha laa fer oniebodie but tha preeshts an he saed tae thaim tha sinn o man is loard o tha sabbath anaa,but peter spauk oot agane een if a hae tae dee alang wi ye a wull niver deny ye an aa tha ither follaers vood tha same,1
2327,LUK,6,USNT,then on anither sabbath he gaed intae tha meetin hoose tae taich tha fowk an thair wus a man thair an his richt han wus wuthert,but hoo its cum aboot that he can see noo or wha apent his een we cannae tell ye,1
2328,LUK,6,USNT,tha maisters o tha laa an tha pharisees kep thair een on jesus tae see wud he hail on tha sabbath sae as tae hae sumthin agin him,a daen it masel tae show yis tae dae whut a hae daen fer you,1
2329,LUK,6,USNT,but he kent richt weel thair thochts an saed tae tha man wi tha baad han stan up whar the can aa see ye,dinnae tak alang onie gowld or siller ner een a copper in yer girthpooch tak nae baag fer tha road ner spare claes ner shune ner a stav fer tha warker is warth his keep,1
