,book,chapt,version,text,second,label
1093,MAT,26,USNT,shair a sut in tha hoose o god iverie day taichin an yis niver layed a han on me but this haes aa tuk place sae that whut wus writ bi tha proaphits micht cum aboot,this is tha yin tha scriptures taak aboot whan the say listen a wull senn oot ma messenger aheid o ye he wull mak readie tha wye afore ye,1
1094,MAT,26,USNT,then aa his follaers left him an run awa,whan jesus saa thannie cumin he saed this aboot him noo thairs a guid israelite thairs naethin fauss aboot him hoo is it ye ken me,1
1095,MAT,26,USNT,tha yins that haed liftit jesus tuk him awa tae caiaphas tha heich preesht whar tha maisters o tha laa an tha elders o tha fowk haed gethert thegither,an then yin o thaim bi tha name o caiaphas that wus heich preesht thon yeir spauk oot yis ken naethin ava ye dinnae unnerstan that it wud be fer tha best if yin man deed fer aa tha fowk ay faur better ner fer tha hale kintrie tae be wiped oot he didnae say this o his ain accoard but as heich preesht thon yeir he foretelt that jesus wud dee fer tha hale nation,1
1096,MAT,26,USNT,but peter follaed him a brave wye behin richt up tae tha coortyaird o tha heich preesht,forbye thair wus monie lepers in israel in tha time o elisha tha proaphit but nane o thaim wus makkit clain apairt frae naaman frae syria,1
1097,MAT,26,USNT,he went intae it an sut doon wi tha gairds tae see whut wud happen,a tell yis jist in tha same wye thair wull be mair joy in heiven ower yin wrangdaer that repents o his wrangdaein mair ner ower ninetienine that thinks the dinnae need tae repent,1
1098,MAT,26,USNT,noo tha heid preeshts an tha hale cooncil wus lukkin fer men that wud wutness agin jesus sae the cud pit him tae deith,sae jesus bid thaim aa sit doon in locks on tha green gress,1
1099,MAT,26,USNT,but the didnae fin onie wi stories that wud dae tha mair monie fauss wutnesses spauk oot,am tellin ye tha truith thaim at believes haes ayelastin life,1
1100,MAT,26,USNT,bye an bye twa steppit forrit sayin this fella saed a be able tae desthroy tha hoose o god an big it up agane in thrie days,whaniver he haes brocht oot aa his ain sheep he waaks aheid o thaim an his sheep follae him fer the ken his voice,1
1101,MAT,26,USNT,then tha heich preesht ris tae his feet an saed tae jesus hae ye nae answer tae these chairges,haein loved his ain that wus in tha warl noo he apent up tae thaim tha fu meesure o his love,1
1102,MAT,26,USNT,whut hae ye tae say fer yersel,but tha ithers saed jist lea him alane,1
1103,MAT,26,USNT,an tha heich preesht saed tae him a chairge ye unner oath bi tha leevin god tell iz if ye ir tha christ tha sinn o god,ye coofs hae ye no tha sense tae know that god made tha inside as weel as tha ootside,1
1104,MAT,26,USNT,its as ye say jesus answert,whaniver herod wus king o judea thair wus this preesht caad zechariah,1
1105,MAT,26,USNT,but am tellin yis aa that in a day tae cum yisll see tha sinn o man sittin at tha richt han o tha michtie yin an cumin on tha cloods o heiven,that made fowerteen generations in aa frae abraham tae davit fowerteen frae davit til the wur cairriet awa tae babylon an anither fowerteen frae that tae tha cumin o christ,1
1106,MAT,26,USNT,then tha heich preesht tore his claes an saed he haes spauk blesphemie whut dae we need onie mair wutnesses fer,simon saed maister whut hae ye tae tell me,1
1107,MAT,26,USNT,luk noo ye hae aa heerd his blesphemie fer yersels,some o thaim wull be killt bi tha sword ithersll be tuk awa an skailt amang aa tha nations o tha warl,1
1108,MAT,26,USNT,he desarves tae be put tae deith the answert,an aa this brocht aboot whut tha loard haed saed throu tha proaphit oot o egypt a hae caad ma sinn,1
1109,MAT,26,USNT,then the sput in his face an hut him wi thair fists,is a man no warth faur mair ner a sheep,1
1110,MAT,26,USNT,ithers hut him wi tha flet o thair hans an the saed weel messiah tell iz wha skelpt ye noo peter wus sittin oot in tha coortyaird an this wee sarvin lass cum up til him,ye cannae sarve baith god an gowld,1
1111,MAT,26,USNT,you wur wi jesus o galilee as weel she saed,the haed follaed jesus frae galilee fer tae luk efter him,1
1112,MAT,26,USNT,but he denied it afore thaim aa,blin fowk can see noo lameters can waak fowk wi leprosie ir makkit weel,1
1113,MAT,26,USNT,a dinnae ken whut yer taakin aboot qo he,he maks his sin tae rise on tha wickit as weel as on tha guid an he senns rain on thaim that daes whuts richt as weel as on tha yins that daesnae,1
1114,MAT,26,USNT,then he slipt oot tae tha gate whar anither lass saen him an saed tae tha fowk stannin roon this fella wus alang wi jesus o nazareth,or shud we be lukkin oot fer some ither bodie,1
1115,MAT,26,USNT,yinst mair he denied it an wi an oath a dinnae ken tha man efter a wee while tha yins that wur stannin thair went up tae peter an saed shairlie ye maun be yin o thaim fer tha wye ye taak gies ye awa,saed jesus til hir am him,1
1116,MAT,26,USNT,then he stairtit cursin an sweerin an sayin a dinnae ken tha man an at that verie minit a rooster craad,an the wur hairtscarred whan that happent,1
1117,MAT,26,USNT,then peter haed mine o tha wurds jesus haed spauk afore tha rooster craas yell deny me thrie times,but the didnae fin onie wi stories that wud dae tha mair monie fauss wutnesses spauk oot,1
1118,MAT,26,USNT,an he went oot o tha coortyaird greetin sair,maister the saed moses toul iz that if a man dees wioot leain onie weans his brither maun merrie tha weeda an hae childer fer him,1
1119,MAT,27,USNT,at tha scraich o day aa tha heid preeshts an tha elders o tha fowk collogued thegither as tae hoo the wud pit jesus tae deith,an hell repone a tell ye tha truith whutiver yis didnae dae fer yin o tha laist impoartin o these brithers o mine yis didnae dae it fer me,1
1120,MAT,27,USNT,sae the tyed him up the maircht him aff an the hannit him ower tae pilate tha guviner,in him wus life an this life wus tha licht o mankine,1
1121,MAT,27,USNT,noo judas that haed bethrayed him whaniver he saa that jesus wus condemned he sairlie rued whut hed daen an he gien tha thurtie siller coins bak tae tha heid preeshts an tha elders,but yous say that its aa richt fer a bodie tae tell his faither or mither whutiver halp ye wud hae got frae me a hae vood tae gie tae god an ye say he isnae obliged tae honour his parents wi it,1
1122,MAT,27,USNT,a hae daen wrang saed he fer a hae bethrayed tha bluid o an innocent man,an tha seed that fell amang tha thoarns thats laik fowk that hears tha wurd o god an the cairrie on fer a weethin but in tha enn aa tha warls bothers tha catter an tha guid times staps thaim growein up strecht an sonsie,1
1123,MAT,27,USNT,on yer ain heid be it sae judas throwed tha siller doon in tha hoose o god,tha warl haes nae cal tae hait yous,1
1124,MAT,27,USNT,then he gan oot o tha temple an he went an hung hissel,their tae cum on aheid tae tha waddin but agane the pyed nae heed an the gan aff tha yin tae his fairm an tha ither tae his bizness,1
1125,MAT,27,USNT,tha heid preeshts gethert up tha coins an saed it is agin tha laa tae pit this intae tha temple kist seein as its tha price o bluid,sae am tellin ye tak nae thocht fer yer life whut yell ait or whut yell drink ner yit aboot yer bodie whut claes yell pit on ye,1
1126,MAT,27,USNT,sae the agreed amang thairsels tae uise tha siller fer tae buy tha potters fiel as a buryin grun fer strangers,his maister saed ye hae daen weel ye guid an faithfu sarvint ye hae showed a can trust ye wi wee things sae all pit ye in chairge o a hale lock mair,1
1127,MAT,27,USNT,an thats tha raison tae this verie day its caad tha fiel o bluid,the cum tae ye lukkin laik hairmless sheep but on tha inside ther naethin but a paak o wolfs,1
1128,MAT,27,USNT,in this wye tha wurd spauk bi jeremiah tha proaphit cum aboot the tuk tha thurtie siller coins tha amoont pit on his heid bi israel an the uised thaim tae buy tha potters fiel jist as tha loard commaundit,jesus answert or haes ithers bin taakin til ye aboot me,1
1129,MAT,27,USNT,while aa this wus gaun on jesus stud afore tha guviner an tha guviner axt him ir you tha king o tha jews,maister the saed moses writ doon fer iz that if a mans brither dees an leas a guidwife wi nae weans then he maun merrie tha weeda an hae childer fer his deid brither,1
1130,MAT,27,USNT,jesus answert you hae saed it,but jesus saed tae thaim a proaphits niver weel thocht o in his hametoon amang his freens or in his ain hoose,1
1131,MAT,27,USNT,but whaniver he wus accused bi tha heid preeshts an tha elders he gien nae answer ava,listen here wae faa ye pharisees ye gie a tenth o yer gairden spices sitch as mint an rue but ye hae neglectit justice an ye dinnae love god,1
1132,MAT,27,USNT,then pilate axt him dae ye no hear whut ther chairgin ye wi,but he saed tae thaim a maun praich tha guid news o tha kingdom o god tae tha ither toons as weel fer thats why a wus sent,1
1133,MAT,27,USNT,but jesus niver saed a wurd bak tae him regairdin onie o tha chairges agin him an tha guviner wus stoondit,strecht awa tha sarvint that got tha five baags begun tae put his siller tae wark an he got bak five mair,1
1134,MAT,27,USNT,noo it uist tae be at tha passower faist tha guviner wud aye let a prisner oot o jail whutiver yin tha fowk axt fer,then tha pharisees gaed oot an collogued thegither as tae hoo the cud ketch jesus oot in sumthin he wud say,1
1135,MAT,27,USNT,an that year the haed a prisner iveriebodie haed heerd tell o bi tha name o barabbas,an tha fairmers sarvin men cum up tae him,1
1136,MAT,27,USNT,sae whaniver tha crood haed gethert thegither pilate axt thaim whutch yin dae yis want me tae let oot tae ye barabbas or jesus that is caad christ,she wud hae killt him but she cudnae get at him,1
1137,MAT,27,USNT,fer he knowed richt weel it wus jist oot o spite the haed hannit jesus ower tae him,an the tuk jesus awa tae tha heich preesht an aa tha heid preeshts tha elders o tha fowk an tha maisters o tha laa wus gethert thegither,1
1138,MAT,27,USNT,noo as pilate wus sittin on tha judges sait his wife sent him this message hae naethin tae dae wi thon innocent man fer am tellin ye am sair tormentit this day bi a draim a haed aboot him but tha heid preeshts an tha elders taakt tha crood roon sae as the wud ax fer barabbas an hae jesus put tae deith,a man aa rigged oot in fancie claes,1
1139,MAT,27,USNT,whutch o tha twa dae yis want me tae let oot tae yis then,noo whaniver tha sodgers haed nailt him tae tha cross the gemmelt amang thairsels tae divide his claes,1
1140,MAT,27,USNT,sae whut am a tae dae wi jesus thats caad tha christ,thats tha raison his mither an faither saed hes oul eneuch ax him yersels,1
1141,MAT,27,USNT,an the aa saed bak tae tha cross wi him but whut fer,whaniver the fun him on tha ither side o tha loch the axt him rabbi whan did ye get here,1
1142,MAT,27,USNT,but tha thrang jist roared aa tha mair tae tha cross wi him whaniver pilate saen that he wus gettin naewhar but that he wus aboot tae hae a riot on his hans he got some watter an waasht his hans afore tha crood o fowk,whan tha evenin wus weel on jesus wus at tha boord alang wi tha twal,1
1143,MAT,27,USNT,am no guiltie o this mans bluid saed he,dae a no hae tha richt tae dae whut a laik wi ma ain siller,1
1144,MAT,27,USNT,on your heids be it aa tha fowk saed let his bluid be on us an on oor childer then he lut barabbas oot tae thaim,an he saed since he wus a wean,1
1145,MAT,27,USNT,but he got jesus whuppt an he hannit him ower fer tae be crucyfied,an jesus saed tae thaim it wus becas yer hairts wus haird that moses gien ye this laa,1
1146,MAT,27,USNT,then tha guviners sodgers tuk jesus intae tha praetorium an the gethert tha hale regiment roon him,sae noo we can sarve him wioot bein feart o thaim thats wantin tae hairm iz wi us bein halie an in guid stannin in tha ee o tha loard as lang as we leeve,1
1147,MAT,27,USNT,the stript him an put a scarlet robe on him an then the plettit thoarns thegither tae mak a croon an the set it on his heid,nicodemus brocht wi him a mix o myrrh an aloes aboot seiventiefive pun wecht,1
1148,MAT,27,USNT,the put a stav in his richt han an the got doon on thair knees afore him mockin him an sayin lang leeve tha king o tha jews the sput on him an the tuk tha stav an hut him ower tha heid agane an agane,whan tha fowk listenin tae jesus heerd this the saed this shud niver cum aboot but jesus lukt at thaim strecht in tha ee an axt whut then is tha mainin o this scripture tha verie stane tha masons turnt doon is noo tha coarner stane,1
1149,MAT,27,USNT,an efter the haed daen mockin him the tuk tha robe aff him an the put his ain claes bak on him,or whut ir ye daein taakin tae hir,1
1150,MAT,27,USNT,then the tuk him awa fer tae crucyfie him,thell be laik tha angels an the cannae dee the ir childer o god an childer o tha risin frae tha deid,1
1151,MAT,27,USNT,an whaniver the wur on thair wye oot the run intae a man frae cyrene bi tha name o simon an the gart him tae cairrie tha cross,sae aff a went an waasht an efter that a cud see whars thon man at noo,1
1152,MAT,27,USNT,the cum tae a place caad golgotha mainin tha place o tha skull,an god daesnae ferget onie o thaim,1
1153,MAT,27,USNT,thair the raxt wine up tae jesus mixt wi gall but efter tastin it he wudnae drink onie mair,she faad doon on hir knees afore jesus an plaidit wi him tae drive tha ill spirit oot frae hir dochter,1
1154,MAT,27,USNT,noo whaniver tha sodgers haed nailt him tae tha cross the gemmelt amang thairsels tae divide his claes,if a man haes a hunner sheep an yin o thaim wanners wull he no lea tha ninetienine on tha hills an gae tae luk fer tha yin that wannert aff,1
1155,MAT,27,USNT,this brocht aboot whut tha proaphit saed wud happen the divid ma dishables amang thaim an the cloddit dice fer ma claes an sittin doon the kep watch ower him thair,then simeon gien thaim a blissin an toul mary tha mither tae tak heed o this tha wean wull hae a pooerfu effect on monie a bodie in israel,1
1156,MAT,27,USNT,abain his heid the put up tha chairge agin him that saed this is jesus tha king o tha jews,an whaiver haes little or naethin even tha wee bit he haes wull be taen awa frae him noo jist cast that guid fer naethin sarvint oot intae tha dairk whar thair wull be greetin an scringein o teeth,1
1157,MAT,27,USNT,twa robbers wur crucyfied alang wi him yin on his richt han side an tha tither on his left,an tha guid news is praicht tae tha puir,1
1158,MAT,27,USNT,thaim at waakt bye yellt abuse at him shakin thair heids an sayin hey you that saed ye wur gaun tae desthroy tha hoose o god an big it agane in thrie days save yersel if you ir tha sinn o god cum doon aff that cross an tha heid preeshts tha maisters o tha laa an tha elders the daen tha same an the mockt him,richt awa he cud see agane an he follaed jesus giein glorie tae god,1
1159,MAT,27,USNT,he saved ithers the saed but he cannae save hissel is he no tha king o israel,yis ir tae stairt frae jerusalem,1
1160,MAT,27,USNT,then jist let him cum doon aff tha cross an well believe in him he trusts in god,did a no cure ten men,1
1161,MAT,27,USNT,let god rescue him noo if he wants him fer he saed a be tha sinn o god,tha jews that wus thair in tha hoose tae offer mary sorra fer hir trouble whaniver the saa tha quick she got up an went oot up they got as weel an went oot efter hir jalousin she wus awa tae tha tomb tae greet thonner,1
1162,MAT,27,USNT,tha robbers that wur crucyfied wi him hurlt abuse at him as weel,then the apent thair kists an the set afore him thair gifts o gowld an frankincense an myrrh,1
1163,MAT,27,USNT,frae nuin tae thrie in tha efternuin dairkness cum ower tha hale lan,an jesus saed bak tae him gang yer wye yer faith haes made ye hale an al at yinst he wus able tae see agane an he went aff doon tha road efter jesus,1
1164,MAT,27,USNT,an roon aboot thrie jesus caad oot wi a lood voice eli eli lama sabachthani,but tak heed a hae toul ye aa this aheid o time sae as yell know,1
1165,MAT,27,USNT, that mains o god ma god why hae ye forsook me,wi aa that thair wus monies a yin did believe in him even amang tha heidyins,1
1166,MAT,27,USNT,whaniver some o thaim stannin bye heerd this the saed hes caain oot fer elijah,but herod saed a haed tha heid tuk aff jhone,1
1167,MAT,27,USNT,an richt awa yin o thaim run an got a sponge,fer thon day wull cum on iveriebodie leevin in tha hale warl,1
1168,MAT,27,USNT,he fillt it wi soor wine put it on a lang stick an raxt it up tae jesus fer him tae drink,as gods ma wutness saed peter a sweer a dinnae ken this man at that verie minnit tha rooster craad tha saicont time,1
1169,MAT,27,USNT,but tha ithers saed jist lea him alane,ay richt eneuch the saed thats jist whut jesus toul iz wud happen,1
1170,MAT,27,USNT,well see noo if elijah cums fer tae save him,at yinst jesus raxt oot his han an gript him,1
1171,MAT,27,USNT,then jesus cryed oot agane wi a lood voice an he gien up his spirit,whut wus he taakin aboot whan he saed yell luk fer me but yell no fin me an whar a be ye cannae cum,1
1172,MAT,27,USNT,at that verie minit tha curtin in tha halie o halies wus tore in twa frae tap tae bottom,an hell gether monie an israelite bak tae tha loard thair god,1
1173,MAT,27,USNT,tha irth shuk an tha roaks split,yin time whaniver tha pharisees axt jesus whan gods kingdom wud cum he toul thaim yis cannae say here it is or thair it is tha kingdom o god is aareadie here amang yis sae thairs nae use lukkin fer it cumin an he saed tae his follaers tha day wull cum whan yisll want tae see tha sinn o man,1
1174,MAT,27,USNT,tha graves apent an tha bodies o monie halie fowk that haed deed wur ris tae life,sae ocht a say is jist whut tha faither haes bid me say,1
1175,MAT,27,USNT,the cum oot o thair tombs an efter jesus wus ris frae tha deid the went intae tha halie citie an appeart tae a lock o fowk,then jesus turnt tae tha yin that haed gien him tha invite an saed whan ye gie a denner or a pairtie dinnae be caain yer freens or yer brithers yer femlie or yer weelaff nighbers acause the wull onlie pye ye bak bi invitin ye in return,1
1176,MAT,27,USNT,tha centurion an thaim alang wi him that wus gairdin jesus whaniver the saa tha irthquake an aa that haed happent the wur hairtscarred an the saed thair can be nae doot this wus tha sinn o god noo monie weemen wur thair as weel stannin awa bak takkin it aa in,an whaniver a hae got a place readie fer ye all cum an tak yis bak alang wi me sae that whar a be well aa be thegither,1
1177,MAT,27,USNT,the haed follaed jesus frae galilee fer tae luk efter him,an the axt him maister whans aa this fer happenin then,1
1178,MAT,27,USNT,in amang thaim thair wus mary magdalene an mary tha mither o jeames an joses an thair wus tha mither o zebedees sinns,an the aa saed sae ye ir tha sinn o god then,1
1179,MAT,27,USNT,whan it cum evenin thair wus this weelaff man frae arimathea bi tha name o joseph wha hissel haed becum a follaer o jesus,yis hinnae uised it yersels an yis hae kep ither fowk frae uisin it as weel,1
1180,MAT,27,USNT,an he gan tae pilate an he axt fer tha bodie o jesus an pilate oardert thaim tae gie it tae him,ma faither that yous mak oot is your god hes tha yin at gies me tha glorie,1
1181,MAT,27,USNT,joseph tuk tha bodie an he lapt it in a clain linen claith an he layed it in his ain new tomb he haed cut oot o tha roak,an yell hae tae shift tae tha bak o tha ruim but whan ye get an invite gang an sit doon at tha bak an whan tha yin that invitit ye sees ye he wull say freen whut ir ye daein awa bak thair,1
1182,MAT,27,USNT,he rowlt a big stane agin tha mooth o tha tomb an then he gaed awa,but yous say that its aa richt fer a bodie tae say tae his faither or mither a cannae gie yis onie halp becas a hae vood tae gie whut a hae tae god,1
1183,MAT,27,USNT,mary magdalene an tha ither mary wur sittin thair fornent tha tomb,but if a did judge ye wud fin ma judgemens wud be richt,1
1184,MAT,27,USNT,tha nixt day tha yin efter tha day o preparation tha heid preeshts an tha pharisees went tae pilate,then he gaed up tha side o tha muntin an sut doon,1
1185,MAT,27,USNT,sir the saed whaniver that deceiver wus still leevin we mine him sayin efter thrie days a wull rise agane,ay loard qo he ye ken that a love ye,1
1186,MAT,27,USNT,sae wud ye gie tha oarder fer thaim tae shut that tomb weel tae tha thurd day less his follaers cum an steal tha bodie an tell tha fowk he haes ris frae tha deid,an sae haein lukt intae it aa masel richt frae whaniver tha hale storie begun a thocht it wud be a guid thing fer me tae pit doon a trig accoont fer ye forbye theophilus tae mak ye shair o tha truith o whut ye hae bin lairnt,1
1187,MAT,27,USNT,then that deception wud be waur ner tha furst,cum on an see he answert,1
1188,MAT,27,USNT,tak gairds wi ye saed pilate,save yersel an iz forbye but tha ither yin gien aff tae him an axt him dae ye no fear god seein as ye ir condemned tae dee as weel,1
1189,MAT,27,USNT,awa an shut up tha tomb as weel as ye can,tha croods that gan aheid o him an thaim that follaed behin cryed oot hosanna tae tha sinn o davit blisst be tha yin that cums in tha name o tha loard hosanna in tha heichest heiven whaniver jesus went intae jerusalem tha hale citie wus in a stir an the axt wha wud this man be,1
1190,MAT,27,USNT,sae the gaed an made tha tomb safe bi sealin tha stane an leain tha gaird tae keep watch,jhone heerd aboot aa this frae his follaers,1
1191,MAT,28,USNT,it wus efter tha sabbath at daylicht on tha furst day o tha week an mary magdalene an tha ither mary cum tae luk at tha tomb,yis ken whar am gaun an yis ken tha road tae whar am gaun,1
1192,MAT,28,USNT,aa o a suddent thair wus a michtie irthquake fer an angel o tha loard cum doon frae heiven he gaed tae tha tomb an he rowlt bak tha stane an he sut on it,an yit ithers thocht he maun be a proaphit laik yin o tha proaphits o tha oulden days,1
1193,MAT,28,USNT,he wus bricht as lichtnin an his claes wus white as snaa,yer ee is tha lamp o yer bodie an if yer ee is guid yer hale bodie is fu o licht but whan yer ee is baad yer hale bodies fu o dairkness,1
1194,MAT,28,USNT,whaniver the saa him tha gairds at tha tomb shuk wi fear an the becum laik deid men,fer less a gang awa tha halie guide wull no cum til yis but if a gang a wull senn him tae ye,1
1195,MAT,28,USNT,but tha angel saed tae tha weemen dinnae be feart fer a ken that yer lukkin fer jesus that wus crucyfied,an it wus bi tha halie spirit,1
1196,MAT,28,USNT,hes no here hes ris jist as he saed he wud,thair wus this man saed jesus that wud hae lent siller tae fowk,1
1197,MAT,28,USNT,cum an see tha place whar he wus layed oot,na a tell ye this if yis dinnae repent tha hale lock o ye wull perish forbye,1
1198,MAT,28,USNT,quick gae an tell his follaers he haes ris frae tha deid an hes awa on aheid o ye intae galilee,noo thair wus this man in jerusalem caad simeon that wus a guid godfearin man fu o tha halie spirit an lukkin forrit tae tha cumin o tha messiah acause tha halie spirit haed toul him that he wudnae dee afore he haed saen christ tha loard,1
1199,MAT,28,USNT,noo mine whut a hae toul ye,listen here wae faa ye pharisees ye gie a tenth o yer gairden spices sitch as mint an rue but ye hae neglectit justice an ye dinnae love god,1
1200,MAT,28,USNT,sae tha weemen hurriet frae tha tomb the wur afeart yit fu o joy,an hail tha seeck fowk thair an say tae thaim tha kingdom o god haes cum nearhan ye,1
1201,MAT,28,USNT,the run tae tell his follaers whan aa o a suddent jesus appeart fornent thaim,on accoont o that tha yin that hannit me ower tae ye is guiltie o a bigger sin,1
1202,MAT,28,USNT,an the went tae him tuk houl o his feet an wurshipt him,a didnae unnerstan masel wha he wus but it wus tae mak him kent tae israel that a cum baptisin wi watter,1
1203,MAT,28,USNT,then jesus saed tae thaim dinnae be feart,he deed an sae did tha proaphits,1
1204,MAT,28,USNT,gae an tell ma brithers tae gae intae galilee an thell see me thair,but whaniver tha sinn o man cums bak a wunner wull he fin oniebodie wi faith on tha irth,1
1205,MAT,28,USNT,while tha weemen wur on thair wye some o tha gairds went intae tha citie an toul tha heid preeshts aa that haed cum aboot,set thaim apairt an keep thaim halie bi tha truith your wurd is truith,1
1206,MAT,28,USNT,an whaniver tha heid preeshts haed gethert thegither wi tha elders the collogued amang thairsels an the gien tha sodgers a big amoont o siller an the toul thaim yer tae say tha follaers o jesus cum in tha nicht an stole him awa whan we wur sleepin,whan it wus daylicht he depairtit an went tae a place he cud be on his ain,1
1207,MAT,28,USNT,if tha guviner hears tell o this well taak him roon an keep ye oot o bother,thisll be yer chaunce tae wutness tae yin an aa,1
1208,MAT,28,USNT,sae tha sodgers tuk tha siller an daen as the wur toul,sae davit caas tha messiah ma loard,1
1209,MAT,28,USNT,an this storie haes gan roon amang tha jews tae this verie day,a hae toul yis thae things while am still here amang yis,1
1210,MAT,28,USNT,then tha eleiven follaers gaed tae galilee tae tha muntin whar jesus haed toul thaim,an thair wus ither yins alang wi thaim an the fun tha stane rowlt awa frae tha tomb,1
1211,MAT,28,USNT,whaniver the saen him the wurshipt him but some aye haed thair doots,he saed tae thaim hoo cum yis ir thinkin laik this,1
1212,MAT,28,USNT,then jesus cum tae thaim an saed aa thortie haes bin gien tae me in heiven an on irth,fer jist laik tha faither haes tha pooer o life in hissel sae he haes gien tha sinn tha pooer o life tae,1
1213,MAT,28,USNT,sae gang an mak follaers o aa nations baptisin thaim in tha name o tha faither an o tha sinn an o tha halie spirit taichin thaim tae keep aa tha commauns a hae gien ye,dinnae be laik thaim fer yer faither kens whut ye hae need o afore ye ax him,1
1214,MAT,28,USNT,an know this a be wi ye iverie day ay tae tha verie enn o time,sae dinnae fash yersels aboot themorra fer themorra wull luk efter itsel,1
